{"session": "session_0", "metric": "perf_score", "unit": "points", "direction": "higher", "run": 1, "value": 81.97, "status": "keep", "description": "run 0 experiment", "timestamp": "2024-01-10T09:00:00Z"}
{"session": "session_0", "metric": "perf_score", "unit": "points", "direction": "higher", "run": 2, "value": 87.08, "status": "keep", "description": "run 1 experiment", "timestamp": "2024-02-10T09:00:00Z"}
{"session": "session_0", "metric": "perf_score", "unit": "points", "direction": "higher", "run": 3, "value": 61.16, "status": "keep", "description": "run 2 experiment", "timestamp": "2024-03-10T09:00:00Z"}
{"session": "session_0", "metric": "perf_score", "unit": "points", "direction": "higher", "run": 4, "value": 83.83, "status": "crash", "description": "run 3 experiment", "timestamp": "2024-04-10T09:00:00Z"}
{"session": "session_0", "metric": "perf_score", "unit": "points", "direction": "higher", "run": 5, "value": 54.35, "status": "discard", "description": "run 4 experiment", "timestamp": "2024-05-10T09:00:00Z"}
{"session": "session_0", "metric": "perf_score", "unit": "points", "direction": "higher", "run": 6, "value": 51.59, "status": "keep", "description": "run 5 experiment", "timestamp": "2024-06-10T09:00:00Z"}
{"session": "session_0", "metric": "perf_score", "unit": "points", "direction": "higher", "run": 7, "value": 60.93, "status": "crash", "description": "run 6 experiment", "timestamp": "2024-07-10T09:00:00Z"}
{"session": "session_0", "metric": "perf_score", "unit": "points", "direction": "higher", "run": 8, "value": 80.1, "status": "crash", "description": "run 7 experiment", "timestamp": "2024-08-10T09:00:00Z"}
{"session": "session_0", "metric": "perf_score", "unit": "points", "direction": "higher", "run": 9, "value": 59.94, "status": "crash", "description": "run 8 experiment", "timestamp": "2024-09-10T09:00:00Z"}
{"session": "session_0", "metric": "perf_score", "unit": "points", "direction": "higher", "run": 10, "value": 70.98, "status": "discard", "description": "run 9 experiment", "timestamp": "2024-01-10T09:00:00Z"}
{"session": "session_0", "metric": "perf_score", "unit": "points", "direction": "higher", "run": 11, "value": 79.46, "status": "keep", "description": "run 10 experiment", "timestamp": "2024-02-10T09:00:00Z"}
{"session": "session_0", "metric": "perf_score", "unit": "points", "direction": "higher", "run": 12, "value": 87.94, "status": "keep", "description": "run 11 experiment", "timestamp": "2024-03-10T09:00:00Z"}
{"session": "session_0", "metric": "perf_score", "unit": "points", "direction": "higher", "run": 13, "value": 84.91, "status": "keep", "description": "run 12 experiment", "timestamp": "2024-04-10T09:00:00Z"}
{"session": "session_0", "metric": "perf_score", "unit": "points", "direction": "higher", "run": 14, "value": 63.89, "status": "keep", "description": "run 13 experiment", "timestamp": "2024-05-10T09:00:00Z"}
{"session": "session_0", "metric": "perf_score", "unit": "points", "direction": "higher", "run": 15, "value": 97.86, "status": "keep", "description": "run 14 experiment", "timestamp": "2024-06-10T09:00:00Z"}
{"session": "session_0", "metric": "perf_score", "unit": "points", "direction": "higher", "run": 16, "value": 55.11, "status": "discard", "description": "run 15 experiment", "timestamp": "2024-07-10T09:00:00Z"}
{"session": "session_0", "metric": "perf_score", "unit": "points", "direction": "higher", "run": 17, "value": 54.84, "status": "keep", "description": "run 16 experiment", "timestamp": "2024-08-10T09:00:00Z"}
{"session": "session_0", "metric": "perf_score", "unit": "points", "direction": "higher", "run": 18, "value": 80.19, "status": "keep", "description": "run 17 experiment", "timestamp": "2024-09-10T09:00:00Z"}
{"session": "session_0", "metric": "perf_score", "unit": "points", "direction": "higher", "run": 19, "value": 86.49, "status": "crash", "description": "run 18 experiment", "timestamp": "2024-01-10T09:00:00Z"}
{"session": "session_0", "metric": "perf_score", "unit": "points", "direction": "higher", "run": 20, "value": 56.24, "status": "discard", "description": "run 19 experiment", "timestamp": "2024-02-10T09:00:00Z"}
{"session": "session_0", "metric": "perf_score", "unit": "points", "direction": "higher", "run": 21, "value": 53.94, "status": "keep", "description": "run 20 experiment", "timestamp": "2024-03-10T09:00:00Z"}
{"session": "session_0", "metric": "perf_score", "unit": "points", "direction": "higher", "run": 22, "value": 91.47, "status": "crash", "description": "run 21 experiment", "timestamp": "2024-04-10T09:00:00Z"}
{"session": "session_0", "metric": "perf_score", "unit": "points", "direction": "higher", "run": 23, "value": 94.27, "status": "keep", "description": "run 22 experiment", "timestamp": "2024-05-10T09:00:00Z"}
{"session": "session_0", "metric": "perf_score", "unit": "points", "direction": "higher", "run": 24, "value": 78.87, "status": "keep", "description": "run 23 experiment", "timestamp": "2024-06-10T09:00:00Z"}
{"session": "session_0", "metric": "perf_score", "unit": "points", "direction": "higher", "run": 25, "value": 52.29, "status": "keep", "description": "run 24 experiment", "timestamp": "2024-07-10T09:00:00Z"}
{"session": "session_0", "metric": "perf_score", "unit": "points", "direction": "higher", "run": 26, "value": 88.65, "status": "keep", "description": "run 25 experiment", "timestamp": "2024-08-10T09:00:00Z"}
{"session": "session_0", "metric": "perf_score", "unit": "points", "direction": "higher", "run": 27, "value": 92.77, "status": "keep", "description": "run 26 experiment", "timestamp": "2024-09-10T09:00:00Z"}
{"session": "session_0", "metric": "perf_score", "unit": "points", "direction": "higher", "run": 28, "value": 69.01, "status": "discard", "description": "run 27 experiment", "timestamp": "2024-01-10T09:00:00Z"}
{"session": "session_0", "metric": "perf_score", "unit": "points", "direction": "higher", "run": 29, "value": 81.78, "status": "keep", "description": "run 28 experiment", "timestamp": "2024-02-10T09:00:00Z"}
{"session": "session_0", "metric": "perf_score", "unit": "points", "direction": "higher", "run": 30, "value": 58.13, "status": "keep", "description": "run 29 experiment", "timestamp": "2024-03-10T09:00:00Z"}
{"session": "session_0", "metric": "perf_score", "unit": "points", "direction": "higher", "run": 31, "value": 60.48, "status": "keep", "description": "run 30 experiment", "timestamp": "2024-04-10T09:00:00Z"}
{"session": "session_0", "metric": "perf_score", "unit": "points", "direction": "higher", "run": 32, "value": 85.09, "status": "keep", "description": "run 31 experiment", "timestamp": "2024-05-10T09:00:00Z"}
{"session": "session_0", "metric": "perf_score", "unit": "points", "direction": "higher", "run": 33, "value": 80.46, "status": "keep", "description": "run 32 experiment", "timestamp": "2024-06-10T09:00:00Z"}
{"session": "session_0", "metric": "perf_score", "unit": "points", "direction": "higher", "run": 34, "value": 76.71, "status": "keep", "description": "run 33 experiment", "timestamp": "2024-07-10T09:00:00Z"}
{"session": "session_0", "metric": "perf_score", "unit": "points", "direction": "higher", "run": 35, "value": 58.17, "status": "discard", "description": "run 34 experiment", "timestamp": "2024-08-10T09:00:00Z"}
{"session": "session_0", "metric": "perf_score", "unit": "points", "direction": "higher", "run": 36, "value": 63.5, "status": "crash", "description": "run 35 experiment", "timestamp": "2024-09-10T09:00:00Z"}
{"session": "session_0", "metric": "perf_score", "unit": "points", "direction": "higher", "run": 37, "value": 60.98, "status": "keep", "description": "run 36 experiment", "timestamp": "2024-01-10T09:00:00Z"}
{"session": "session_0", "metric": "perf_score", "unit": "points", "direction": "higher", "run": 38, "value": 92.14, "status": "keep", "description": "run 37 experiment", "timestamp": "2024-02-10T09:00:00Z"}
{"session": "session_0", "metric": "perf_score", "unit": "points", "direction": "higher", "run": 39, "value": 61.45, "status": "keep", "description": "run 38 experiment", "timestamp": "2024-03-10T09:00:00Z"}
{"session": "session_0", "metric": "perf_score", "unit": "points", "direction": "higher", "run": 40, "value": 90.25, "status": "discard", "description": "run 39 experiment", "timestamp": "2024-04-10T09:00:00Z"}
{"session": "session_0", "metric": "perf_score", "unit": "points", "direction": "higher", "run": 41, "value": 63.39, "status": "keep", "description": "run 40 experiment", "timestamp": "2024-05-10T09:00:00Z"}
{"session": "session_0", "metric": "perf_score", "unit": "points", "direction": "higher", "run": 42, "value": 95.66, "status": "crash", "description": "run 41 experiment", "timestamp": "2024-06-10T09:00:00Z"}
{"session": "session_0", "metric": "perf_score", "unit": "points", "direction": "higher", "run": 43, "value": 93.82, "status": "keep", "description": "run 42 experiment", "timestamp": "2024-07-10T09:00:00Z"}
{"session": "session_0", "metric": "perf_score", "unit": "points", "direction": "higher", "run": 44, "value": 60.63, "status": "discard", "description": "run 43 experiment", "timestamp": "2024-08-10T09:00:00Z"}
{"session": "session_0", "metric": "perf_score", "unit": "points", "direction": "higher", "run": 45, "value": 69.78, "status": "discard", "description": "run 44 experiment", "timestamp": "2024-09-10T09:00:00Z"}
{"session": "session_0", "metric": "perf_score", "unit": "points", "direction": "higher", "run": 46, "value": 57.14, "status": "keep", "description": "run 45 experiment", "timestamp": "2024-01-10T09:00:00Z"}
{"session": "session_0", "metric": "perf_score", "unit": "points", "direction": "higher", "run": 47, "value": 62.33, "status": "crash", "description": "run 46 experiment", "timestamp": "2024-02-10T09:00:00Z"}
{"session": "session_0", "metric": "perf_score", "unit": "points", "direction": "higher", "run": 48, "value": 76.95, "status": "crash", "description": "run 47 experiment", "timestamp": "2024-03-10T09:00:00Z"}
{"session": "session_0", "metric": "perf_score", "unit": "points", "direction": "higher", "run": 49, "value": 71.42, "status": "crash", "description": "run 48 experiment", "timestamp": "2024-04-10T09:00:00Z"}
{"session": "session_0", "metric": "perf_score", "unit": "points", "direction": "higher", "run": 50, "value": 69.97, "status": "keep", "description": "run 49 experiment", "timestamp": "2024-05-10T09:00:00Z"}
{"session": "session_0", "metric": "perf_score", "unit": "points", "direction": "higher", "run": 51, "value": 99.87, "status": "keep", "description": "run 50 experiment", "timestamp": "2024-06-10T09:00:00Z"}
{"session": "session_0", "metric": "perf_score", "unit": "points", "direction": "higher", "run": 52, "value": 75.48, "status": "keep", "description": "run 51 experiment", "timestamp": "2024-07-10T09:00:00Z"}
{"session": "session_0", "metric": "perf_score", "unit": "points", "direction": "higher", "run": 53, "value": 87.79, "status": "keep", "description": "run 52 experiment", "timestamp": "2024-08-10T09:00:00Z"}
{"session": "session_0", "metric": "perf_score", "unit": "points", "direction": "higher", "run": 54, "value": 57.64, "status": "keep", "description": "run 53 experiment", "timestamp": "2024-09-10T09:00:00Z"}
{"session": "session_0", "metric": "perf_score", "unit": "points", "direction": "higher", "run": 55, "value": 89.6, "status": "discard", "description": "run 54 experiment", "timestamp": "2024-01-10T09:00:00Z"}
{"session": "session_0", "metric": "perf_score", "unit": "points", "direction": "higher", "run": 56, "value": 79.82, "status": "discard", "description": "run 55 experiment", "timestamp": "2024-02-10T09:00:00Z"}
{"session": "session_0", "metric": "perf_score", "unit": "points", "direction": "higher", "run": 57, "value": 69.08, "status": "discard", "description": "run 56 experiment", "timestamp": "2024-03-10T09:00:00Z"}
{"session": "session_0", "metric": "perf_score", "unit": "points", "direction": "higher", "run": 58, "value": 76.46, "status": "crash", "description": "run 57 experiment", "timestamp": "2024-04-10T09:00:00Z"}
{"session": "session_0", "metric": "perf_score", "unit": "points", "direction": "higher", "run": 59, "value": 93.04, "status": "keep", "description": "run 58 experiment", "timestamp": "2024-05-10T09:00:00Z"}
{"session": "session_0", "metric": "perf_score", "unit": "points", "direction": "higher", "run": 60, "value": 84.01, "status": "keep", "description": "run 59 experiment", "timestamp": "2024-06-10T09:00:00Z"}
{"session": "session_0", "metric": "perf_score", "unit": "points", "direction": "higher", "run": 61, "value": 84.09, "status": "crash", "description": "run 60 experiment", "timestamp": "2024-07-10T09:00:00Z"}
{"session": "session_0", "metric": "perf_score", "unit": "points", "direction": "higher", "run": 62, "value": 87.54, "status": "keep", "description": "run 61 experiment", "timestamp": "2024-08-10T09:00:00Z"}
{"session": "session_0", "metric": "perf_score", "unit": "points", "direction": "higher", "run": 63, "value": 55.58, "status": "discard", "description": "run 62 experiment", "timestamp": "2024-09-10T09:00:00Z"}
{"session": "session_0", "metric": "perf_score", "unit": "points", "direction": "higher", "run": 64, "value": 57.91, "status": "keep", "description": "run 63 experiment", "timestamp": "2024-01-10T09:00:00Z"}
{"session": "session_0", "metric": "perf_score", "unit": "points", "direction": "higher", "run": 65, "value": 97.69, "status": "keep", "description": "run 64 experiment", "timestamp": "2024-02-10T09:00:00Z"}
{"session": "session_0", "metric": "perf_score", "unit": "points", "direction": "higher", "run": 66, "value": 98.59, "status": "keep", "description": "run 65 experiment", "timestamp": "2024-03-10T09:00:00Z"}
{"session": "session_0", "metric": "perf_score", "unit": "points", "direction": "higher", "run": 67, "value": 75.38, "status": "keep", "description": "run 66 experiment", "timestamp": "2024-04-10T09:00:00Z"}
{"session": "session_0", "metric": "perf_score", "unit": "points", "direction": "higher", "run": 68, "value": 93.53, "status": "keep", "description": "run 67 experiment", "timestamp": "2024-05-10T09:00:00Z"}
{"session": "session_0", "metric": "perf_score", "unit": "points", "direction": "higher", "run": 69, "value": 92.08, "status": "crash", "description": "run 68 experiment", "timestamp": "2024-06-10T09:00:00Z"}
{"session": "session_0", "metric": "perf_score", "unit": "points", "direction": "higher", "run": 70, "value": 80.45, "status": "keep", "description": "run 69 experiment", "timestamp": "2024-07-10T09:00:00Z"}
{"session": "session_0", "metric": "perf_score", "unit": "points", "direction": "higher", "run": 71, "value": 68.7, "status": "keep", "description": "run 70 experiment", "timestamp": "2024-08-10T09:00:00Z"}
{"session": "session_0", "metric": "perf_score", "unit": "points", "direction": "higher", "run": 72, "value": 76.97, "status": "crash", "description": "run 71 experiment", "timestamp": "2024-09-10T09:00:00Z"}
{"session": "session_0", "metric": "perf_score", "unit": "points", "direction": "higher", "run": 73, "value": 95.92, "status": "crash", "description": "run 72 experiment", "timestamp": "2024-01-10T09:00:00Z"}
{"session": "session_0", "metric": "perf_score", "unit": "points", "direction": "higher", "run": 74, "value": 66.21, "status": "keep", "description": "run 73 experiment", "timestamp": "2024-02-10T09:00:00Z"}
{"session": "session_0", "metric": "perf_score", "unit": "points", "direction": "higher", "run": 75, "value": 55.59, "status": "keep", "description": "run 74 experiment", "timestamp": "2024-03-10T09:00:00Z"}
{"session": "session_0", "metric": "perf_score", "unit": "points", "direction": "higher", "run": 76, "value": 93.94, "status": "keep", "description": "run 75 experiment", "timestamp": "2024-04-10T09:00:00Z"}
{"session": "session_0", "metric": "perf_score", "unit": "points", "direction": "higher", "run": 77, "value": 61.97, "status": "keep", "description": "run 76 experiment", "timestamp": "2024-05-10T09:00:00Z"}
{"session": "session_0", "metric": "perf_score", "unit": "points", "direction": "higher", "run": 78, "value": 93.9, "status": "keep", "description": "run 77 experiment", "timestamp": "2024-06-10T09:00:00Z"}
{"session": "session_0", "metric": "perf_score", "unit": "points", "direction": "higher", "run": 79, "value": 54.28, "status": "discard", "description": "run 78 experiment", "timestamp": "2024-07-10T09:00:00Z"}
{"session": "session_0", "metric": "perf_score", "unit": "points", "direction": "higher", "run": 80, "value": 90.8, "status": "crash", "description": "run 79 experiment", "timestamp": "2024-08-10T09:00:00Z"}
{"session": "session_0", "metric": "perf_score", "unit": "points", "direction": "higher", "run": 81, "value": 88.29, "status": "keep", "description": "run 80 experiment", "timestamp": "2024-09-10T09:00:00Z"}
{"session": "session_0", "metric": "perf_score", "unit": "points", "direction": "higher", "run": 82, "value": 82.99, "status": "crash", "description": "run 81 experiment", "timestamp": "2024-01-10T09:00:00Z"}
{"session": "session_0", "metric": "perf_score", "unit": "points", "direction": "higher", "run": 83, "value": 58.26, "status": "crash", "description": "run 82 experiment", "timestamp": "2024-02-10T09:00:00Z"}
{"session": "session_0", "metric": "perf_score", "unit": "points", "direction": "higher", "run": 84, "value": 93.62, "status": "discard", "description": "run 83 experiment", "timestamp": "2024-03-10T09:00:00Z"}
{"session": "session_0", "metric": "perf_score", "unit": "points", "direction": "higher", "run": 85, "value": 98.22, "status": "crash", "description": "run 84 experiment", "timestamp": "2024-04-10T09:00:00Z"}
{"session": "session_0", "metric": "perf_score", "unit": "points", "direction": "higher", "run": 86, "value": 87.76, "status": "keep", "description": "run 85 experiment", "timestamp": "2024-05-10T09:00:00Z"}
{"session": "session_0", "metric": "perf_score", "unit": "points", "direction": "higher", "run": 87, "value": 85.65, "status": "discard", "description": "run 86 experiment", "timestamp": "2024-06-10T09:00:00Z"}
{"session": "session_0", "metric": "perf_score", "unit": "points", "direction": "higher", "run": 88, "value": 99.76, "status": "keep", "description": "run 87 experiment", "timestamp": "2024-07-10T09:00:00Z"}
{"session": "session_0", "metric": "perf_score", "unit": "points", "direction": "higher", "run": 89, "value": 71.91, "status": "crash", "description": "run 88 experiment", "timestamp": "2024-08-10T09:00:00Z"}
{"session": "session_0", "metric": "perf_score", "unit": "points", "direction": "higher", "run": 90, "value": 72.57, "status": "keep", "description": "run 89 experiment", "timestamp": "2024-09-10T09:00:00Z"}
{"session": "session_0", "metric": "perf_score", "unit": "points", "direction": "higher", "run": 91, "value": 61.23, "status": "keep", "description": "run 90 experiment", "timestamp": "2024-01-10T09:00:00Z"}
{"session": "session_0", "metric": "perf_score", "unit": "points", "direction": "higher", "run": 92, "value": 51.05, "status": "crash", "description": "run 91 experiment", "timestamp": "2024-02-10T09:00:00Z"}
{"session": "session_0", "metric": "perf_score", "unit": "points", "direction": "higher", "run": 93, "value": 61.51, "status": "keep", "description": "run 92 experiment", "timestamp": "2024-03-10T09:00:00Z"}
{"session": "session_0", "metric": "perf_score", "unit": "points", "direction": "higher", "run": 94, "value": 50.36, "status": "keep", "description": "run 93 experiment", "timestamp": "2024-04-10T09:00:00Z"}
{"session": "session_0", "metric": "perf_score", "unit": "points", "direction": "higher", "run": 95, "value": 61.45, "status": "keep", "description": "run 94 experiment", "timestamp": "2024-05-10T09:00:00Z"}
{"session": "session_0", "metric": "perf_score", "unit": "points", "direction": "higher", "run": 96, "value": 92.98, "status": "keep", "description": "run 95 experiment", "timestamp": "2024-06-10T09:00:00Z"}
{"session": "session_0", "metric": "perf_score", "unit": "points", "direction": "higher", "run": 97, "value": 75.71, "status": "keep", "description": "run 96 experiment", "timestamp": "2024-07-10T09:00:00Z"}
{"session": "session_0", "metric": "perf_score", "unit": "points", "direction": "higher", "run": 98, "value": 83.45, "status": "keep", "description": "run 97 experiment", "timestamp": "2024-08-10T09:00:00Z"}
{"session": "session_0", "metric": "perf_score", "unit": "points", "direction": "higher", "run": 99, "value": 76.96, "status": "crash", "description": "run 98 experiment", "timestamp": "2024-09-10T09:00:00Z"}
{"session": "session_0", "metric": "perf_score", "unit": "points", "direction": "higher", "run": 100, "value": 78.81, "status": "keep", "description": "run 99 experiment", "timestamp": "2024-01-10T09:00:00Z"}
{"session": "session_1", "metric": "perf_score", "unit": "points", "direction": "higher", "run": 1, "value": 89.23, "status": "discard", "description": "run 100 experiment", "timestamp": "2024-02-10T09:00:00Z"}
{"session": "session_1", "metric": "perf_score", "unit": "points", "direction": "higher", "run": 2, "value": 59.52, "status": "keep", "description": "run 101 experiment", "timestamp": "2024-03-10T09:00:00Z"}
{"session": "session_1", "metric": "perf_score", "unit": "points", "direction": "higher", "run": 3, "value": 82.95, "status": "keep", "description": "run 102 experiment", "timestamp": "2024-04-10T09:00:00Z"}
{"session": "session_1", "metric": "perf_score", "unit": "points", "direction": "higher", "run": 4, "value": 71.18, "status": "discard", "description": "run 103 experiment", "timestamp": "2024-05-10T09:00:00Z"}
{"session": "session_1", "metric": "perf_score", "unit": "points", "direction": "higher", "run": 5, "value": 93.19, "status": "keep", "description": "run 104 experiment", "timestamp": "2024-06-10T09:00:00Z"}
