{"session": "session_4", "metric": "perf_score", "unit": "points", "direction": "higher", "run": 19, "value": 65.73, "status": "keep", "description": "run 418 experiment", "timestamp": "2024-05-10T09:00:00Z"}
{"session": "session_4", "metric": "perf_score", "unit": "points", "direction": "higher", "run": 20, "value": 55.8, "status": "discard", "description": "run 419 experiment", "timestamp": "2024-06-10T09:00:00Z"}
{"session": "session_4", "metric": "perf_score", "unit": "points", "direction": "higher", "run": 21, "value": 93.25, "status": "keep", "description": "run 420 experiment", "timestamp": "2024-07-10T09:00:00Z"}
{"session": "session_4", "metric": "perf_score", "unit": "points", "direction": "higher", "run": 22, "value": 82.88, "status": "crash", "description": "run 421 experiment", "timestamp": "2024-08-10T09:00:00Z"}
{"session": "session_4", "metric": "perf_score", "unit": "points", "direction": "higher", "run": 23, "value": 73.1, "status": "keep", "description": "run 422 experiment", "timestamp": "2024-09-10T09:00:00Z"}
{"session": "session_4", "metric": "perf_score", "unit": "points", "direction": "higher", "run": 24, "value": 59.38, "status": "keep", "description": "run 423 experiment", "timestamp": "2024-01-10T09:00:00Z"}
{"session": "session_4", "metric": "perf_score", "unit": "points", "direction": "higher", "run": 25, "value": 81.13, "status": "discard", "description": "run 424 experiment", "timestamp": "2024-02-10T09:00:00Z"}
{"session": "session_4", "metric": "perf_score", "unit": "points", "direction": "higher", "run": 26, "value": 81.27, "status": "keep", "description": "run 425 experiment", "timestamp": "2024-03-10T09:00:00Z"}
{"session": "session_4", "metric": "perf_score", "unit": "points", "direction": "higher", "run": 27, "value": 60.18, "status": "crash", "description": "run 426 experiment", "timestamp": "2024-04-10T09:00:00Z"}
{"session": "session_4", "metric": "perf_score", "unit": "points", "direction": "higher", "run": 28, "value": 56.55, "status": "keep", "description": "run 427 experiment", "timestamp": "2024-05-10T09:00:00Z"}
{"session": "session_4", "metric": "perf_score", "unit": "points", "direction": "higher", "run": 29, "value": 71.91, "status": "discard", "description": "run 428 experiment", "timestamp": "2024-06-10T09:00:00Z"}
{"session": "session_4", "metric": "perf_score", "unit": "points", "direction": "higher", "run": 30, "value": 56.07, "status": "crash", "description": "run 429 experiment", "timestamp": "2024-07-10T09:00:00Z"}
{"session": "session_4", "metric": "perf_score", "unit": "points", "direction": "higher", "run": 31, "value": 89.97, "status": "keep", "description": "run 430 experiment", "timestamp": "2024-08-10T09:00:00Z"}
{"session": "session_4", "metric": "perf_score", "unit": "points", "direction": "higher", "run": 32, "value": 65.54, "status": "keep", "description": "run 431 experiment", "timestamp": "2024-09-10T09:00:00Z"}
{"session": "session_4", "metric": "perf_score", "unit": "points", "direction": "higher", "run": 33, "value": 77.61, "status": "keep", "description": "run 432 experiment", "timestamp": "2024-01-10T09:00:00Z"}
{"session": "session_4", "metric": "perf_score", "unit": "points", "direction": "higher", "run": 34, "value": 61.24, "status": "keep", "description": "run 433 experiment", "timestamp": "2024-02-10T09:00:00Z"}
{"session": "session_4", "metric": "perf_score", "unit": "points", "direction": "higher", "run": 35, "value": 73.07, "status": "keep", "description": "run 434 experiment", "timestamp": "2024-03-10T09:00:00Z"}
{"session": "session_4", "metric": "perf_score", "unit": "points", "direction": "higher", "run": 36, "value": 82.39, "status": "keep", "description": "run 435 experiment", "timestamp": "2024-04-10T09:00:00Z"}
{"session": "session_4", "metric": "perf_score", "unit": "points", "direction": "higher", "run": 37, "value": 74.92, "status": "keep", "description": "run 436 experiment", "timestamp": "2024-05-10T09:00:00Z"}
{"session": "session_4", "metric": "perf_score", "unit": "points", "direction": "higher", "run": 38, "value": 75.44, "status": "keep", "description": "run 437 experiment", "timestamp": "2024-06-10T09:00:00Z"}
{"session": "session_4", "metric": "perf_score", "unit": "points", "direction": "higher", "run": 39, "value": 70.77, "status": "discard", "description": "run 438 experiment", "timestamp": "2024-07-10T09:00:00Z"}
{"session": "session_4", "metric": "perf_score", "unit": "points", "direction": "higher", "run": 40, "value": 99.01, "status": "keep", "description": "run 439 experiment", "timestamp": "2024-08-10T09:00:00Z"}
{"session": "session_4", "metric": "perf_score", "unit": "points", "direction": "higher", "run": 41, "value": 72.84, "status": "keep", "description": "run 440 experiment", "timestamp": "2024-09-10T09:00:00Z"}
{"session": "session_4", "metric": "perf_score", "unit": "points", "direction": "higher", "run": 42, "value": 69.18, "status": "crash", "description": "run 441 experiment", "timestamp": "2024-01-10T09:00:00Z"}
{"session": "session_4", "metric": "perf_score", "unit": "points", "direction": "higher", "run": 43, "value": 75.41, "status": "keep", "description": "run 442 experiment", "timestamp": "2024-02-10T09:00:00Z"}
{"session": "session_4", "metric": "perf_score", "unit": "points", "direction": "higher", "run": 44, "value": 93.2, "status": "keep", "description": "run 443 experiment", "timestamp": "2024-03-10T09:00:00Z"}
{"session": "session_4", "metric": "perf_score", "unit": "points", "direction": "higher", "run": 45, "value": 88.63, "status": "discard", "description": "run 444 experiment", "timestamp": "2024-04-10T09:00:00Z"}
{"session": "session_4", "metric": "perf_score", "unit": "points", "direction": "higher", "run": 46, "value": 66.99, "status": "crash", "description": "run 445 experiment", "timestamp": "2024-05-10T09:00:00Z"}
{"session": "session_4", "metric": "perf_score", "unit": "points", "direction": "higher", "run": 47, "value": 63.36, "status": "keep", "description": "run 446 experiment", "timestamp": "2024-06-10T09:00:00Z"}
{"session": "session_4", "metric": "perf_score", "unit": "points", "direction": "higher", "run": 48, "value": 64.14, "status": "keep", "description": "run 447 experiment", "timestamp": "2024-07-10T09:00:00Z"}
{"session": "session_4", "metric": "perf_score", "unit": "points", "direction": "higher", "run": 49, "value": 91.87, "status": "crash", "description": "run 448 experiment", "timestamp": "2024-08-10T09:00:00Z"}
{"session": "session_4", "metric": "perf_score", "unit": "points", "direction": "higher", "run": 50, "value": 99.95, "status": "discard", "description": "run 449 experiment", "timestamp": "2024-09-10T09:00:00Z"}
{"session": "session_4", "metric": "perf_score", "unit": "points", "direction": "higher", "run": 51, "value": 93.26, "status": "discard", "description": "run 450 experiment", "timestamp": "2024-01-10T09:00:00Z"}
{"session": "session_4", "metric": "perf_score", "unit": "points", "direction": "higher", "run": 52, "value": 76.93, "status": "keep", "description": "run 451 experiment", "timestamp": "2024-02-10T09:00:00Z"}
{"session": "session_4", "metric": "perf_score", "unit": "points", "direction": "higher", "run": 53, "value": 66.62, "status": "crash", "description": "run 452 experiment", "timestamp": "2024-03-10T09:00:00Z"}
{"session": "session_4", "metric": "perf_score", "unit": "points", "direction": "higher", "run": 54, "value": 68.86, "status": "keep", "description": "run 453 experiment", "timestamp": "2024-04-10T09:00:00Z"}
{"session": "session_4", "metric": "perf_score", "unit": "points", "direction": "higher", "run": 55, "value": 93.48, "status": "keep", "description": "run 454 experiment", "timestamp": "2024-05-10T09:00:00Z"}
{"session": "session_4", "metric": "perf_score", "unit": "points", "direction": "higher", "run": 56, "value": 78.59, "status": "keep", "description": "run 455 experiment", "timestamp": "2024-06-10T09:00:00Z"}
{"session": "session_4", "metric": "perf_score", "unit": "points", "direction": "higher", "run": 57, "value": 92.8, "status": "discard", "description": "run 456 experiment", "timestamp": "2024-07-10T09:00:00Z"}
{"session": "session_4", "metric": "perf_score", "unit": "points", "direction": "higher", "run": 58, "value": 52.18, "status": "discard", "description": "run 457 experiment", "timestamp": "2024-08-10T09:00:00Z"}
{"session": "session_4", "metric": "perf_score", "unit": "points", "direction": "higher", "run": 59, "value": 85.26, "status": "discard", "description": "run 458 experiment", "timestamp": "2024-09-10T09:00:00Z"}
{"session": "session_4", "metric": "perf_score", "unit": "points", "direction": "higher", "run": 60, "value": 69.3, "status": "keep", "description": "run 459 experiment", "timestamp": "2024-01-10T09:00:00Z"}
{"session": "session_4", "metric": "perf_score", "unit": "points", "direction": "higher", "run": 61, "value": 74.77, "status": "keep", "description": "run 460 experiment", "timestamp": "2024-02-10T09:00:00Z"}
{"session": "session_4", "metric": "perf_score", "unit": "points", "direction": "higher", "run": 62, "value": 56.31, "status": "crash", "description": "run 461 experiment", "timestamp": "2024-03-10T09:00:00Z"}
{"session": "session_4", "metric": "perf_score", "unit": "points", "direction": "higher", "run": 63, "value": 66.6, "status": "keep", "description": "run 462 experiment", "timestamp": "2024-04-10T09:00:00Z"}
{"session": "session_4", "metric": "perf_score", "unit": "points", "direction": "higher", "run": 64, "value": 93.71, "status": "discard", "description": "run 463 experiment", "timestamp": "2024-05-10T09:00:00Z"}
{"session": "session_4", "metric": "perf_score", "unit": "points", "direction": "higher", "run": 65, "value": 54.99, "status": "discard", "description": "run 464 experiment", "timestamp": "2024-06-10T09:00:00Z"}
{"session": "session_4", "metric": "perf_score", "unit": "points", "direction": "higher", "run": 66, "value": 50.77, "status": "keep", "description": "run 465 experiment", "timestamp": "2024-07-10T09:00:00Z"}
{"session": "session_4", "metric": "perf_score", "unit": "points", "direction": "higher", "run": 67, "value": 70.5, "status": "keep", "description": "run 466 experiment", "timestamp": "2024-08-10T09:00:00Z"}
{"session": "session_4", "metric": "perf_score", "unit": "points", "direction": "higher", "run": 68, "value": 53.74, "status": "keep", "description": "run 467 experiment", "timestamp": "2024-09-10T09:00:00Z"}
{"session": "session_4", "metric": "perf_score", "unit": "points", "direction": "higher", "run": 69, "value": 66.93, "status": "discard", "description": "run 468 experiment", "timestamp": "2024-01-10T09:00:00Z"}
{"session": "session_4", "metric": "perf_score", "unit": "points", "direction": "higher", "run": 70, "value": 82.49, "status": "keep", "description": "run 469 experiment", "timestamp": "2024-02-10T09:00:00Z"}
{"session": "session_4", "metric": "perf_score", "unit": "points", "direction": "higher", "run": 71, "value": 92.62, "status": "crash", "description": "run 470 experiment", "timestamp": "2024-03-10T09:00:00Z"}
{"session": "session_4", "metric": "perf_score", "unit": "points", "direction": "higher", "run": 72, "value": 69.0, "status": "keep", "description": "run 471 experiment", "timestamp": "2024-04-10T09:00:00Z"}
{"session": "session_4", "metric": "perf_score", "unit": "points", "direction": "higher", "run": 73, "value": 81.34, "status": "discard", "description": "run 472 experiment", "timestamp": "2024-05-10T09:00:00Z"}
{"session": "session_4", "metric": "perf_score", "unit": "points", "direction": "higher", "run": 74, "value": 93.62, "status": "keep", "description": "run 473 experiment", "timestamp": "2024-06-10T09:00:00Z"}
{"session": "session_4", "metric": "perf_score", "unit": "points", "direction": "higher", "run": 75, "value": 80.87, "status": "keep", "description": "run 474 experiment", "timestamp": "2024-07-10T09:00:00Z"}
{"session": "session_4", "metric": "perf_score", "unit": "points", "direction": "higher", "run": 76, "value": 81.56, "status": "keep", "description": "run 475 experiment", "timestamp": "2024-08-10T09:00:00Z"}
{"session": "session_4", "metric": "perf_score", "unit": "points", "direction": "higher", "run": 77, "value": 99.87, "status": "keep", "description": "run 476 experiment", "timestamp": "2024-09-10T09:00:00Z"}
{"session": "session_4", "metric": "perf_score", "unit": "points", "direction": "higher", "run": 78, "value": 71.7, "status": "keep", "description": "run 477 experiment", "timestamp": "2024-01-10T09:00:00Z"}
{"session": "session_4", "metric": "perf_score", "unit": "points", "direction": "higher", "run": 79, "value": 88.02, "status": "keep", "description": "run 478 experiment", "timestamp": "2024-02-10T09:00:00Z"}
{"session": "session_4", "metric": "perf_score", "unit": "points", "direction": "higher", "run": 80, "value": 72.18, "status": "keep", "description": "run 479 experiment", "timestamp": "2024-03-10T09:00:00Z"}
{"session": "session_4", "metric": "perf_score", "unit": "points", "direction": "higher", "run": 81, "value": 95.17, "status": "keep", "description": "run 480 experiment", "timestamp": "2024-04-10T09:00:00Z"}
{"session": "session_4", "metric": "perf_score", "unit": "points", "direction": "higher", "run": 82, "value": 66.22, "status": "keep", "description": "run 481 experiment", "timestamp": "2024-05-10T09:00:00Z"}
{"session": "session_4", "metric": "perf_score", "unit": "points", "direction": "higher", "run": 83, "value": 64.67, "status": "keep", "description": "run 482 experiment", "timestamp": "2024-06-10T09:00:00Z"}
{"session": "session_4", "metric": "perf_score", "unit": "points", "direction": "higher", "run": 84, "value": 71.53, "status": "keep", "description": "run 483 experiment", "timestamp": "2024-07-10T09:00:00Z"}
{"session": "session_4", "metric": "perf_score", "unit": "points", "direction": "higher", "run": 85, "value": 76.56, "status": "crash", "description": "run 484 experiment", "timestamp": "2024-08-10T09:00:00Z"}
{"session": "session_4", "metric": "perf_score", "unit": "points", "direction": "higher", "run": 86, "value": 84.09, "status": "keep", "description": "run 485 experiment", "timestamp": "2024-09-10T09:00:00Z"}
{"session": "session_4", "metric": "perf_score", "unit": "points", "direction": "higher", "run": 87, "value": 58.5, "status": "keep", "description": "run 486 experiment", "timestamp": "2024-01-10T09:00:00Z"}
{"session": "session_4", "metric": "perf_score", "unit": "points", "direction": "higher", "run": 88, "value": 80.47, "status": "discard", "description": "run 487 experiment", "timestamp": "2024-02-10T09:00:00Z"}
{"session": "session_4", "metric": "perf_score", "unit": "points", "direction": "higher", "run": 89, "value": 80.99, "status": "keep", "description": "run 488 experiment", "timestamp": "2024-03-10T09:00:00Z"}
{"session": "session_4", "metric": "perf_score", "unit": "points", "direction": "higher", "run": 90, "value": 74.88, "status": "crash", "description": "run 489 experiment", "timestamp": "2024-04-10T09:00:00Z"}
{"session": "session_4", "metric": "perf_score", "unit": "points", "direction": "higher", "run": 91, "value": 57.16, "status": "discard", "description": "run 490 experiment", "timestamp": "2024-05-10T09:00:00Z"}
{"session": "session_4", "metric": "perf_score", "unit": "points", "direction": "higher", "run": 92, "value": 81.9, "status": "discard", "description": "run 491 experiment", "timestamp": "2024-06-10T09:00:00Z"}
{"session": "session_4", "metric": "perf_score", "unit": "points", "direction": "higher", "run": 93, "value": 62.77, "status": "keep", "description": "run 492 experiment", "timestamp": "2024-07-10T09:00:00Z"}
{"session": "session_4", "metric": "perf_score", "unit": "points", "direction": "higher", "run": 94, "value": 94.95, "status": "discard", "description": "run 493 experiment", "timestamp": "2024-08-10T09:00:00Z"}
{"session": "session_4", "metric": "perf_score", "unit": "points", "direction": "higher", "run": 95, "value": 95.06, "status": "crash", "description": "run 494 experiment", "timestamp": "2024-09-10T09:00:00Z"}
{"session": "session_4", "metric": "perf_score", "unit": "points", "direction": "higher", "run": 96, "value": 57.9, "status": "discard", "description": "run 495 experiment", "timestamp": "2024-01-10T09:00:00Z"}
{"session": "session_4", "metric": "perf_score", "unit": "points", "direction": "higher", "run": 97, "value": 97.26, "status": "crash", "description": "run 496 experiment", "timestamp": "2024-02-10T09:00:00Z"}
{"session": "session_4", "metric": "perf_score", "unit": "points", "direction": "higher", "run": 98, "value": 64.96, "status": "discard", "description": "run 497 experiment", "timestamp": "2024-03-10T09:00:00Z"}
{"session": "session_4", "metric": "perf_score", "unit": "points", "direction": "higher", "run": 99, "value": 84.52, "status": "discard", "description": "run 498 experiment", "timestamp": "2024-04-10T09:00:00Z"}
{"session": "session_4", "metric": "perf_score", "unit": "points", "direction": "higher", "run": 100, "value": 92.27, "status": "keep", "description": "run 499 experiment", "timestamp": "2024-05-10T09:00:00Z"}
{"session": "session_5", "metric": "perf_score", "unit": "points", "direction": "higher", "run": 1, "value": 99.97, "status": "discard", "description": "run 500 experiment", "timestamp": "2024-06-10T09:00:00Z"}
{"session": "session_5", "metric": "perf_score", "unit": "points", "direction": "higher", "run": 2, "value": 55.33, "status": "discard", "description": "run 501 experiment", "timestamp": "2024-07-10T09:00:00Z"}
{"session": "session_5", "metric": "perf_score", "unit": "points", "direction": "higher", "run": 3, "value": 78.6, "status": "crash", "description": "run 502 experiment", "timestamp": "2024-08-10T09:00:00Z"}
{"session": "session_5", "metric": "perf_score", "unit": "points", "direction": "higher", "run": 4, "value": 64.79, "status": "keep", "description": "run 503 experiment", "timestamp": "2024-09-10T09:00:00Z"}
{"session": "session_5", "metric": "perf_score", "unit": "points", "direction": "higher", "run": 5, "value": 51.1, "status": "discard", "description": "run 504 experiment", "timestamp": "2024-01-10T09:00:00Z"}
{"session": "session_5", "metric": "perf_score", "unit": "points", "direction": "higher", "run": 6, "value": 63.72, "status": "crash", "description": "run 505 experiment", "timestamp": "2024-02-10T09:00:00Z"}
{"session": "session_5", "metric": "perf_score", "unit": "points", "direction": "higher", "run": 7, "value": 93.25, "status": "keep", "description": "run 506 experiment", "timestamp": "2024-03-10T09:00:00Z"}
{"session": "session_5", "metric": "perf_score", "unit": "points", "direction": "higher", "run": 8, "value": 95.53, "status": "discard", "description": "run 507 experiment", "timestamp": "2024-04-10T09:00:00Z"}
{"session": "session_5", "metric": "perf_score", "unit": "points", "direction": "higher", "run": 9, "value": 91.64, "status": "keep", "description": "run 508 experiment", "timestamp": "2024-05-10T09:00:00Z"}
{"session": "session_5", "metric": "perf_score", "unit": "points", "direction": "higher", "run": 10, "value": 88.79, "status": "keep", "description": "run 509 experiment", "timestamp": "2024-06-10T09:00:00Z"}
{"session": "session_5", "metric": "perf_score", "unit": "points", "direction": "higher", "run": 11, "value": 80.35, "status": "keep", "description": "run 510 experiment", "timestamp": "2024-07-10T09:00:00Z"}
{"session": "session_5", "metric": "perf_score", "unit": "points", "direction": "higher", "run": 12, "value": 60.95, "status": "keep", "description": "run 511 experiment", "timestamp": "2024-08-10T09:00:00Z"}
{"session": "session_5", "metric": "perf_score", "unit": "points", "direction": "higher", "run": 13, "value": 81.04, "status": "keep", "description": "run 512 experiment", "timestamp": "2024-09-10T09:00:00Z"}
{"session": "session_5", "metric": "perf_score", "unit": "points", "direction": "higher", "run": 14, "value": 81.41, "status": "keep", "description": "run 513 experiment", "timestamp": "2024-01-10T09:00:00Z"}
{"session": "session_5", "metric": "perf_score", "unit": "points", "direction": "higher", "run": 15, "value": 65.45, "status": "discard", "description": "run 514 experiment", "timestamp": "2024-02-10T09:00:00Z"}
{"session": "session_5", "metric": "perf_score", "unit": "points", "direction": "higher", "run": 16, "value": 51.67, "status": "keep", "description": "run 515 experiment", "timestamp": "2024-03-10T09:00:00Z"}
{"session": "session_5", "metric": "perf_score", "unit": "points", "direction": "higher", "run": 17, "value": 86.62, "status": "keep", "description": "run 516 experiment", "timestamp": "2024-04-10T09:00:00Z"}
{"session": "session_5", "metric": "perf_score", "unit": "points", "direction": "higher", "run": 18, "value": 95.48, "status": "keep", "description": "run 517 experiment", "timestamp": "2024-05-10T09:00:00Z"}
{"session": "session_5", "metric": "perf_score", "unit": "points", "direction": "higher", "run": 19, "value": 87.37, "status": "keep", "description": "run 518 experiment", "timestamp": "2024-06-10T09:00:00Z"}
{"session": "session_5", "metric": "perf_score", "unit": "points", "direction": "higher", "run": 20, "value": 60.04, "status": "crash", "description": "run 519 experiment", "timestamp": "2024-07-10T09:00:00Z"}
{"session": "session_5", "metric": "perf_score", "unit": "points", "direction": "higher", "run": 21, "value": 93.82, "status": "keep", "description": "run 520 experiment", "timestamp": "2024-08-10T09:00:00Z"}
{"session": "session_5", "metric": "perf_score", "unit": "points", "direction": "higher", "run": 22, "value": 76.54, "status": "keep", "description": "run 521 experiment", "timestamp": "2024-09-10T09:00:00Z"}
