{"session": "session_7", "metric": "perf_score", "unit": "points", "direction": "higher", "run": 31, "value": 92.22, "status": "keep", "description": "run 730 experiment", "timestamp": "2024-02-10T09:00:00Z"}
{"session": "session_7", "metric": "perf_score", "unit": "points", "direction": "higher", "run": 32, "value": 75.38, "status": "crash", "description": "run 731 experiment", "timestamp": "2024-03-10T09:00:00Z"}
{"session": "session_7", "metric": "perf_score", "unit": "points", "direction": "higher", "run": 33, "value": 91.76, "status": "crash", "description": "run 732 experiment", "timestamp": "2024-04-10T09:00:00Z"}
{"session": "session_7", "metric": "perf_score", "unit": "points", "direction": "higher", "run": 34, "value": 51.89, "status": "keep", "description": "run 733 experiment", "timestamp": "2024-05-10T09:00:00Z"}
{"session": "session_7", "metric": "perf_score", "unit": "points", "direction": "higher", "run": 35, "value": 93.82, "status": "crash", "description": "run 734 experiment", "timestamp": "2024-06-10T09:00:00Z"}
{"session": "session_7", "metric": "perf_score", "unit": "points", "direction": "higher", "run": 36, "value": 56.55, "status": "discard", "description": "run 735 experiment", "timestamp": "2024-07-10T09:00:00Z"}
{"session": "session_7", "metric": "perf_score", "unit": "points", "direction": "higher", "run": 37, "value": 57.71, "status": "keep", "description": "run 736 experiment", "timestamp": "2024-08-10T09:00:00Z"}
{"session": "session_7", "metric": "perf_score", "unit": "points", "direction": "higher", "run": 38, "value": 91.57, "status": "crash", "description": "run 737 experiment", "timestamp": "2024-09-10T09:00:00Z"}
{"session": "session_7", "metric": "perf_score", "unit": "points", "direction": "higher", "run": 39, "value": 90.45, "status": "keep", "description": "run 738 experiment", "timestamp": "2024-01-10T09:00:00Z"}
{"session": "session_7", "metric": "perf_score", "unit": "points", "direction": "higher", "run": 40, "value": 86.06, "status": "keep", "description": "run 739 experiment", "timestamp": "2024-02-10T09:00:00Z"}
{"session": "session_7", "metric": "perf_score", "unit": "points", "direction": "higher", "run": 41, "value": 70.54, "status": "keep", "description": "run 740 experiment", "timestamp": "2024-03-10T09:00:00Z"}
{"session": "session_7", "metric": "perf_score", "unit": "points", "direction": "higher", "run": 42, "value": 98.48, "status": "crash", "description": "run 741 experiment", "timestamp": "2024-04-10T09:00:00Z"}
{"session": "session_7", "metric": "perf_score", "unit": "points", "direction": "higher", "run": 43, "value": 64.25, "status": "discard", "description": "run 742 experiment", "timestamp": "2024-05-10T09:00:00Z"}
{"session": "session_7", "metric": "perf_score", "unit": "points", "direction": "higher", "run": 44, "value": 61.7, "status": "keep", "description": "run 743 experiment", "timestamp": "2024-06-10T09:00:00Z"}
{"session": "session_7", "metric": "perf_score", "unit": "points", "direction": "higher", "run": 45, "value": 65.47, "status": "discard", "description": "run 744 experiment", "timestamp": "2024-07-10T09:00:00Z"}
{"session": "session_7", "metric": "perf_score", "unit": "points", "direction": "higher", "run": 46, "value": 95.2, "status": "keep", "description": "run 745 experiment", "timestamp": "2024-08-10T09:00:00Z"}
{"session": "session_7", "metric": "perf_score", "unit": "points", "direction": "higher", "run": 47, "value": 68.39, "status": "crash", "description": "run 746 experiment", "timestamp": "2024-09-10T09:00:00Z"}
{"session": "session_7", "metric": "perf_score", "unit": "points", "direction": "higher", "run": 48, "value": 99.22, "status": "discard", "description": "run 747 experiment", "timestamp": "2024-01-10T09:00:00Z"}
{"session": "session_7", "metric": "perf_score", "unit": "points", "direction": "higher", "run": 49, "value": 88.47, "status": "discard", "description": "run 748 experiment", "timestamp": "2024-02-10T09:00:00Z"}
{"session": "session_7", "metric": "perf_score", "unit": "points", "direction": "higher", "run": 50, "value": 75.15, "status": "discard", "description": "run 749 experiment", "timestamp": "2024-03-10T09:00:00Z"}
{"session": "session_7", "metric": "perf_score", "unit": "points", "direction": "higher", "run": 51, "value": 98.31, "status": "keep", "description": "run 750 experiment", "timestamp": "2024-04-10T09:00:00Z"}
{"session": "session_7", "metric": "perf_score", "unit": "points", "direction": "higher", "run": 52, "value": 90.06, "status": "keep", "description": "run 751 experiment", "timestamp": "2024-05-10T09:00:00Z"}
{"session": "session_7", "metric": "perf_score", "unit": "points", "direction": "higher", "run": 53, "value": 93.65, "status": "keep", "description": "run 752 experiment", "timestamp": "2024-06-10T09:00:00Z"}
{"session": "session_7", "metric": "perf_score", "unit": "points", "direction": "higher", "run": 54, "value": 82.06, "status": "keep", "description": "run 753 experiment", "timestamp": "2024-07-10T09:00:00Z"}
{"session": "session_7", "metric": "perf_score", "unit": "points", "direction": "higher", "run": 55, "value": 77.73, "status": "keep", "description": "run 754 experiment", "timestamp": "2024-08-10T09:00:00Z"}
{"session": "session_7", "metric": "perf_score", "unit": "points", "direction": "higher", "run": 56, "value": 85.57, "status": "crash", "description": "run 755 experiment", "timestamp": "2024-09-10T09:00:00Z"}
{"session": "session_7", "metric": "perf_score", "unit": "points", "direction": "higher", "run": 57, "value": 92.56, "status": "keep", "description": "run 756 experiment", "timestamp": "2024-01-10T09:00:00Z"}
{"session": "session_7", "metric": "perf_score", "unit": "points", "direction": "higher", "run": 58, "value": 54.19, "status": "keep", "description": "run 757 experiment", "timestamp": "2024-02-10T09:00:00Z"}
{"session": "session_7", "metric": "perf_score", "unit": "points", "direction": "higher", "run": 59, "value": 63.64, "status": "crash", "description": "run 758 experiment", "timestamp": "2024-03-10T09:00:00Z"}
{"session": "session_7", "metric": "perf_score", "unit": "points", "direction": "higher", "run": 60, "value": 57.37, "status": "discard", "description": "run 759 experiment", "timestamp": "2024-04-10T09:00:00Z"}
{"session": "session_7", "metric": "perf_score", "unit": "points", "direction": "higher", "run": 61, "value": 54.59, "status": "keep", "description": "run 760 experiment", "timestamp": "2024-05-10T09:00:00Z"}
{"session": "session_7", "metric": "perf_score", "unit": "points", "direction": "higher", "run": 62, "value": 90.84, "status": "keep", "description": "run 761 experiment", "timestamp": "2024-06-10T09:00:00Z"}
{"session": "session_7", "metric": "perf_score", "unit": "points", "direction": "higher", "run": 63, "value": 96.52, "status": "discard", "description": "run 762 experiment", "timestamp": "2024-07-10T09:00:00Z"}
{"session": "session_7", "metric": "perf_score", "unit": "points", "direction": "higher", "run": 64, "value": 52.66, "status": "crash", "description": "run 763 experiment", "timestamp": "2024-08-10T09:00:00Z"}
{"session": "session_7", "metric": "perf_score", "unit": "points", "direction": "higher", "run": 65, "value": 68.7, "status": "discard", "description": "run 764 experiment", "timestamp": "2024-09-10T09:00:00Z"}
{"session": "session_7", "metric": "perf_score", "unit": "points", "direction": "higher", "run": 66, "value": 99.73, "status": "keep", "description": "run 765 experiment", "timestamp": "2024-01-10T09:00:00Z"}
{"session": "session_7", "metric": "perf_score", "unit": "points", "direction": "higher", "run": 67, "value": 61.23, "status": "keep", "description": "run 766 experiment", "timestamp": "2024-02-10T09:00:00Z"}
{"session": "session_7", "metric": "perf_score", "unit": "points", "direction": "higher", "run": 68, "value": 96.54, "status": "keep", "description": "run 767 experiment", "timestamp": "2024-03-10T09:00:00Z"}
{"session": "session_7", "metric": "perf_score", "unit": "points", "direction": "higher", "run": 69, "value": 89.57, "status": "keep", "description": "run 768 experiment", "timestamp": "2024-04-10T09:00:00Z"}
{"session": "session_7", "metric": "perf_score", "unit": "points", "direction": "higher", "run": 70, "value": 51.92, "status": "discard", "description": "run 769 experiment", "timestamp": "2024-05-10T09:00:00Z"}
{"session": "session_7", "metric": "perf_score", "unit": "points", "direction": "higher", "run": 71, "value": 84.8, "status": "keep", "description": "run 770 experiment", "timestamp": "2024-06-10T09:00:00Z"}
{"session": "session_7", "metric": "perf_score", "unit": "points", "direction": "higher", "run": 72, "value": 87.94, "status": "discard", "description": "run 771 experiment", "timestamp": "2024-07-10T09:00:00Z"}
{"session": "session_7", "metric": "perf_score", "unit": "points", "direction": "higher", "run": 73, "value": 72.43, "status": "keep", "description": "run 772 experiment", "timestamp": "2024-08-10T09:00:00Z"}
{"session": "session_7", "metric": "perf_score", "unit": "points", "direction": "higher", "run": 74, "value": 95.29, "status": "keep", "description": "run 773 experiment", "timestamp": "2024-09-10T09:00:00Z"}
{"session": "session_7", "metric": "perf_score", "unit": "points", "direction": "higher", "run": 75, "value": 62.8, "status": "keep", "description": "run 774 experiment", "timestamp": "2024-01-10T09:00:00Z"}
{"session": "session_7", "metric": "perf_score", "unit": "points", "direction": "higher", "run": 76, "value": 77.44, "status": "crash", "description": "run 775 experiment", "timestamp": "2024-02-10T09:00:00Z"}
{"session": "session_7", "metric": "perf_score", "unit": "points", "direction": "higher", "run": 77, "value": 76.39, "status": "keep", "description": "run 776 experiment", "timestamp": "2024-03-10T09:00:00Z"}
{"session": "session_7", "metric": "perf_score", "unit": "points", "direction": "higher", "run": 78, "value": 88.81, "status": "keep", "description": "run 777 experiment", "timestamp": "2024-04-10T09:00:00Z"}
{"session": "session_7", "metric": "perf_score", "unit": "points", "direction": "higher", "run": 79, "value": 65.06, "status": "keep", "description": "run 778 experiment", "timestamp": "2024-05-10T09:00:00Z"}
{"session": "session_7", "metric": "perf_score", "unit": "points", "direction": "higher", "run": 80, "value": 61.92, "status": "crash", "description": "run 779 experiment", "timestamp": "2024-06-10T09:00:00Z"}
{"session": "session_7", "metric": "perf_score", "unit": "points", "direction": "higher", "run": 81, "value": 72.86, "status": "keep", "description": "run 780 experiment", "timestamp": "2024-07-10T09:00:00Z"}
{"session": "session_7", "metric": "perf_score", "unit": "points", "direction": "higher", "run": 82, "value": 91.83, "status": "discard", "description": "run 781 experiment", "timestamp": "2024-08-10T09:00:00Z"}
{"session": "session_7", "metric": "perf_score", "unit": "points", "direction": "higher", "run": 83, "value": 79.84, "status": "keep", "description": "run 782 experiment", "timestamp": "2024-09-10T09:00:00Z"}
{"session": "session_7", "metric": "perf_score", "unit": "points", "direction": "higher", "run": 84, "value": 81.6, "status": "crash", "description": "run 783 experiment", "timestamp": "2024-01-10T09:00:00Z"}
{"session": "session_7", "metric": "perf_score", "unit": "points", "direction": "higher", "run": 85, "value": 62.1, "status": "keep", "description": "run 784 experiment", "timestamp": "2024-02-10T09:00:00Z"}
{"session": "session_7", "metric": "perf_score", "unit": "points", "direction": "higher", "run": 86, "value": 64.56, "status": "keep", "description": "run 785 experiment", "timestamp": "2024-03-10T09:00:00Z"}
{"session": "session_7", "metric": "perf_score", "unit": "points", "direction": "higher", "run": 87, "value": 80.74, "status": "keep", "description": "run 786 experiment", "timestamp": "2024-04-10T09:00:00Z"}
{"session": "session_7", "metric": "perf_score", "unit": "points", "direction": "higher", "run": 88, "value": 78.53, "status": "keep", "description": "run 787 experiment", "timestamp": "2024-05-10T09:00:00Z"}
{"session": "session_7", "metric": "perf_score", "unit": "points", "direction": "higher", "run": 89, "value": 83.22, "status": "keep", "description": "run 788 experiment", "timestamp": "2024-06-10T09:00:00Z"}
{"session": "session_7", "metric": "perf_score", "unit": "points", "direction": "higher", "run": 90, "value": 76.17, "status": "keep", "description": "run 789 experiment", "timestamp": "2024-07-10T09:00:00Z"}
{"session": "session_7", "metric": "perf_score", "unit": "points", "direction": "higher", "run": 91, "value": 53.38, "status": "crash", "description": "run 790 experiment", "timestamp": "2024-08-10T09:00:00Z"}
{"session": "session_7", "metric": "perf_score", "unit": "points", "direction": "higher", "run": 92, "value": 77.2, "status": "crash", "description": "run 791 experiment", "timestamp": "2024-09-10T09:00:00Z"}
{"session": "session_7", "metric": "perf_score", "unit": "points", "direction": "higher", "run": 93, "value": 77.71, "status": "discard", "description": "run 792 experiment", "timestamp": "2024-01-10T09:00:00Z"}
{"session": "session_7", "metric": "perf_score", "unit": "points", "direction": "higher", "run": 94, "value": 93.67, "status": "keep", "description": "run 793 experiment", "timestamp": "2024-02-10T09:00:00Z"}
{"session": "session_7", "metric": "perf_score", "unit": "points", "direction": "higher", "run": 95, "value": 81.78, "status": "keep", "description": "run 794 experiment", "timestamp": "2024-03-10T09:00:00Z"}
{"session": "session_7", "metric": "perf_score", "unit": "points", "direction": "higher", "run": 96, "value": 62.68, "status": "keep", "description": "run 795 experiment", "timestamp": "2024-04-10T09:00:00Z"}
{"session": "session_7", "metric": "perf_score", "unit": "points", "direction": "higher", "run": 97, "value": 67.85, "status": "keep", "description": "run 796 experiment", "timestamp": "2024-05-10T09:00:00Z"}
{"session": "session_7", "metric": "perf_score", "unit": "points", "direction": "higher", "run": 98, "value": 67.24, "status": "keep", "description": "run 797 experiment", "timestamp": "2024-06-10T09:00:00Z"}
{"session": "session_7", "metric": "perf_score", "unit": "points", "direction": "higher", "run": 99, "value": 88.58, "status": "keep", "description": "run 798 experiment", "timestamp": "2024-07-10T09:00:00Z"}
{"session": "session_7", "metric": "perf_score", "unit": "points", "direction": "higher", "run": 100, "value": 56.67, "status": "keep", "description": "run 799 experiment", "timestamp": "2024-08-10T09:00:00Z"}
{"session": "session_8", "metric": "perf_score", "unit": "points", "direction": "higher", "run": 1, "value": 77.3, "status": "keep", "description": "run 800 experiment", "timestamp": "2024-09-10T09:00:00Z"}
{"session": "session_8", "metric": "perf_score", "unit": "points", "direction": "higher", "run": 2, "value": 91.52, "status": "discard", "description": "run 801 experiment", "timestamp": "2024-01-10T09:00:00Z"}
{"session": "session_8", "metric": "perf_score", "unit": "points", "direction": "higher", "run": 3, "value": 99.04, "status": "discard", "description": "run 802 experiment", "timestamp": "2024-02-10T09:00:00Z"}
{"session": "session_8", "metric": "perf_score", "unit": "points", "direction": "higher", "run": 4, "value": 81.59, "status": "keep", "description": "run 803 experiment", "timestamp": "2024-03-10T09:00:00Z"}
{"session": "session_8", "metric": "perf_score", "unit": "points", "direction": "higher", "run": 5, "value": 53.16, "status": "discard", "description": "run 804 experiment", "timestamp": "2024-04-10T09:00:00Z"}
{"session": "session_8", "metric": "perf_score", "unit": "points", "direction": "higher", "run": 6, "value": 51.85, "status": "keep", "description": "run 805 experiment", "timestamp": "2024-05-10T09:00:00Z"}
{"session": "session_8", "metric": "perf_score", "unit": "points", "direction": "higher", "run": 7, "value": 52.19, "status": "keep", "description": "run 806 experiment", "timestamp": "2024-06-10T09:00:00Z"}
{"session": "session_8", "metric": "perf_score", "unit": "points", "direction": "higher", "run": 8, "value": 94.29, "status": "keep", "description": "run 807 experiment", "timestamp": "2024-07-10T09:00:00Z"}
{"session": "session_8", "metric": "perf_score", "unit": "points", "direction": "higher", "run": 9, "value": 96.67, "status": "crash", "description": "run 808 experiment", "timestamp": "2024-08-10T09:00:00Z"}
{"session": "session_8", "metric": "perf_score", "unit": "points", "direction": "higher", "run": 10, "value": 69.91, "status": "crash", "description": "run 809 experiment", "timestamp": "2024-09-10T09:00:00Z"}
{"session": "session_8", "metric": "perf_score", "unit": "points", "direction": "higher", "run": 11, "value": 73.67, "status": "keep", "description": "run 810 experiment", "timestamp": "2024-01-10T09:00:00Z"}
{"session": "session_8", "metric": "perf_score", "unit": "points", "direction": "higher", "run": 12, "value": 87.66, "status": "keep", "description": "run 811 experiment", "timestamp": "2024-02-10T09:00:00Z"}
{"session": "session_8", "metric": "perf_score", "unit": "points", "direction": "higher", "run": 13, "value": 64.31, "status": "keep", "description": "run 812 experiment", "timestamp": "2024-03-10T09:00:00Z"}
{"session": "session_8", "metric": "perf_score", "unit": "points", "direction": "higher", "run": 14, "value": 93.29, "status": "keep", "description": "run 813 experiment", "timestamp": "2024-04-10T09:00:00Z"}
{"session": "session_8", "metric": "perf_score", "unit": "points", "direction": "higher", "run": 15, "value": 63.66, "status": "keep", "description": "run 814 experiment", "timestamp": "2024-05-10T09:00:00Z"}
{"session": "session_8", "metric": "perf_score", "unit": "points", "direction": "higher", "run": 16, "value": 71.85, "status": "discard", "description": "run 815 experiment", "timestamp": "2024-06-10T09:00:00Z"}
{"session": "session_8", "metric": "perf_score", "unit": "points", "direction": "higher", "run": 17, "value": 87.17, "status": "discard", "description": "run 816 experiment", "timestamp": "2024-07-10T09:00:00Z"}
{"session": "session_8", "metric": "perf_score", "unit": "points", "direction": "higher", "run": 18, "value": 66.95, "status": "keep", "description": "run 817 experiment", "timestamp": "2024-08-10T09:00:00Z"}
{"session": "session_8", "metric": "perf_score", "unit": "points", "direction": "higher", "run": 19, "value": 74.81, "status": "discard", "description": "run 818 experiment", "timestamp": "2024-09-10T09:00:00Z"}
{"session": "session_8", "metric": "perf_score", "unit": "points", "direction": "higher", "run": 20, "value": 68.37, "status": "crash", "description": "run 819 experiment", "timestamp": "2024-01-10T09:00:00Z"}
{"session": "session_8", "metric": "perf_score", "unit": "points", "direction": "higher", "run": 21, "value": 63.34, "status": "keep", "description": "run 820 experiment", "timestamp": "2024-02-10T09:00:00Z"}
{"session": "session_8", "metric": "perf_score", "unit": "points", "direction": "higher", "run": 22, "value": 86.35, "status": "keep", "description": "run 821 experiment", "timestamp": "2024-03-10T09:00:00Z"}
{"session": "session_8", "metric": "perf_score", "unit": "points", "direction": "higher", "run": 23, "value": 71.53, "status": "keep", "description": "run 822 experiment", "timestamp": "2024-04-10T09:00:00Z"}
{"session": "session_8", "metric": "perf_score", "unit": "points", "direction": "higher", "run": 24, "value": 77.27, "status": "keep", "description": "run 823 experiment", "timestamp": "2024-05-10T09:00:00Z"}
{"session": "session_8", "metric": "perf_score", "unit": "points", "direction": "higher", "run": 25, "value": 55.13, "status": "keep", "description": "run 824 experiment", "timestamp": "2024-06-10T09:00:00Z"}
{"session": "session_8", "metric": "perf_score", "unit": "points", "direction": "higher", "run": 26, "value": 83.05, "status": "keep", "description": "run 825 experiment", "timestamp": "2024-07-10T09:00:00Z"}
{"session": "session_8", "metric": "perf_score", "unit": "points", "direction": "higher", "run": 27, "value": 72.3, "status": "discard", "description": "run 826 experiment", "timestamp": "2024-08-10T09:00:00Z"}
{"session": "session_8", "metric": "perf_score", "unit": "points", "direction": "higher", "run": 28, "value": 58.33, "status": "discard", "description": "run 827 experiment", "timestamp": "2024-09-10T09:00:00Z"}
{"session": "session_8", "metric": "perf_score", "unit": "points", "direction": "higher", "run": 29, "value": 67.58, "status": "keep", "description": "run 828 experiment", "timestamp": "2024-01-10T09:00:00Z"}
{"session": "session_8", "metric": "perf_score", "unit": "points", "direction": "higher", "run": 30, "value": 86.34, "status": "keep", "description": "run 829 experiment", "timestamp": "2024-02-10T09:00:00Z"}
{"session": "session_8", "metric": "perf_score", "unit": "points", "direction": "higher", "run": 31, "value": 80.74, "status": "discard", "description": "run 830 experiment", "timestamp": "2024-03-10T09:00:00Z"}
{"session": "session_8", "metric": "perf_score", "unit": "points", "direction": "higher", "run": 32, "value": 63.73, "status": "keep", "description": "run 831 experiment", "timestamp": "2024-04-10T09:00:00Z"}
{"session": "session_8", "metric": "perf_score", "unit": "points", "direction": "higher", "run": 33, "value": 53.75, "status": "discard", "description": "run 832 experiment", "timestamp": "2024-05-10T09:00:00Z"}
{"session": "session_8", "metric": "perf_score", "unit": "points", "direction": "higher", "run": 34, "value": 68.17, "status": "keep", "description": "run 833 experiment", "timestamp": "2024-06-10T09:00:00Z"}
