{"session": "session_1", "metric": "perf_score", "unit": "points", "direction": "higher", "run": 6, "value": 83.67, "status": "keep", "description": "run 105 experiment", "timestamp": "2024-07-10T09:00:00Z"}
{"session": "session_1", "metric": "perf_score", "unit": "points", "direction": "higher", "run": 7, "value": 53.03, "status": "keep", "description": "run 106 experiment", "timestamp": "2024-08-10T09:00:00Z"}
{"session": "session_1", "metric": "perf_score", "unit": "points", "direction": "higher", "run": 8, "value": 90.03, "status": "keep", "description": "run 107 experiment", "timestamp": "2024-09-10T09:00:00Z"}
{"session": "session_1", "metric": "perf_score", "unit": "points", "direction": "higher", "run": 9, "value": 62.43, "status": "keep", "description": "run 108 experiment", "timestamp": "2024-01-10T09:00:00Z"}
{"session": "session_1", "metric": "perf_score", "unit": "points", "direction": "higher", "run": 10, "value": 76.81, "status": "keep", "description": "run 109 experiment", "timestamp": "2024-02-10T09:00:00Z"}
{"session": "session_1", "metric": "perf_score", "unit": "points", "direction": "higher", "run": 11, "value": 71.09, "status": "keep", "description": "run 110 experiment", "timestamp": "2024-03-10T09:00:00Z"}
{"session": "session_1", "metric": "perf_score", "unit": "points", "direction": "higher", "run": 12, "value": 73.13, "status": "keep", "description": "run 111 experiment", "timestamp": "2024-04-10T09:00:00Z"}
{"session": "session_1", "metric": "perf_score", "unit": "points", "direction": "higher", "run": 13, "value": 72.16, "status": "crash", "description": "run 112 experiment", "timestamp": "2024-05-10T09:00:00Z"}
{"session": "session_1", "metric": "perf_score", "unit": "points", "direction": "higher", "run": 14, "value": 54.9, "status": "crash", "description": "run 113 experiment", "timestamp": "2024-06-10T09:00:00Z"}
{"session": "session_1", "metric": "perf_score", "unit": "points", "direction": "higher", "run": 15, "value": 91.8, "status": "keep", "description": "run 114 experiment", "timestamp": "2024-07-10T09:00:00Z"}
{"session": "session_1", "metric": "perf_score", "unit": "points", "direction": "higher", "run": 16, "value": 96.32, "status": "keep", "description": "run 115 experiment", "timestamp": "2024-08-10T09:00:00Z"}
{"session": "session_1", "metric": "perf_score", "unit": "points", "direction": "higher", "run": 17, "value": 58.32, "status": "discard", "description": "run 116 experiment", "timestamp": "2024-09-10T09:00:00Z"}
{"session": "session_1", "metric": "perf_score", "unit": "points", "direction": "higher", "run": 18, "value": 74.07, "status": "discard", "description": "run 117 experiment", "timestamp": "2024-01-10T09:00:00Z"}
{"session": "session_1", "metric": "perf_score", "unit": "points", "direction": "higher", "run": 19, "value": 95.12, "status": "keep", "description": "run 118 experiment", "timestamp": "2024-02-10T09:00:00Z"}
{"session": "session_1", "metric": "perf_score", "unit": "points", "direction": "higher", "run": 20, "value": 68.95, "status": "discard", "description": "run 119 experiment", "timestamp": "2024-03-10T09:00:00Z"}
{"session": "session_1", "metric": "perf_score", "unit": "points", "direction": "higher", "run": 21, "value": 63.26, "status": "discard", "description": "run 120 experiment", "timestamp": "2024-04-10T09:00:00Z"}
{"session": "session_1", "metric": "perf_score", "unit": "points", "direction": "higher", "run": 22, "value": 64.26, "status": "crash", "description": "run 121 experiment", "timestamp": "2024-05-10T09:00:00Z"}
{"session": "session_1", "metric": "perf_score", "unit": "points", "direction": "higher", "run": 23, "value": 83.09, "status": "discard", "description": "run 122 experiment", "timestamp": "2024-06-10T09:00:00Z"}
{"session": "session_1", "metric": "perf_score", "unit": "points", "direction": "higher", "run": 24, "value": 57.74, "status": "keep", "description": "run 123 experiment", "timestamp": "2024-07-10T09:00:00Z"}
{"session": "session_1", "metric": "perf_score", "unit": "points", "direction": "higher", "run": 25, "value": 60.89, "status": "keep", "description": "run 124 experiment", "timestamp": "2024-08-10T09:00:00Z"}
{"session": "session_1", "metric": "perf_score", "unit": "points", "direction": "higher", "run": 26, "value": 78.96, "status": "crash", "description": "run 125 experiment", "timestamp": "2024-09-10T09:00:00Z"}
{"session": "session_1", "metric": "perf_score", "unit": "points", "direction": "higher", "run": 27, "value": 53.05, "status": "keep", "description": "run 126 experiment", "timestamp": "2024-01-10T09:00:00Z"}
{"session": "session_1", "metric": "perf_score", "unit": "points", "direction": "higher", "run": 28, "value": 52.86, "status": "crash", "description": "run 127 experiment", "timestamp": "2024-02-10T09:00:00Z"}
{"session": "session_1", "metric": "perf_score", "unit": "points", "direction": "higher", "run": 29, "value": 73.84, "status": "crash", "description": "run 128 experiment", "timestamp": "2024-03-10T09:00:00Z"}
{"session": "session_1", "metric": "perf_score", "unit": "points", "direction": "higher", "run": 30, "value": 57.87, "status": "crash", "description": "run 129 experiment", "timestamp": "2024-04-10T09:00:00Z"}
{"session": "session_1", "metric": "perf_score", "unit": "points", "direction": "higher", "run": 31, "value": 54.01, "status": "keep", "description": "run 130 experiment", "timestamp": "2024-05-10T09:00:00Z"}
{"session": "session_1", "metric": "perf_score", "unit": "points", "direction": "higher", "run": 32, "value": 53.43, "status": "keep", "description": "run 131 experiment", "timestamp": "2024-06-10T09:00:00Z"}
{"session": "session_1", "metric": "perf_score", "unit": "points", "direction": "higher", "run": 33, "value": 83.76, "status": "keep", "description": "run 132 experiment", "timestamp": "2024-07-10T09:00:00Z"}
{"session": "session_1", "metric": "perf_score", "unit": "points", "direction": "higher", "run": 34, "value": 70.19, "status": "crash", "description": "run 133 experiment", "timestamp": "2024-08-10T09:00:00Z"}
{"session": "session_1", "metric": "perf_score", "unit": "points", "direction": "higher", "run": 35, "value": 62.31, "status": "crash", "description": "run 134 experiment", "timestamp": "2024-09-10T09:00:00Z"}
{"session": "session_1", "metric": "perf_score", "unit": "points", "direction": "higher", "run": 36, "value": 51.99, "status": "keep", "description": "run 135 experiment", "timestamp": "2024-01-10T09:00:00Z"}
{"session": "session_1", "metric": "perf_score", "unit": "points", "direction": "higher", "run": 37, "value": 70.96, "status": "crash", "description": "run 136 experiment", "timestamp": "2024-02-10T09:00:00Z"}
{"session": "session_1", "metric": "perf_score", "unit": "points", "direction": "higher", "run": 38, "value": 78.26, "status": "keep", "description": "run 137 experiment", "timestamp": "2024-03-10T09:00:00Z"}
{"session": "session_1", "metric": "perf_score", "unit": "points", "direction": "higher", "run": 39, "value": 96.74, "status": "keep", "description": "run 138 experiment", "timestamp": "2024-04-10T09:00:00Z"}
{"session": "session_1", "metric": "perf_score", "unit": "points", "direction": "higher", "run": 40, "value": 83.49, "status": "keep", "description": "run 139 experiment", "timestamp": "2024-05-10T09:00:00Z"}
{"session": "session_1", "metric": "perf_score", "unit": "points", "direction": "higher", "run": 41, "value": 61.93, "status": "discard", "description": "run 140 experiment", "timestamp": "2024-06-10T09:00:00Z"}
{"session": "session_1", "metric": "perf_score", "unit": "points", "direction": "higher", "run": 42, "value": 56.54, "status": "keep", "description": "run 141 experiment", "timestamp": "2024-07-10T09:00:00Z"}
{"session": "session_1", "metric": "perf_score", "unit": "points", "direction": "higher", "run": 43, "value": 72.86, "status": "keep", "description": "run 142 experiment", "timestamp": "2024-08-10T09:00:00Z"}
{"session": "session_1", "metric": "perf_score", "unit": "points", "direction": "higher", "run": 44, "value": 50.47, "status": "crash", "description": "run 143 experiment", "timestamp": "2024-09-10T09:00:00Z"}
{"session": "session_1", "metric": "perf_score", "unit": "points", "direction": "higher", "run": 45, "value": 99.92, "status": "keep", "description": "run 144 experiment", "timestamp": "2024-01-10T09:00:00Z"}
{"session": "session_1", "metric": "perf_score", "unit": "points", "direction": "higher", "run": 46, "value": 53.66, "status": "keep", "description": "run 145 experiment", "timestamp": "2024-02-10T09:00:00Z"}
{"session": "session_1", "metric": "perf_score", "unit": "points", "direction": "higher", "run": 47, "value": 75.29, "status": "keep", "description": "run 146 experiment", "timestamp": "2024-03-10T09:00:00Z"}
{"session": "session_1", "metric": "perf_score", "unit": "points", "direction": "higher", "run": 48, "value": 96.66, "status": "keep", "description": "run 147 experiment", "timestamp": "2024-04-10T09:00:00Z"}
{"session": "session_1", "metric": "perf_score", "unit": "points", "direction": "higher", "run": 49, "value": 93.96, "status": "keep", "description": "run 148 experiment", "timestamp": "2024-05-10T09:00:00Z"}
{"session": "session_1", "metric": "perf_score", "unit": "points", "direction": "higher", "run": 50, "value": 64.25, "status": "discard", "description": "run 149 experiment", "timestamp": "2024-06-10T09:00:00Z"}
{"session": "session_1", "metric": "perf_score", "unit": "points", "direction": "higher", "run": 51, "value": 91.69, "status": "keep", "description": "run 150 experiment", "timestamp": "2024-07-10T09:00:00Z"}
{"session": "session_1", "metric": "perf_score", "unit": "points", "direction": "higher", "run": 52, "value": 80.58, "status": "crash", "description": "run 151 experiment", "timestamp": "2024-08-10T09:00:00Z"}
{"session": "session_1", "metric": "perf_score", "unit": "points", "direction": "higher", "run": 53, "value": 50.39, "status": "crash", "description": "run 152 experiment", "timestamp": "2024-09-10T09:00:00Z"}
{"session": "session_1", "metric": "perf_score", "unit": "points", "direction": "higher", "run": 54, "value": 64.97, "status": "keep", "description": "run 153 experiment", "timestamp": "2024-01-10T09:00:00Z"}
{"session": "session_1", "metric": "perf_score", "unit": "points", "direction": "higher", "run": 55, "value": 96.95, "status": "keep", "description": "run 154 experiment", "timestamp": "2024-02-10T09:00:00Z"}
{"session": "session_1", "metric": "perf_score", "unit": "points", "direction": "higher", "run": 56, "value": 63.22, "status": "keep", "description": "run 155 experiment", "timestamp": "2024-03-10T09:00:00Z"}
{"session": "session_1", "metric": "perf_score", "unit": "points", "direction": "higher", "run": 57, "value": 87.12, "status": "keep", "description": "run 156 experiment", "timestamp": "2024-04-10T09:00:00Z"}
{"session": "session_1", "metric": "perf_score", "unit": "points", "direction": "higher", "run": 58, "value": 63.62, "status": "crash", "description": "run 157 experiment", "timestamp": "2024-05-10T09:00:00Z"}
{"session": "session_1", "metric": "perf_score", "unit": "points", "direction": "higher", "run": 59, "value": 60.53, "status": "keep", "description": "run 158 experiment", "timestamp": "2024-06-10T09:00:00Z"}
{"session": "session_1", "metric": "perf_score", "unit": "points", "direction": "higher", "run": 60, "value": 60.18, "status": "keep", "description": "run 159 experiment", "timestamp": "2024-07-10T09:00:00Z"}
{"session": "session_1", "metric": "perf_score", "unit": "points", "direction": "higher", "run": 61, "value": 75.27, "status": "keep", "description": "run 160 experiment", "timestamp": "2024-08-10T09:00:00Z"}
{"session": "session_1", "metric": "perf_score", "unit": "points", "direction": "higher", "run": 62, "value": 95.27, "status": "keep", "description": "run 161 experiment", "timestamp": "2024-09-10T09:00:00Z"}
{"session": "session_1", "metric": "perf_score", "unit": "points", "direction": "higher", "run": 63, "value": 54.61, "status": "discard", "description": "run 162 experiment", "timestamp": "2024-01-10T09:00:00Z"}
{"session": "session_1", "metric": "perf_score", "unit": "points", "direction": "higher", "run": 64, "value": 91.47, "status": "keep", "description": "run 163 experiment", "timestamp": "2024-02-10T09:00:00Z"}
{"session": "session_1", "metric": "perf_score", "unit": "points", "direction": "higher", "run": 65, "value": 50.18, "status": "keep", "description": "run 164 experiment", "timestamp": "2024-03-10T09:00:00Z"}
{"session": "session_1", "metric": "perf_score", "unit": "points", "direction": "higher", "run": 66, "value": 81.86, "status": "keep", "description": "run 165 experiment", "timestamp": "2024-04-10T09:00:00Z"}
{"session": "session_1", "metric": "perf_score", "unit": "points", "direction": "higher", "run": 67, "value": 58.08, "status": "discard", "description": "run 166 experiment", "timestamp": "2024-05-10T09:00:00Z"}
{"session": "session_1", "metric": "perf_score", "unit": "points", "direction": "higher", "run": 68, "value": 77.58, "status": "discard", "description": "run 167 experiment", "timestamp": "2024-06-10T09:00:00Z"}
{"session": "session_1", "metric": "perf_score", "unit": "points", "direction": "higher", "run": 69, "value": 78.05, "status": "keep", "description": "run 168 experiment", "timestamp": "2024-07-10T09:00:00Z"}
{"session": "session_1", "metric": "perf_score", "unit": "points", "direction": "higher", "run": 70, "value": 53.76, "status": "keep", "description": "run 169 experiment", "timestamp": "2024-08-10T09:00:00Z"}
{"session": "session_1", "metric": "perf_score", "unit": "points", "direction": "higher", "run": 71, "value": 77.28, "status": "keep", "description": "run 170 experiment", "timestamp": "2024-09-10T09:00:00Z"}
{"session": "session_1", "metric": "perf_score", "unit": "points", "direction": "higher", "run": 72, "value": 79.13, "status": "keep", "description": "run 171 experiment", "timestamp": "2024-01-10T09:00:00Z"}
{"session": "session_1", "metric": "perf_score", "unit": "points", "direction": "higher", "run": 73, "value": 71.49, "status": "keep", "description": "run 172 experiment", "timestamp": "2024-02-10T09:00:00Z"}
{"session": "session_1", "metric": "perf_score", "unit": "points", "direction": "higher", "run": 74, "value": 65.41, "status": "keep", "description": "run 173 experiment", "timestamp": "2024-03-10T09:00:00Z"}
{"session": "session_1", "metric": "perf_score", "unit": "points", "direction": "higher", "run": 75, "value": 94.95, "status": "keep", "description": "run 174 experiment", "timestamp": "2024-04-10T09:00:00Z"}
{"session": "session_1", "metric": "perf_score", "unit": "points", "direction": "higher", "run": 76, "value": 84.1, "status": "keep", "description": "run 175 experiment", "timestamp": "2024-05-10T09:00:00Z"}
{"session": "session_1", "metric": "perf_score", "unit": "points", "direction": "higher", "run": 77, "value": 67.68, "status": "crash", "description": "run 176 experiment", "timestamp": "2024-06-10T09:00:00Z"}
{"session": "session_1", "metric": "perf_score", "unit": "points", "direction": "higher", "run": 78, "value": 94.21, "status": "discard", "description": "run 177 experiment", "timestamp": "2024-07-10T09:00:00Z"}
{"session": "session_1", "metric": "perf_score", "unit": "points", "direction": "higher", "run": 79, "value": 98.69, "status": "keep", "description": "run 178 experiment", "timestamp": "2024-08-10T09:00:00Z"}
{"session": "session_1", "metric": "perf_score", "unit": "points", "direction": "higher", "run": 80, "value": 96.29, "status": "keep", "description": "run 179 experiment", "timestamp": "2024-09-10T09:00:00Z"}
{"session": "session_1", "metric": "perf_score", "unit": "points", "direction": "higher", "run": 81, "value": 93.23, "status": "keep", "description": "run 180 experiment", "timestamp": "2024-01-10T09:00:00Z"}
{"session": "session_1", "metric": "perf_score", "unit": "points", "direction": "higher", "run": 82, "value": 94.07, "status": "keep", "description": "run 181 experiment", "timestamp": "2024-02-10T09:00:00Z"}
{"session": "session_1", "metric": "perf_score", "unit": "points", "direction": "higher", "run": 83, "value": 58.97, "status": "keep", "description": "run 182 experiment", "timestamp": "2024-03-10T09:00:00Z"}
{"session": "session_1", "metric": "perf_score", "unit": "points", "direction": "higher", "run": 84, "value": 89.12, "status": "discard", "description": "run 183 experiment", "timestamp": "2024-04-10T09:00:00Z"}
{"session": "session_1", "metric": "perf_score", "unit": "points", "direction": "higher", "run": 85, "value": 90.11, "status": "keep", "description": "run 184 experiment", "timestamp": "2024-05-10T09:00:00Z"}
{"session": "session_1", "metric": "perf_score", "unit": "points", "direction": "higher", "run": 86, "value": 63.34, "status": "keep", "description": "run 185 experiment", "timestamp": "2024-06-10T09:00:00Z"}
{"session": "session_1", "metric": "perf_score", "unit": "points", "direction": "higher", "run": 87, "value": 69.13, "status": "keep", "description": "run 186 experiment", "timestamp": "2024-07-10T09:00:00Z"}
{"session": "session_1", "metric": "perf_score", "unit": "points", "direction": "higher", "run": 88, "value": 92.93, "status": "keep", "description": "run 187 experiment", "timestamp": "2024-08-10T09:00:00Z"}
{"session": "session_1", "metric": "perf_score", "unit": "points", "direction": "higher", "run": 89, "value": 59.98, "status": "discard", "description": "run 188 experiment", "timestamp": "2024-09-10T09:00:00Z"}
{"session": "session_1", "metric": "perf_score", "unit": "points", "direction": "higher", "run": 90, "value": 67.48, "status": "keep", "description": "run 189 experiment", "timestamp": "2024-01-10T09:00:00Z"}
{"session": "session_1", "metric": "perf_score", "unit": "points", "direction": "higher", "run": 91, "value": 61.15, "status": "keep", "description": "run 190 experiment", "timestamp": "2024-02-10T09:00:00Z"}
{"session": "session_1", "metric": "perf_score", "unit": "points", "direction": "higher", "run": 92, "value": 69.92, "status": "keep", "description": "run 191 experiment", "timestamp": "2024-03-10T09:00:00Z"}
{"session": "session_1", "metric": "perf_score", "unit": "points", "direction": "higher", "run": 93, "value": 93.22, "status": "keep", "description": "run 192 experiment", "timestamp": "2024-04-10T09:00:00Z"}
{"session": "session_1", "metric": "perf_score", "unit": "points", "direction": "higher", "run": 94, "value": 67.56, "status": "crash", "description": "run 193 experiment", "timestamp": "2024-05-10T09:00:00Z"}
{"session": "session_1", "metric": "perf_score", "unit": "points", "direction": "higher", "run": 95, "value": 69.98, "status": "crash", "description": "run 194 experiment", "timestamp": "2024-06-10T09:00:00Z"}
{"session": "session_1", "metric": "perf_score", "unit": "points", "direction": "higher", "run": 96, "value": 66.56, "status": "keep", "description": "run 195 experiment", "timestamp": "2024-07-10T09:00:00Z"}
{"session": "session_1", "metric": "perf_score", "unit": "points", "direction": "higher", "run": 97, "value": 55.77, "status": "keep", "description": "run 196 experiment", "timestamp": "2024-08-10T09:00:00Z"}
{"session": "session_1", "metric": "perf_score", "unit": "points", "direction": "higher", "run": 98, "value": 58.93, "status": "keep", "description": "run 197 experiment", "timestamp": "2024-09-10T09:00:00Z"}
{"session": "session_1", "metric": "perf_score", "unit": "points", "direction": "higher", "run": 99, "value": 51.91, "status": "crash", "description": "run 198 experiment", "timestamp": "2024-01-10T09:00:00Z"}
{"session": "session_1", "metric": "perf_score", "unit": "points", "direction": "higher", "run": 100, "value": 71.73, "status": "keep", "description": "run 199 experiment", "timestamp": "2024-02-10T09:00:00Z"}
{"session": "session_2", "metric": "perf_score", "unit": "points", "direction": "higher", "run": 1, "value": 71.82, "status": "crash", "description": "run 200 experiment", "timestamp": "2024-03-10T09:00:00Z"}
{"session": "session_2", "metric": "perf_score", "unit": "points", "direction": "higher", "run": 2, "value": 55.78, "status": "crash", "description": "run 201 experiment", "timestamp": "2024-04-10T09:00:00Z"}
{"session": "session_2", "metric": "perf_score", "unit": "points", "direction": "higher", "run": 3, "value": 59.5, "status": "keep", "description": "run 202 experiment", "timestamp": "2024-05-10T09:00:00Z"}
{"session": "session_2", "metric": "perf_score", "unit": "points", "direction": "higher", "run": 4, "value": 85.44, "status": "keep", "description": "run 203 experiment", "timestamp": "2024-06-10T09:00:00Z"}
{"session": "session_2", "metric": "perf_score", "unit": "points", "direction": "higher", "run": 5, "value": 76.0, "status": "crash", "description": "run 204 experiment", "timestamp": "2024-07-10T09:00:00Z"}
{"session": "session_2", "metric": "perf_score", "unit": "points", "direction": "higher", "run": 6, "value": 84.34, "status": "keep", "description": "run 205 experiment", "timestamp": "2024-08-10T09:00:00Z"}
{"session": "session_2", "metric": "perf_score", "unit": "points", "direction": "higher", "run": 7, "value": 68.21, "status": "keep", "description": "run 206 experiment", "timestamp": "2024-09-10T09:00:00Z"}
{"session": "session_2", "metric": "perf_score", "unit": "points", "direction": "higher", "run": 8, "value": 97.44, "status": "keep", "description": "run 207 experiment", "timestamp": "2024-01-10T09:00:00Z"}
{"session": "session_2", "metric": "perf_score", "unit": "points", "direction": "higher", "run": 9, "value": 81.16, "status": "keep", "description": "run 208 experiment", "timestamp": "2024-02-10T09:00:00Z"}
{"session": "session_2", "metric": "perf_score", "unit": "points", "direction": "higher", "run": 10, "value": 85.99, "status": "keep", "description": "run 209 experiment", "timestamp": "2024-03-10T09:00:00Z"}
