{"session": "session_8", "metric": "perf_score", "unit": "points", "direction": "higher", "run": 35, "value": 97.64, "status": "keep", "description": "run 834 experiment", "timestamp": "2024-07-10T09:00:00Z"}
{"session": "session_8", "metric": "perf_score", "unit": "points", "direction": "higher", "run": 36, "value": 92.43, "status": "discard", "description": "run 835 experiment", "timestamp": "2024-08-10T09:00:00Z"}
{"session": "session_8", "metric": "perf_score", "unit": "points", "direction": "higher", "run": 37, "value": 51.74, "status": "keep", "description": "run 836 experiment", "timestamp": "2024-09-10T09:00:00Z"}
{"session": "session_8", "metric": "perf_score", "unit": "points", "direction": "higher", "run": 38, "value": 61.8, "status": "keep", "description": "run 837 experiment", "timestamp": "2024-01-10T09:00:00Z"}
{"session": "session_8", "metric": "perf_score", "unit": "points", "direction": "higher", "run": 39, "value": 68.11, "status": "crash", "description": "run 838 experiment", "timestamp": "2024-02-10T09:00:00Z"}
{"session": "session_8", "metric": "perf_score", "unit": "points", "direction": "higher", "run": 40, "value": 51.62, "status": "keep", "description": "run 839 experiment", "timestamp": "2024-03-10T09:00:00Z"}
{"session": "session_8", "metric": "perf_score", "unit": "points", "direction": "higher", "run": 41, "value": 83.95, "status": "keep", "description": "run 840 experiment", "timestamp": "2024-04-10T09:00:00Z"}
{"session": "session_8", "metric": "perf_score", "unit": "points", "direction": "higher", "run": 42, "value": 68.6, "status": "keep", "description": "run 841 experiment", "timestamp": "2024-05-10T09:00:00Z"}
{"session": "session_8", "metric": "perf_score", "unit": "points", "direction": "higher", "run": 43, "value": 78.7, "status": "crash", "description": "run 842 experiment", "timestamp": "2024-06-10T09:00:00Z"}
{"session": "session_8", "metric": "perf_score", "unit": "points", "direction": "higher", "run": 44, "value": 68.35, "status": "keep", "description": "run 843 experiment", "timestamp": "2024-07-10T09:00:00Z"}
{"session": "session_8", "metric": "perf_score", "unit": "points", "direction": "higher", "run": 45, "value": 82.48, "status": "keep", "description": "run 844 experiment", "timestamp": "2024-08-10T09:00:00Z"}
{"session": "session_8", "metric": "perf_score", "unit": "points", "direction": "higher", "run": 46, "value": 98.03, "status": "keep", "description": "run 845 experiment", "timestamp": "2024-09-10T09:00:00Z"}
{"session": "session_8", "metric": "perf_score", "unit": "points", "direction": "higher", "run": 47, "value": 86.78, "status": "discard", "description": "run 846 experiment", "timestamp": "2024-01-10T09:00:00Z"}
{"session": "session_8", "metric": "perf_score", "unit": "points", "direction": "higher", "run": 48, "value": 75.89, "status": "crash", "description": "run 847 experiment", "timestamp": "2024-02-10T09:00:00Z"}
{"session": "session_8", "metric": "perf_score", "unit": "points", "direction": "higher", "run": 49, "value": 55.89, "status": "keep", "description": "run 848 experiment", "timestamp": "2024-03-10T09:00:00Z"}
{"session": "session_8", "metric": "perf_score", "unit": "points", "direction": "higher", "run": 50, "value": 85.2, "status": "keep", "description": "run 849 experiment", "timestamp": "2024-04-10T09:00:00Z"}
{"session": "session_8", "metric": "perf_score", "unit": "points", "direction": "higher", "run": 51, "value": 99.82, "status": "keep", "description": "run 850 experiment", "timestamp": "2024-05-10T09:00:00Z"}
{"session": "session_8", "metric": "perf_score", "unit": "points", "direction": "higher", "run": 52, "value": 84.7, "status": "discard", "description": "run 851 experiment", "timestamp": "2024-06-10T09:00:00Z"}
{"session": "session_8", "metric": "perf_score", "unit": "points", "direction": "higher", "run": 53, "value": 60.01, "status": "keep", "description": "run 852 experiment", "timestamp": "2024-07-10T09:00:00Z"}
{"session": "session_8", "metric": "perf_score", "unit": "points", "direction": "higher", "run": 54, "value": 92.64, "status": "discard", "description": "run 853 experiment", "timestamp": "2024-08-10T09:00:00Z"}
{"session": "session_8", "metric": "perf_score", "unit": "points", "direction": "higher", "run": 55, "value": 58.63, "status": "discard", "description": "run 854 experiment", "timestamp": "2024-09-10T09:00:00Z"}
{"session": "session_8", "metric": "perf_score", "unit": "points", "direction": "higher", "run": 56, "value": 99.86, "status": "keep", "description": "run 855 experiment", "timestamp": "2024-01-10T09:00:00Z"}
{"session": "session_8", "metric": "perf_score", "unit": "points", "direction": "higher", "run": 57, "value": 83.39, "status": "keep", "description": "run 856 experiment", "timestamp": "2024-02-10T09:00:00Z"}
{"session": "session_8", "metric": "perf_score", "unit": "points", "direction": "higher", "run": 58, "value": 77.5, "status": "keep", "description": "run 857 experiment", "timestamp": "2024-03-10T09:00:00Z"}
{"session": "session_8", "metric": "perf_score", "unit": "points", "direction": "higher", "run": 59, "value": 94.57, "status": "keep", "description": "run 858 experiment", "timestamp": "2024-04-10T09:00:00Z"}
{"session": "session_8", "metric": "perf_score", "unit": "points", "direction": "higher", "run": 60, "value": 85.59, "status": "keep", "description": "run 859 experiment", "timestamp": "2024-05-10T09:00:00Z"}
{"session": "session_8", "metric": "perf_score", "unit": "points", "direction": "higher", "run": 61, "value": 89.68, "status": "crash", "description": "run 860 experiment", "timestamp": "2024-06-10T09:00:00Z"}
{"session": "session_8", "metric": "perf_score", "unit": "points", "direction": "higher", "run": 62, "value": 61.21, "status": "keep", "description": "run 861 experiment", "timestamp": "2024-07-10T09:00:00Z"}
{"session": "session_8", "metric": "perf_score", "unit": "points", "direction": "higher", "run": 63, "value": 89.6, "status": "keep", "description": "run 862 experiment", "timestamp": "2024-08-10T09:00:00Z"}
{"session": "session_8", "metric": "perf_score", "unit": "points", "direction": "higher", "run": 64, "value": 89.52, "status": "keep", "description": "run 863 experiment", "timestamp": "2024-09-10T09:00:00Z"}
{"session": "session_8", "metric": "perf_score", "unit": "points", "direction": "higher", "run": 65, "value": 68.04, "status": "crash", "description": "run 864 experiment", "timestamp": "2024-01-10T09:00:00Z"}
{"session": "session_8", "metric": "perf_score", "unit": "points", "direction": "higher", "run": 66, "value": 68.45, "status": "crash", "description": "run 865 experiment", "timestamp": "2024-02-10T09:00:00Z"}
{"session": "session_8", "metric": "perf_score", "unit": "points", "direction": "higher", "run": 67, "value": 56.49, "status": "keep", "description": "run 866 experiment", "timestamp": "2024-03-10T09:00:00Z"}
{"session": "session_8", "metric": "perf_score", "unit": "points", "direction": "higher", "run": 68, "value": 53.29, "status": "discard", "description": "run 867 experiment", "timestamp": "2024-04-10T09:00:00Z"}
{"session": "session_8", "metric": "perf_score", "unit": "points", "direction": "higher", "run": 69, "value": 99.98, "status": "discard", "description": "run 868 experiment", "timestamp": "2024-05-10T09:00:00Z"}
{"session": "session_8", "metric": "perf_score", "unit": "points", "direction": "higher", "run": 70, "value": 76.28, "status": "discard", "description": "run 869 experiment", "timestamp": "2024-06-10T09:00:00Z"}
{"session": "session_8", "metric": "perf_score", "unit": "points", "direction": "higher", "run": 71, "value": 91.17, "status": "keep", "description": "run 870 experiment", "timestamp": "2024-07-10T09:00:00Z"}
{"session": "session_8", "metric": "perf_score", "unit": "points", "direction": "higher", "run": 72, "value": 56.27, "status": "keep", "description": "run 871 experiment", "timestamp": "2024-08-10T09:00:00Z"}
{"session": "session_8", "metric": "perf_score", "unit": "points", "direction": "higher", "run": 73, "value": 82.12, "status": "discard", "description": "run 872 experiment", "timestamp": "2024-09-10T09:00:00Z"}
{"session": "session_8", "metric": "perf_score", "unit": "points", "direction": "higher", "run": 74, "value": 73.29, "status": "crash", "description": "run 873 experiment", "timestamp": "2024-01-10T09:00:00Z"}
{"session": "session_8", "metric": "perf_score", "unit": "points", "direction": "higher", "run": 75, "value": 67.23, "status": "crash", "description": "run 874 experiment", "timestamp": "2024-02-10T09:00:00Z"}
{"session": "session_8", "metric": "perf_score", "unit": "points", "direction": "higher", "run": 76, "value": 81.99, "status": "keep", "description": "run 875 experiment", "timestamp": "2024-03-10T09:00:00Z"}
{"session": "session_8", "metric": "perf_score", "unit": "points", "direction": "higher", "run": 77, "value": 88.39, "status": "keep", "description": "run 876 experiment", "timestamp": "2024-04-10T09:00:00Z"}
{"session": "session_8", "metric": "perf_score", "unit": "points", "direction": "higher", "run": 78, "value": 71.63, "status": "keep", "description": "run 877 experiment", "timestamp": "2024-05-10T09:00:00Z"}
{"session": "session_8", "metric": "perf_score", "unit": "points", "direction": "higher", "run": 79, "value": 91.57, "status": "crash", "description": "run 878 experiment", "timestamp": "2024-06-10T09:00:00Z"}
{"session": "session_8", "metric": "perf_score", "unit": "points", "direction": "higher", "run": 80, "value": 57.65, "status": "keep", "description": "run 879 experiment", "timestamp": "2024-07-10T09:00:00Z"}
{"session": "session_8", "metric": "perf_score", "unit": "points", "direction": "higher", "run": 81, "value": 58.1, "status": "keep", "description": "run 880 experiment", "timestamp": "2024-08-10T09:00:00Z"}
{"session": "session_8", "metric": "perf_score", "unit": "points", "direction": "higher", "run": 82, "value": 67.3, "status": "crash", "description": "run 881 experiment", "timestamp": "2024-09-10T09:00:00Z"}
{"session": "session_8", "metric": "perf_score", "unit": "points", "direction": "higher", "run": 83, "value": 94.75, "status": "keep", "description": "run 882 experiment", "timestamp": "2024-01-10T09:00:00Z"}
{"session": "session_8", "metric": "perf_score", "unit": "points", "direction": "higher", "run": 84, "value": 62.53, "status": "crash", "description": "run 883 experiment", "timestamp": "2024-02-10T09:00:00Z"}
{"session": "session_8", "metric": "perf_score", "unit": "points", "direction": "higher", "run": 85, "value": 63.72, "status": "keep", "description": "run 884 experiment", "timestamp": "2024-03-10T09:00:00Z"}
{"session": "session_8", "metric": "perf_score", "unit": "points", "direction": "higher", "run": 86, "value": 80.72, "status": "keep", "description": "run 885 experiment", "timestamp": "2024-04-10T09:00:00Z"}
{"session": "session_8", "metric": "perf_score", "unit": "points", "direction": "higher", "run": 87, "value": 75.13, "status": "keep", "description": "run 886 experiment", "timestamp": "2024-05-10T09:00:00Z"}
{"session": "session_8", "metric": "perf_score", "unit": "points", "direction": "higher", "run": 88, "value": 79.59, "status": "crash", "description": "run 887 experiment", "timestamp": "2024-06-10T09:00:00Z"}
{"session": "session_8", "metric": "perf_score", "unit": "points", "direction": "higher", "run": 89, "value": 57.71, "status": "crash", "description": "run 888 experiment", "timestamp": "2024-07-10T09:00:00Z"}
{"session": "session_8", "metric": "perf_score", "unit": "points", "direction": "higher", "run": 90, "value": 86.03, "status": "crash", "description": "run 889 experiment", "timestamp": "2024-08-10T09:00:00Z"}
{"session": "session_8", "metric": "perf_score", "unit": "points", "direction": "higher", "run": 91, "value": 66.88, "status": "crash", "description": "run 890 experiment", "timestamp": "2024-09-10T09:00:00Z"}
{"session": "session_8", "metric": "perf_score", "unit": "points", "direction": "higher", "run": 92, "value": 52.06, "status": "keep", "description": "run 891 experiment", "timestamp": "2024-01-10T09:00:00Z"}
{"session": "session_8", "metric": "perf_score", "unit": "points", "direction": "higher", "run": 93, "value": 54.06, "status": "crash", "description": "run 892 experiment", "timestamp": "2024-02-10T09:00:00Z"}
{"session": "session_8", "metric": "perf_score", "unit": "points", "direction": "higher", "run": 94, "value": 63.23, "status": "keep", "description": "run 893 experiment", "timestamp": "2024-03-10T09:00:00Z"}
{"session": "session_8", "metric": "perf_score", "unit": "points", "direction": "higher", "run": 95, "value": 88.35, "status": "discard", "description": "run 894 experiment", "timestamp": "2024-04-10T09:00:00Z"}
{"session": "session_8", "metric": "perf_score", "unit": "points", "direction": "higher", "run": 96, "value": 80.91, "status": "keep", "description": "run 895 experiment", "timestamp": "2024-05-10T09:00:00Z"}
{"session": "session_8", "metric": "perf_score", "unit": "points", "direction": "higher", "run": 97, "value": 74.9, "status": "crash", "description": "run 896 experiment", "timestamp": "2024-06-10T09:00:00Z"}
{"session": "session_8", "metric": "perf_score", "unit": "points", "direction": "higher", "run": 98, "value": 64.48, "status": "keep", "description": "run 897 experiment", "timestamp": "2024-07-10T09:00:00Z"}
{"session": "session_8", "metric": "perf_score", "unit": "points", "direction": "higher", "run": 99, "value": 74.15, "status": "discard", "description": "run 898 experiment", "timestamp": "2024-08-10T09:00:00Z"}
{"session": "session_8", "metric": "perf_score", "unit": "points", "direction": "higher", "run": 100, "value": 64.87, "status": "keep", "description": "run 899 experiment", "timestamp": "2024-09-10T09:00:00Z"}
{"session": "session_9", "metric": "perf_score", "unit": "points", "direction": "higher", "run": 1, "value": 84.43, "status": "keep", "description": "run 900 experiment", "timestamp": "2024-01-10T09:00:00Z"}
{"session": "session_9", "metric": "perf_score", "unit": "points", "direction": "higher", "run": 2, "value": 71.98, "status": "discard", "description": "run 901 experiment", "timestamp": "2024-02-10T09:00:00Z"}
{"session": "session_9", "metric": "perf_score", "unit": "points", "direction": "higher", "run": 3, "value": 73.22, "status": "keep", "description": "run 902 experiment", "timestamp": "2024-03-10T09:00:00Z"}
{"session": "session_9", "metric": "perf_score", "unit": "points", "direction": "higher", "run": 4, "value": 80.33, "status": "keep", "description": "run 903 experiment", "timestamp": "2024-04-10T09:00:00Z"}
{"session": "session_9", "metric": "perf_score", "unit": "points", "direction": "higher", "run": 5, "value": 93.07, "status": "keep", "description": "run 904 experiment", "timestamp": "2024-05-10T09:00:00Z"}
{"session": "session_9", "metric": "perf_score", "unit": "points", "direction": "higher", "run": 6, "value": 86.71, "status": "keep", "description": "run 905 experiment", "timestamp": "2024-06-10T09:00:00Z"}
{"session": "session_9", "metric": "perf_score", "unit": "points", "direction": "higher", "run": 7, "value": 98.77, "status": "keep", "description": "run 906 experiment", "timestamp": "2024-07-10T09:00:00Z"}
{"session": "session_9", "metric": "perf_score", "unit": "points", "direction": "higher", "run": 8, "value": 88.03, "status": "crash", "description": "run 907 experiment", "timestamp": "2024-08-10T09:00:00Z"}
{"session": "session_9", "metric": "perf_score", "unit": "points", "direction": "higher", "run": 9, "value": 78.08, "status": "keep", "description": "run 908 experiment", "timestamp": "2024-09-10T09:00:00Z"}
{"session": "session_9", "metric": "perf_score", "unit": "points", "direction": "higher", "run": 10, "value": 62.09, "status": "keep", "description": "run 909 experiment", "timestamp": "2024-01-10T09:00:00Z"}
{"session": "session_9", "metric": "perf_score", "unit": "points", "direction": "higher", "run": 11, "value": 63.37, "status": "keep", "description": "run 910 experiment", "timestamp": "2024-02-10T09:00:00Z"}
{"session": "session_9", "metric": "perf_score", "unit": "points", "direction": "higher", "run": 12, "value": 57.04, "status": "keep", "description": "run 911 experiment", "timestamp": "2024-03-10T09:00:00Z"}
{"session": "session_9", "metric": "perf_score", "unit": "points", "direction": "higher", "run": 13, "value": 64.51, "status": "discard", "description": "run 912 experiment", "timestamp": "2024-04-10T09:00:00Z"}
{"session": "session_9", "metric": "perf_score", "unit": "points", "direction": "higher", "run": 14, "value": 93.21, "status": "discard", "description": "run 913 experiment", "timestamp": "2024-05-10T09:00:00Z"}
{"session": "session_9", "metric": "perf_score", "unit": "points", "direction": "higher", "run": 15, "value": 62.41, "status": "keep", "description": "run 914 experiment", "timestamp": "2024-06-10T09:00:00Z"}
{"session": "session_9", "metric": "perf_score", "unit": "points", "direction": "higher", "run": 16, "value": 90.67, "status": "crash", "description": "run 915 experiment", "timestamp": "2024-07-10T09:00:00Z"}
{"session": "session_9", "metric": "perf_score", "unit": "points", "direction": "higher", "run": 17, "value": 86.06, "status": "keep", "description": "run 916 experiment", "timestamp": "2024-08-10T09:00:00Z"}
{"session": "session_9", "metric": "perf_score", "unit": "points", "direction": "higher", "run": 18, "value": 88.16, "status": "discard", "description": "run 917 experiment", "timestamp": "2024-09-10T09:00:00Z"}
{"session": "session_9", "metric": "perf_score", "unit": "points", "direction": "higher", "run": 19, "value": 99.8, "status": "discard", "description": "run 918 experiment", "timestamp": "2024-01-10T09:00:00Z"}
{"session": "session_9", "metric": "perf_score", "unit": "points", "direction": "higher", "run": 20, "value": 74.94, "status": "keep", "description": "run 919 experiment", "timestamp": "2024-02-10T09:00:00Z"}
{"session": "session_9", "metric": "perf_score", "unit": "points", "direction": "higher", "run": 21, "value": 74.87, "status": "keep", "description": "run 920 experiment", "timestamp": "2024-03-10T09:00:00Z"}
{"session": "session_9", "metric": "perf_score", "unit": "points", "direction": "higher", "run": 22, "value": 97.26, "status": "crash", "description": "run 921 experiment", "timestamp": "2024-04-10T09:00:00Z"}
{"session": "session_9", "metric": "perf_score", "unit": "points", "direction": "higher", "run": 23, "value": 72.86, "status": "keep", "description": "run 922 experiment", "timestamp": "2024-05-10T09:00:00Z"}
{"session": "session_9", "metric": "perf_score", "unit": "points", "direction": "higher", "run": 24, "value": 60.76, "status": "keep", "description": "run 923 experiment", "timestamp": "2024-06-10T09:00:00Z"}
{"session": "session_9", "metric": "perf_score", "unit": "points", "direction": "higher", "run": 25, "value": 52.43, "status": "keep", "description": "run 924 experiment", "timestamp": "2024-07-10T09:00:00Z"}
{"session": "session_9", "metric": "perf_score", "unit": "points", "direction": "higher", "run": 26, "value": 74.74, "status": "discard", "description": "run 925 experiment", "timestamp": "2024-08-10T09:00:00Z"}
{"session": "session_9", "metric": "perf_score", "unit": "points", "direction": "higher", "run": 27, "value": 64.29, "status": "keep", "description": "run 926 experiment", "timestamp": "2024-09-10T09:00:00Z"}
{"session": "session_9", "metric": "perf_score", "unit": "points", "direction": "higher", "run": 28, "value": 92.36, "status": "discard", "description": "run 927 experiment", "timestamp": "2024-01-10T09:00:00Z"}
{"session": "session_9", "metric": "perf_score", "unit": "points", "direction": "higher", "run": 29, "value": 56.7, "status": "keep", "description": "run 928 experiment", "timestamp": "2024-02-10T09:00:00Z"}
{"session": "session_9", "metric": "perf_score", "unit": "points", "direction": "higher", "run": 30, "value": 86.38, "status": "discard", "description": "run 929 experiment", "timestamp": "2024-03-10T09:00:00Z"}
{"session": "session_9", "metric": "perf_score", "unit": "points", "direction": "higher", "run": 31, "value": 68.3, "status": "discard", "description": "run 930 experiment", "timestamp": "2024-04-10T09:00:00Z"}
{"session": "session_9", "metric": "perf_score", "unit": "points", "direction": "higher", "run": 32, "value": 52.56, "status": "crash", "description": "run 931 experiment", "timestamp": "2024-05-10T09:00:00Z"}
{"session": "session_9", "metric": "perf_score", "unit": "points", "direction": "higher", "run": 33, "value": 59.73, "status": "crash", "description": "run 932 experiment", "timestamp": "2024-06-10T09:00:00Z"}
{"session": "session_9", "metric": "perf_score", "unit": "points", "direction": "higher", "run": 34, "value": 64.43, "status": "discard", "description": "run 933 experiment", "timestamp": "2024-07-10T09:00:00Z"}
{"session": "session_9", "metric": "perf_score", "unit": "points", "direction": "higher", "run": 35, "value": 75.21, "status": "crash", "description": "run 934 experiment", "timestamp": "2024-08-10T09:00:00Z"}
{"session": "session_9", "metric": "perf_score", "unit": "points", "direction": "higher", "run": 36, "value": 63.99, "status": "crash", "description": "run 935 experiment", "timestamp": "2024-09-10T09:00:00Z"}
{"session": "session_9", "metric": "perf_score", "unit": "points", "direction": "higher", "run": 37, "value": 84.02, "status": "keep", "description": "run 936 experiment", "timestamp": "2024-01-10T09:00:00Z"}
{"session": "session_9", "metric": "perf_score", "unit": "points", "direction": "higher", "run": 38, "value": 56.43, "status": "keep", "description": "run 937 experiment", "timestamp": "2024-02-10T09:00:00Z"}
