{"session": "session_9", "metric": "perf_score", "unit": "points", "direction": "higher", "run": 39, "value": 69.7, "status": "keep", "description": "run 938 experiment", "timestamp": "2024-03-10T09:00:00Z"}
{"session": "session_9", "metric": "perf_score", "unit": "points", "direction": "higher", "run": 40, "value": 77.89, "status": "keep", "description": "run 939 experiment", "timestamp": "2024-04-10T09:00:00Z"}
{"session": "session_9", "metric": "perf_score", "unit": "points", "direction": "higher", "run": 41, "value": 87.75, "status": "keep", "description": "run 940 experiment", "timestamp": "2024-05-10T09:00:00Z"}
{"session": "session_9", "metric": "perf_score", "unit": "points", "direction": "higher", "run": 42, "value": 80.12, "status": "discard", "description": "run 941 experiment", "timestamp": "2024-06-10T09:00:00Z"}
{"session": "session_9", "metric": "perf_score", "unit": "points", "direction": "higher", "run": 43, "value": 75.0, "status": "keep", "description": "run 942 experiment", "timestamp": "2024-07-10T09:00:00Z"}
{"session": "session_9", "metric": "perf_score", "unit": "points", "direction": "higher", "run": 44, "value": 51.95, "status": "keep", "description": "run 943 experiment", "timestamp": "2024-08-10T09:00:00Z"}
{"session": "session_9", "metric": "perf_score", "unit": "points", "direction": "higher", "run": 45, "value": 90.2, "status": "crash", "description": "run 944 experiment", "timestamp": "2024-09-10T09:00:00Z"}
{"session": "session_9", "metric": "perf_score", "unit": "points", "direction": "higher", "run": 46, "value": 72.85, "status": "crash", "description": "run 945 experiment", "timestamp": "2024-01-10T09:00:00Z"}
{"session": "session_9", "metric": "perf_score", "unit": "points", "direction": "higher", "run": 47, "value": 94.66, "status": "keep", "description": "run 946 experiment", "timestamp": "2024-02-10T09:00:00Z"}
{"session": "session_9", "metric": "perf_score", "unit": "points", "direction": "higher", "run": 48, "value": 66.4, "status": "crash", "description": "run 947 experiment", "timestamp": "2024-03-10T09:00:00Z"}
{"session": "session_9", "metric": "perf_score", "unit": "points", "direction": "higher", "run": 49, "value": 65.93, "status": "discard", "description": "run 948 experiment", "timestamp": "2024-04-10T09:00:00Z"}
{"session": "session_9", "metric": "perf_score", "unit": "points", "direction": "higher", "run": 50, "value": 99.53, "status": "keep", "description": "run 949 experiment", "timestamp": "2024-05-10T09:00:00Z"}
{"session": "session_9", "metric": "perf_score", "unit": "points", "direction": "higher", "run": 51, "value": 79.69, "status": "crash", "description": "run 950 experiment", "timestamp": "2024-06-10T09:00:00Z"}
{"session": "session_9", "metric": "perf_score", "unit": "points", "direction": "higher", "run": 52, "value": 91.41, "status": "crash", "description": "run 951 experiment", "timestamp": "2024-07-10T09:00:00Z"}
{"session": "session_9", "metric": "perf_score", "unit": "points", "direction": "higher", "run": 53, "value": 74.49, "status": "crash", "description": "run 952 experiment", "timestamp": "2024-08-10T09:00:00Z"}
{"session": "session_9", "metric": "perf_score", "unit": "points", "direction": "higher", "run": 54, "value": 64.99, "status": "keep", "description": "run 953 experiment", "timestamp": "2024-09-10T09:00:00Z"}
{"session": "session_9", "metric": "perf_score", "unit": "points", "direction": "higher", "run": 55, "value": 68.42, "status": "keep", "description": "run 954 experiment", "timestamp": "2024-01-10T09:00:00Z"}
{"session": "session_9", "metric": "perf_score", "unit": "points", "direction": "higher", "run": 56, "value": 98.99, "status": "crash", "description": "run 955 experiment", "timestamp": "2024-02-10T09:00:00Z"}
{"session": "session_9", "metric": "perf_score", "unit": "points", "direction": "higher", "run": 57, "value": 65.38, "status": "keep", "description": "run 956 experiment", "timestamp": "2024-03-10T09:00:00Z"}
{"session": "session_9", "metric": "perf_score", "unit": "points", "direction": "higher", "run": 58, "value": 79.85, "status": "keep", "description": "run 957 experiment", "timestamp": "2024-04-10T09:00:00Z"}
{"session": "session_9", "metric": "perf_score", "unit": "points", "direction": "higher", "run": 59, "value": 98.35, "status": "crash", "description": "run 958 experiment", "timestamp": "2024-05-10T09:00:00Z"}
{"session": "session_9", "metric": "perf_score", "unit": "points", "direction": "higher", "run": 60, "value": 78.88, "status": "keep", "description": "run 959 experiment", "timestamp": "2024-06-10T09:00:00Z"}
{"session": "session_9", "metric": "perf_score", "unit": "points", "direction": "higher", "run": 61, "value": 79.18, "status": "keep", "description": "run 960 experiment", "timestamp": "2024-07-10T09:00:00Z"}
{"session": "session_9", "metric": "perf_score", "unit": "points", "direction": "higher", "run": 62, "value": 76.21, "status": "crash", "description": "run 961 experiment", "timestamp": "2024-08-10T09:00:00Z"}
{"session": "session_9", "metric": "perf_score", "unit": "points", "direction": "higher", "run": 63, "value": 88.73, "status": "discard", "description": "run 962 experiment", "timestamp": "2024-09-10T09:00:00Z"}
{"session": "session_9", "metric": "perf_score", "unit": "points", "direction": "higher", "run": 64, "value": 57.39, "status": "keep", "description": "run 963 experiment", "timestamp": "2024-01-10T09:00:00Z"}
{"session": "session_9", "metric": "perf_score", "unit": "points", "direction": "higher", "run": 65, "value": 51.58, "status": "keep", "description": "run 964 experiment", "timestamp": "2024-02-10T09:00:00Z"}
{"session": "session_9", "metric": "perf_score", "unit": "points", "direction": "higher", "run": 66, "value": 59.54, "status": "discard", "description": "run 965 experiment", "timestamp": "2024-03-10T09:00:00Z"}
{"session": "session_9", "metric": "perf_score", "unit": "points", "direction": "higher", "run": 67, "value": 65.68, "status": "keep", "description": "run 966 experiment", "timestamp": "2024-04-10T09:00:00Z"}
{"session": "session_9", "metric": "perf_score", "unit": "points", "direction": "higher", "run": 68, "value": 70.65, "status": "keep", "description": "run 967 experiment", "timestamp": "2024-05-10T09:00:00Z"}
{"session": "session_9", "metric": "perf_score", "unit": "points", "direction": "higher", "run": 69, "value": 70.52, "status": "crash", "description": "run 968 experiment", "timestamp": "2024-06-10T09:00:00Z"}
{"session": "session_9", "metric": "perf_score", "unit": "points", "direction": "higher", "run": 70, "value": 96.03, "status": "keep", "description": "run 969 experiment", "timestamp": "2024-07-10T09:00:00Z"}
{"session": "session_9", "metric": "perf_score", "unit": "points", "direction": "higher", "run": 71, "value": 85.29, "status": "crash", "description": "run 970 experiment", "timestamp": "2024-08-10T09:00:00Z"}
{"session": "session_9", "metric": "perf_score", "unit": "points", "direction": "higher", "run": 72, "value": 60.37, "status": "keep", "description": "run 971 experiment", "timestamp": "2024-09-10T09:00:00Z"}
{"session": "session_9", "metric": "perf_score", "unit": "points", "direction": "higher", "run": 73, "value": 99.91, "status": "discard", "description": "run 972 experiment", "timestamp": "2024-01-10T09:00:00Z"}
{"session": "session_9", "metric": "perf_score", "unit": "points", "direction": "higher", "run": 74, "value": 76.27, "status": "keep", "description": "run 973 experiment", "timestamp": "2024-02-10T09:00:00Z"}
{"session": "session_9", "metric": "perf_score", "unit": "points", "direction": "higher", "run": 75, "value": 97.83, "status": "discard", "description": "run 974 experiment", "timestamp": "2024-03-10T09:00:00Z"}
{"session": "session_9", "metric": "perf_score", "unit": "points", "direction": "higher", "run": 76, "value": 95.61, "status": "keep", "description": "run 975 experiment", "timestamp": "2024-04-10T09:00:00Z"}
{"session": "session_9", "metric": "perf_score", "unit": "points", "direction": "higher", "run": 77, "value": 77.31, "status": "keep", "description": "run 976 experiment", "timestamp": "2024-05-10T09:00:00Z"}
{"session": "session_9", "metric": "perf_score", "unit": "points", "direction": "higher", "run": 78, "value": 80.5, "status": "keep", "description": "run 977 experiment", "timestamp": "2024-06-10T09:00:00Z"}
{"session": "session_9", "metric": "perf_score", "unit": "points", "direction": "higher", "run": 79, "value": 97.87, "status": "keep", "description": "run 978 experiment", "timestamp": "2024-07-10T09:00:00Z"}
{"session": "session_9", "metric": "perf_score", "unit": "points", "direction": "higher", "run": 80, "value": 77.9, "status": "keep", "description": "run 979 experiment", "timestamp": "2024-08-10T09:00:00Z"}
{"session": "session_9", "metric": "perf_score", "unit": "points", "direction": "higher", "run": 81, "value": 97.07, "status": "keep", "description": "run 980 experiment", "timestamp": "2024-09-10T09:00:00Z"}
{"session": "session_9", "metric": "perf_score", "unit": "points", "direction": "higher", "run": 82, "value": 88.56, "status": "keep", "description": "run 981 experiment", "timestamp": "2024-01-10T09:00:00Z"}
{"session": "session_9", "metric": "perf_score", "unit": "points", "direction": "higher", "run": 83, "value": 84.51, "status": "discard", "description": "run 982 experiment", "timestamp": "2024-02-10T09:00:00Z"}
{"session": "session_9", "metric": "perf_score", "unit": "points", "direction": "higher", "run": 84, "value": 65.85, "status": "keep", "description": "run 983 experiment", "timestamp": "2024-03-10T09:00:00Z"}
{"session": "session_9", "metric": "perf_score", "unit": "points", "direction": "higher", "run": 85, "value": 78.02, "status": "keep", "description": "run 984 experiment", "timestamp": "2024-04-10T09:00:00Z"}
{"session": "session_9", "metric": "perf_score", "unit": "points", "direction": "higher", "run": 86, "value": 64.39, "status": "crash", "description": "run 985 experiment", "timestamp": "2024-05-10T09:00:00Z"}
{"session": "session_9", "metric": "perf_score", "unit": "points", "direction": "higher", "run": 87, "value": 83.83, "status": "discard", "description": "run 986 experiment", "timestamp": "2024-06-10T09:00:00Z"}
{"session": "session_9", "metric": "perf_score", "unit": "points", "direction": "higher", "run": 88, "value": 94.79, "status": "discard", "description": "run 987 experiment", "timestamp": "2024-07-10T09:00:00Z"}
{"session": "session_9", "metric": "perf_score", "unit": "points", "direction": "higher", "run": 89, "value": 90.92, "status": "keep", "description": "run 988 experiment", "timestamp": "2024-08-10T09:00:00Z"}
{"session": "session_9", "metric": "perf_score", "unit": "points", "direction": "higher", "run": 90, "value": 64.52, "status": "keep", "description": "run 989 experiment", "timestamp": "2024-09-10T09:00:00Z"}
{"session": "session_9", "metric": "perf_score", "unit": "points", "direction": "higher", "run": 91, "value": 97.77, "status": "keep", "description": "run 990 experiment", "timestamp": "2024-01-10T09:00:00Z"}
{"session": "session_9", "metric": "perf_score", "unit": "points", "direction": "higher", "run": 92, "value": 67.32, "status": "discard", "description": "run 991 experiment", "timestamp": "2024-02-10T09:00:00Z"}
{"session": "session_9", "metric": "perf_score", "unit": "points", "direction": "higher", "run": 93, "value": 82.8, "status": "discard", "description": "run 992 experiment", "timestamp": "2024-03-10T09:00:00Z"}
{"session": "session_9", "metric": "perf_score", "unit": "points", "direction": "higher", "run": 94, "value": 60.7, "status": "crash", "description": "run 993 experiment", "timestamp": "2024-04-10T09:00:00Z"}
{"session": "session_9", "metric": "perf_score", "unit": "points", "direction": "higher", "run": 95, "value": 63.56, "status": "crash", "description": "run 994 experiment", "timestamp": "2024-05-10T09:00:00Z"}
{"session": "session_9", "metric": "perf_score", "unit": "points", "direction": "higher", "run": 96, "value": 84.81, "status": "keep", "description": "run 995 experiment", "timestamp": "2024-06-10T09:00:00Z"}
{"session": "session_9", "metric": "perf_score", "unit": "points", "direction": "higher", "run": 97, "value": 55.46, "status": "crash", "description": "run 996 experiment", "timestamp": "2024-07-10T09:00:00Z"}
{"session": "session_9", "metric": "perf_score", "unit": "points", "direction": "higher", "run": 98, "value": 61.96, "status": "keep", "description": "run 997 experiment", "timestamp": "2024-08-10T09:00:00Z"}
{"session": "session_9", "metric": "perf_score", "unit": "points", "direction": "higher", "run": 99, "value": 83.49, "status": "crash", "description": "run 998 experiment", "timestamp": "2024-09-10T09:00:00Z"}
{"session": "session_9", "metric": "perf_score", "unit": "points", "direction": "higher", "run": 100, "value": 61.28, "status": "keep", "description": "run 999 experiment", "timestamp": "2024-01-10T09:00:00Z"}