{"session": "session_6", "metric": "perf_score", "unit": "points", "direction": "higher", "run": 27, "value": 80.68, "status": "crash", "description": "run 626 experiment", "timestamp": "2024-06-10T09:00:00Z"}
{"session": "session_6", "metric": "perf_score", "unit": "points", "direction": "higher", "run": 28, "value": 51.31, "status": "keep", "description": "run 627 experiment", "timestamp": "2024-07-10T09:00:00Z"}
{"session": "session_6", "metric": "perf_score", "unit": "points", "direction": "higher", "run": 29, "value": 51.45, "status": "keep", "description": "run 628 experiment", "timestamp": "2024-08-10T09:00:00Z"}
{"session": "session_6", "metric": "perf_score", "unit": "points", "direction": "higher", "run": 30, "value": 85.13, "status": "keep", "description": "run 629 experiment", "timestamp": "2024-09-10T09:00:00Z"}
{"session": "session_6", "metric": "perf_score", "unit": "points", "direction": "higher", "run": 31, "value": 96.08, "status": "keep", "description": "run 630 experiment", "timestamp": "2024-01-10T09:00:00Z"}
{"session": "session_6", "metric": "perf_score", "unit": "points", "direction": "higher", "run": 32, "value": 50.31, "status": "keep", "description": "run 631 experiment", "timestamp": "2024-02-10T09:00:00Z"}
{"session": "session_6", "metric": "perf_score", "unit": "points", "direction": "higher", "run": 33, "value": 78.32, "status": "discard", "description": "run 632 experiment", "timestamp": "2024-03-10T09:00:00Z"}
{"session": "session_6", "metric": "perf_score", "unit": "points", "direction": "higher", "run": 34, "value": 53.48, "status": "keep", "description": "run 633 experiment", "timestamp": "2024-04-10T09:00:00Z"}
{"session": "session_6", "metric": "perf_score", "unit": "points", "direction": "higher", "run": 35, "value": 54.59, "status": "crash", "description": "run 634 experiment", "timestamp": "2024-05-10T09:00:00Z"}
{"session": "session_6", "metric": "perf_score", "unit": "points", "direction": "higher", "run": 36, "value": 60.76, "status": "discard", "description": "run 635 experiment", "timestamp": "2024-06-10T09:00:00Z"}
{"session": "session_6", "metric": "perf_score", "unit": "points", "direction": "higher", "run": 37, "value": 72.68, "status": "keep", "description": "run 636 experiment", "timestamp": "2024-07-10T09:00:00Z"}
{"session": "session_6", "metric": "perf_score", "unit": "points", "direction": "higher", "run": 38, "value": 68.5, "status": "keep", "description": "run 637 experiment", "timestamp": "2024-08-10T09:00:00Z"}
{"session": "session_6", "metric": "perf_score", "unit": "points", "direction": "higher", "run": 39, "value": 88.84, "status": "crash", "description": "run 638 experiment", "timestamp": "2024-09-10T09:00:00Z"}
{"session": "session_6", "metric": "perf_score", "unit": "points", "direction": "higher", "run": 40, "value": 79.81, "status": "keep", "description": "run 639 experiment", "timestamp": "2024-01-10T09:00:00Z"}
{"session": "session_6", "metric": "perf_score", "unit": "points", "direction": "higher", "run": 41, "value": 57.78, "status": "crash", "description": "run 640 experiment", "timestamp": "2024-02-10T09:00:00Z"}
{"session": "session_6", "metric": "perf_score", "unit": "points", "direction": "higher", "run": 42, "value": 52.49, "status": "keep", "description": "run 641 experiment", "timestamp": "2024-03-10T09:00:00Z"}
{"session": "session_6", "metric": "perf_score", "unit": "points", "direction": "higher", "run": 43, "value": 63.61, "status": "discard", "description": "run 642 experiment", "timestamp": "2024-04-10T09:00:00Z"}
{"session": "session_6", "metric": "perf_score", "unit": "points", "direction": "higher", "run": 44, "value": 74.28, "status": "discard", "description": "run 643 experiment", "timestamp": "2024-05-10T09:00:00Z"}
{"session": "session_6", "metric": "perf_score", "unit": "points", "direction": "higher", "run": 45, "value": 70.71, "status": "keep", "description": "run 644 experiment", "timestamp": "2024-06-10T09:00:00Z"}
{"session": "session_6", "metric": "perf_score", "unit": "points", "direction": "higher", "run": 46, "value": 87.75, "status": "keep", "description": "run 645 experiment", "timestamp": "2024-07-10T09:00:00Z"}
{"session": "session_6", "metric": "perf_score", "unit": "points", "direction": "higher", "run": 47, "value": 67.26, "status": "keep", "description": "run 646 experiment", "timestamp": "2024-08-10T09:00:00Z"}
{"session": "session_6", "metric": "perf_score", "unit": "points", "direction": "higher", "run": 48, "value": 64.16, "status": "crash", "description": "run 647 experiment", "timestamp": "2024-09-10T09:00:00Z"}
{"session": "session_6", "metric": "perf_score", "unit": "points", "direction": "higher", "run": 49, "value": 74.33, "status": "keep", "description": "run 648 experiment", "timestamp": "2024-01-10T09:00:00Z"}
{"session": "session_6", "metric": "perf_score", "unit": "points", "direction": "higher", "run": 50, "value": 52.27, "status": "discard", "description": "run 649 experiment", "timestamp": "2024-02-10T09:00:00Z"}
{"session": "session_6", "metric": "perf_score", "unit": "points", "direction": "higher", "run": 51, "value": 99.22, "status": "keep", "description": "run 650 experiment", "timestamp": "2024-03-10T09:00:00Z"}
{"session": "session_6", "metric": "perf_score", "unit": "points", "direction": "higher", "run": 52, "value": 50.38, "status": "keep", "description": "run 651 experiment", "timestamp": "2024-04-10T09:00:00Z"}
{"session": "session_6", "metric": "perf_score", "unit": "points", "direction": "higher", "run": 53, "value": 97.27, "status": "keep", "description": "run 652 experiment", "timestamp": "2024-05-10T09:00:00Z"}
{"session": "session_6", "metric": "perf_score", "unit": "points", "direction": "higher", "run": 54, "value": 88.21, "status": "keep", "description": "run 653 experiment", "timestamp": "2024-06-10T09:00:00Z"}
{"session": "session_6", "metric": "perf_score", "unit": "points", "direction": "higher", "run": 55, "value": 66.41, "status": "keep", "description": "run 654 experiment", "timestamp": "2024-07-10T09:00:00Z"}
{"session": "session_6", "metric": "perf_score", "unit": "points", "direction": "higher", "run": 56, "value": 74.87, "status": "discard", "description": "run 655 experiment", "timestamp": "2024-08-10T09:00:00Z"}
{"session": "session_6", "metric": "perf_score", "unit": "points", "direction": "higher", "run": 57, "value": 58.78, "status": "discard", "description": "run 656 experiment", "timestamp": "2024-09-10T09:00:00Z"}
{"session": "session_6", "metric": "perf_score", "unit": "points", "direction": "higher", "run": 58, "value": 76.63, "status": "keep", "description": "run 657 experiment", "timestamp": "2024-01-10T09:00:00Z"}
{"session": "session_6", "metric": "perf_score", "unit": "points", "direction": "higher", "run": 59, "value": 75.01, "status": "keep", "description": "run 658 experiment", "timestamp": "2024-02-10T09:00:00Z"}
{"session": "session_6", "metric": "perf_score", "unit": "points", "direction": "higher", "run": 60, "value": 53.6, "status": "keep", "description": "run 659 experiment", "timestamp": "2024-03-10T09:00:00Z"}
{"session": "session_6", "metric": "perf_score", "unit": "points", "direction": "higher", "run": 61, "value": 71.81, "status": "discard", "description": "run 660 experiment", "timestamp": "2024-04-10T09:00:00Z"}
{"session": "session_6", "metric": "perf_score", "unit": "points", "direction": "higher", "run": 62, "value": 96.06, "status": "keep", "description": "run 661 experiment", "timestamp": "2024-05-10T09:00:00Z"}
{"session": "session_6", "metric": "perf_score", "unit": "points", "direction": "higher", "run": 63, "value": 78.79, "status": "crash", "description": "run 662 experiment", "timestamp": "2024-06-10T09:00:00Z"}
{"session": "session_6", "metric": "perf_score", "unit": "points", "direction": "higher", "run": 64, "value": 70.22, "status": "discard", "description": "run 663 experiment", "timestamp": "2024-07-10T09:00:00Z"}
{"session": "session_6", "metric": "perf_score", "unit": "points", "direction": "higher", "run": 65, "value": 64.48, "status": "discard", "description": "run 664 experiment", "timestamp": "2024-08-10T09:00:00Z"}
{"session": "session_6", "metric": "perf_score", "unit": "points", "direction": "higher", "run": 66, "value": 51.04, "status": "keep", "description": "run 665 experiment", "timestamp": "2024-09-10T09:00:00Z"}
{"session": "session_6", "metric": "perf_score", "unit": "points", "direction": "higher", "run": 67, "value": 58.59, "status": "crash", "description": "run 666 experiment", "timestamp": "2024-01-10T09:00:00Z"}
{"session": "session_6", "metric": "perf_score", "unit": "points", "direction": "higher", "run": 68, "value": 73.0, "status": "keep", "description": "run 667 experiment", "timestamp": "2024-02-10T09:00:00Z"}
{"session": "session_6", "metric": "perf_score", "unit": "points", "direction": "higher", "run": 69, "value": 54.41, "status": "keep", "description": "run 668 experiment", "timestamp": "2024-03-10T09:00:00Z"}
{"session": "session_6", "metric": "perf_score", "unit": "points", "direction": "higher", "run": 70, "value": 62.17, "status": "crash", "description": "run 669 experiment", "timestamp": "2024-04-10T09:00:00Z"}
{"session": "session_6", "metric": "perf_score", "unit": "points", "direction": "higher", "run": 71, "value": 70.02, "status": "keep", "description": "run 670 experiment", "timestamp": "2024-05-10T09:00:00Z"}
{"session": "session_6", "metric": "perf_score", "unit": "points", "direction": "higher", "run": 72, "value": 69.79, "status": "keep", "description": "run 671 experiment", "timestamp": "2024-06-10T09:00:00Z"}
{"session": "session_6", "metric": "perf_score", "unit": "points", "direction": "higher", "run": 73, "value": 87.29, "status": "keep", "description": "run 672 experiment", "timestamp": "2024-07-10T09:00:00Z"}
{"session": "session_6", "metric": "perf_score", "unit": "points", "direction": "higher", "run": 74, "value": 66.65, "status": "keep", "description": "run 673 experiment", "timestamp": "2024-08-10T09:00:00Z"}
{"session": "session_6", "metric": "perf_score", "unit": "points", "direction": "higher", "run": 75, "value": 53.82, "status": "keep", "description": "run 674 experiment", "timestamp": "2024-09-10T09:00:00Z"}
{"session": "session_6", "metric": "perf_score", "unit": "points", "direction": "higher", "run": 76, "value": 76.53, "status": "keep", "description": "run 675 experiment", "timestamp": "2024-01-10T09:00:00Z"}
{"session": "session_6", "metric": "perf_score", "unit": "points", "direction": "higher", "run": 77, "value": 95.3, "status": "keep", "description": "run 676 experiment", "timestamp": "2024-02-10T09:00:00Z"}
{"session": "session_6", "metric": "perf_score", "unit": "points", "direction": "higher", "run": 78, "value": 67.55, "status": "keep", "description": "run 677 experiment", "timestamp": "2024-03-10T09:00:00Z"}
{"session": "session_6", "metric": "perf_score", "unit": "points", "direction": "higher", "run": 79, "value": 61.81, "status": "keep", "description": "run 678 experiment", "timestamp": "2024-04-10T09:00:00Z"}
{"session": "session_6", "metric": "perf_score", "unit": "points", "direction": "higher", "run": 80, "value": 62.8, "status": "keep", "description": "run 679 experiment", "timestamp": "2024-05-10T09:00:00Z"}
{"session": "session_6", "metric": "perf_score", "unit": "points", "direction": "higher", "run": 81, "value": 80.12, "status": "keep", "description": "run 680 experiment", "timestamp": "2024-06-10T09:00:00Z"}
{"session": "session_6", "metric": "perf_score", "unit": "points", "direction": "higher", "run": 82, "value": 58.86, "status": "discard", "description": "run 681 experiment", "timestamp": "2024-07-10T09:00:00Z"}
{"session": "session_6", "metric": "perf_score", "unit": "points", "direction": "higher", "run": 83, "value": 73.2, "status": "crash", "description": "run 682 experiment", "timestamp": "2024-08-10T09:00:00Z"}
{"session": "session_6", "metric": "perf_score", "unit": "points", "direction": "higher", "run": 84, "value": 87.99, "status": "discard", "description": "run 683 experiment", "timestamp": "2024-09-10T09:00:00Z"}
{"session": "session_6", "metric": "perf_score", "unit": "points", "direction": "higher", "run": 85, "value": 84.06, "status": "crash", "description": "run 684 experiment", "timestamp": "2024-01-10T09:00:00Z"}
{"session": "session_6", "metric": "perf_score", "unit": "points", "direction": "higher", "run": 86, "value": 82.15, "status": "crash", "description": "run 685 experiment", "timestamp": "2024-02-10T09:00:00Z"}
{"session": "session_6", "metric": "perf_score", "unit": "points", "direction": "higher", "run": 87, "value": 66.16, "status": "keep", "description": "run 686 experiment", "timestamp": "2024-03-10T09:00:00Z"}
{"session": "session_6", "metric": "perf_score", "unit": "points", "direction": "higher", "run": 88, "value": 57.55, "status": "keep", "description": "run 687 experiment", "timestamp": "2024-04-10T09:00:00Z"}
{"session": "session_6", "metric": "perf_score", "unit": "points", "direction": "higher", "run": 89, "value": 73.45, "status": "keep", "description": "run 688 experiment", "timestamp": "2024-05-10T09:00:00Z"}
{"session": "session_6", "metric": "perf_score", "unit": "points", "direction": "higher", "run": 90, "value": 89.82, "status": "crash", "description": "run 689 experiment", "timestamp": "2024-06-10T09:00:00Z"}
{"session": "session_6", "metric": "perf_score", "unit": "points", "direction": "higher", "run": 91, "value": 52.81, "status": "crash", "description": "run 690 experiment", "timestamp": "2024-07-10T09:00:00Z"}
{"session": "session_6", "metric": "perf_score", "unit": "points", "direction": "higher", "run": 92, "value": 53.71, "status": "discard", "description": "run 691 experiment", "timestamp": "2024-08-10T09:00:00Z"}
{"session": "session_6", "metric": "perf_score", "unit": "points", "direction": "higher", "run": 93, "value": 72.6, "status": "keep", "description": "run 692 experiment", "timestamp": "2024-09-10T09:00:00Z"}
{"session": "session_6", "metric": "perf_score", "unit": "points", "direction": "higher", "run": 94, "value": 68.44, "status": "keep", "description": "run 693 experiment", "timestamp": "2024-01-10T09:00:00Z"}
{"session": "session_6", "metric": "perf_score", "unit": "points", "direction": "higher", "run": 95, "value": 53.84, "status": "keep", "description": "run 694 experiment", "timestamp": "2024-02-10T09:00:00Z"}
{"session": "session_6", "metric": "perf_score", "unit": "points", "direction": "higher", "run": 96, "value": 80.75, "status": "crash", "description": "run 695 experiment", "timestamp": "2024-03-10T09:00:00Z"}
{"session": "session_6", "metric": "perf_score", "unit": "points", "direction": "higher", "run": 97, "value": 69.22, "status": "crash", "description": "run 696 experiment", "timestamp": "2024-04-10T09:00:00Z"}
{"session": "session_6", "metric": "perf_score", "unit": "points", "direction": "higher", "run": 98, "value": 77.72, "status": "keep", "description": "run 697 experiment", "timestamp": "2024-05-10T09:00:00Z"}
{"session": "session_6", "metric": "perf_score", "unit": "points", "direction": "higher", "run": 99, "value": 72.49, "status": "crash", "description": "run 698 experiment", "timestamp": "2024-06-10T09:00:00Z"}
{"session": "session_6", "metric": "perf_score", "unit": "points", "direction": "higher", "run": 100, "value": 82.59, "status": "keep", "description": "run 699 experiment", "timestamp": "2024-07-10T09:00:00Z"}
{"session": "session_7", "metric": "perf_score", "unit": "points", "direction": "higher", "run": 1, "value": 80.25, "status": "crash", "description": "run 700 experiment", "timestamp": "2024-08-10T09:00:00Z"}
{"session": "session_7", "metric": "perf_score", "unit": "points", "direction": "higher", "run": 2, "value": 57.54, "status": "keep", "description": "run 701 experiment", "timestamp": "2024-09-10T09:00:00Z"}
{"session": "session_7", "metric": "perf_score", "unit": "points", "direction": "higher", "run": 3, "value": 72.53, "status": "keep", "description": "run 702 experiment", "timestamp": "2024-01-10T09:00:00Z"}
{"session": "session_7", "metric": "perf_score", "unit": "points", "direction": "higher", "run": 4, "value": 99.12, "status": "keep", "description": "run 703 experiment", "timestamp": "2024-02-10T09:00:00Z"}
{"session": "session_7", "metric": "perf_score", "unit": "points", "direction": "higher", "run": 5, "value": 75.23, "status": "keep", "description": "run 704 experiment", "timestamp": "2024-03-10T09:00:00Z"}
{"session": "session_7", "metric": "perf_score", "unit": "points", "direction": "higher", "run": 6, "value": 51.96, "status": "discard", "description": "run 705 experiment", "timestamp": "2024-04-10T09:00:00Z"}
{"session": "session_7", "metric": "perf_score", "unit": "points", "direction": "higher", "run": 7, "value": 99.55, "status": "crash", "description": "run 706 experiment", "timestamp": "2024-05-10T09:00:00Z"}
{"session": "session_7", "metric": "perf_score", "unit": "points", "direction": "higher", "run": 8, "value": 76.14, "status": "keep", "description": "run 707 experiment", "timestamp": "2024-06-10T09:00:00Z"}
{"session": "session_7", "metric": "perf_score", "unit": "points", "direction": "higher", "run": 9, "value": 68.19, "status": "keep", "description": "run 708 experiment", "timestamp": "2024-07-10T09:00:00Z"}
{"session": "session_7", "metric": "perf_score", "unit": "points", "direction": "higher", "run": 10, "value": 69.37, "status": "keep", "description": "run 709 experiment", "timestamp": "2024-08-10T09:00:00Z"}
{"session": "session_7", "metric": "perf_score", "unit": "points", "direction": "higher", "run": 11, "value": 83.94, "status": "keep", "description": "run 710 experiment", "timestamp": "2024-09-10T09:00:00Z"}
{"session": "session_7", "metric": "perf_score", "unit": "points", "direction": "higher", "run": 12, "value": 89.46, "status": "keep", "description": "run 711 experiment", "timestamp": "2024-01-10T09:00:00Z"}
{"session": "session_7", "metric": "perf_score", "unit": "points", "direction": "higher", "run": 13, "value": 53.3, "status": "keep", "description": "run 712 experiment", "timestamp": "2024-02-10T09:00:00Z"}
{"session": "session_7", "metric": "perf_score", "unit": "points", "direction": "higher", "run": 14, "value": 77.9, "status": "discard", "description": "run 713 experiment", "timestamp": "2024-03-10T09:00:00Z"}
{"session": "session_7", "metric": "perf_score", "unit": "points", "direction": "higher", "run": 15, "value": 64.21, "status": "crash", "description": "run 714 experiment", "timestamp": "2024-04-10T09:00:00Z"}
{"session": "session_7", "metric": "perf_score", "unit": "points", "direction": "higher", "run": 16, "value": 93.66, "status": "keep", "description": "run 715 experiment", "timestamp": "2024-05-10T09:00:00Z"}
{"session": "session_7", "metric": "perf_score", "unit": "points", "direction": "higher", "run": 17, "value": 54.08, "status": "keep", "description": "run 716 experiment", "timestamp": "2024-06-10T09:00:00Z"}
{"session": "session_7", "metric": "perf_score", "unit": "points", "direction": "higher", "run": 18, "value": 95.84, "status": "keep", "description": "run 717 experiment", "timestamp": "2024-07-10T09:00:00Z"}
{"session": "session_7", "metric": "perf_score", "unit": "points", "direction": "higher", "run": 19, "value": 98.38, "status": "discard", "description": "run 718 experiment", "timestamp": "2024-08-10T09:00:00Z"}
{"session": "session_7", "metric": "perf_score", "unit": "points", "direction": "higher", "run": 20, "value": 56.45, "status": "keep", "description": "run 719 experiment", "timestamp": "2024-09-10T09:00:00Z"}
{"session": "session_7", "metric": "perf_score", "unit": "points", "direction": "higher", "run": 21, "value": 65.48, "status": "discard", "description": "run 720 experiment", "timestamp": "2024-01-10T09:00:00Z"}
{"session": "session_7", "metric": "perf_score", "unit": "points", "direction": "higher", "run": 22, "value": 82.17, "status": "keep", "description": "run 721 experiment", "timestamp": "2024-02-10T09:00:00Z"}
{"session": "session_7", "metric": "perf_score", "unit": "points", "direction": "higher", "run": 23, "value": 90.66, "status": "crash", "description": "run 722 experiment", "timestamp": "2024-03-10T09:00:00Z"}
{"session": "session_7", "metric": "perf_score", "unit": "points", "direction": "higher", "run": 24, "value": 54.67, "status": "discard", "description": "run 723 experiment", "timestamp": "2024-04-10T09:00:00Z"}
{"session": "session_7", "metric": "perf_score", "unit": "points", "direction": "higher", "run": 25, "value": 75.42, "status": "keep", "description": "run 724 experiment", "timestamp": "2024-05-10T09:00:00Z"}
{"session": "session_7", "metric": "perf_score", "unit": "points", "direction": "higher", "run": 26, "value": 68.13, "status": "keep", "description": "run 725 experiment", "timestamp": "2024-06-10T09:00:00Z"}
{"session": "session_7", "metric": "perf_score", "unit": "points", "direction": "higher", "run": 27, "value": 97.56, "status": "keep", "description": "run 726 experiment", "timestamp": "2024-07-10T09:00:00Z"}
{"session": "session_7", "metric": "perf_score", "unit": "points", "direction": "higher", "run": 28, "value": 97.38, "status": "discard", "description": "run 727 experiment", "timestamp": "2024-08-10T09:00:00Z"}
{"session": "session_7", "metric": "perf_score", "unit": "points", "direction": "higher", "run": 29, "value": 59.6, "status": "keep", "description": "run 728 experiment", "timestamp": "2024-09-10T09:00:00Z"}
{"session": "session_7", "metric": "perf_score", "unit": "points", "direction": "higher", "run": 30, "value": 57.75, "status": "keep", "description": "run 729 experiment", "timestamp": "2024-01-10T09:00:00Z"}
