{"session": "session_3", "metric": "perf_score", "unit": "points", "direction": "higher", "run": 15, "value": 98.27, "status": "keep", "description": "run 314 experiment", "timestamp": "2024-09-10T09:00:00Z"}
{"session": "session_3", "metric": "perf_score", "unit": "points", "direction": "higher", "run": 16, "value": 80.8, "status": "crash", "description": "run 315 experiment", "timestamp": "2024-01-10T09:00:00Z"}
{"session": "session_3", "metric": "perf_score", "unit": "points", "direction": "higher", "run": 17, "value": 88.73, "status": "discard", "description": "run 316 experiment", "timestamp": "2024-02-10T09:00:00Z"}
{"session": "session_3", "metric": "perf_score", "unit": "points", "direction": "higher", "run": 18, "value": 71.78, "status": "crash", "description": "run 317 experiment", "timestamp": "2024-03-10T09:00:00Z"}
{"session": "session_3", "metric": "perf_score", "unit": "points", "direction": "higher", "run": 19, "value": 63.42, "status": "keep", "description": "run 318 experiment", "timestamp": "2024-04-10T09:00:00Z"}
{"session": "session_3", "metric": "perf_score", "unit": "points", "direction": "higher", "run": 20, "value": 91.54, "status": "keep", "description": "run 319 experiment", "timestamp": "2024-05-10T09:00:00Z"}
{"session": "session_3", "metric": "perf_score", "unit": "points", "direction": "higher", "run": 21, "value": 63.95, "status": "discard", "description": "run 320 experiment", "timestamp": "2024-06-10T09:00:00Z"}
{"session": "session_3", "metric": "perf_score", "unit": "points", "direction": "higher", "run": 22, "value": 62.19, "status": "discard", "description": "run 321 experiment", "timestamp": "2024-07-10T09:00:00Z"}
{"session": "session_3", "metric": "perf_score", "unit": "points", "direction": "higher", "run": 23, "value": 78.49, "status": "discard", "description": "run 322 experiment", "timestamp": "2024-08-10T09:00:00Z"}
{"session": "session_3", "metric": "perf_score", "unit": "points", "direction": "higher", "run": 24, "value": 66.82, "status": "discard", "description": "run 323 experiment", "timestamp": "2024-09-10T09:00:00Z"}
{"session": "session_3", "metric": "perf_score", "unit": "points", "direction": "higher", "run": 25, "value": 92.55, "status": "keep", "description": "run 324 experiment", "timestamp": "2024-01-10T09:00:00Z"}
{"session": "session_3", "metric": "perf_score", "unit": "points", "direction": "higher", "run": 26, "value": 74.38, "status": "keep", "description": "run 325 experiment", "timestamp": "2024-02-10T09:00:00Z"}
{"session": "session_3", "metric": "perf_score", "unit": "points", "direction": "higher", "run": 27, "value": 89.89, "status": "keep", "description": "run 326 experiment", "timestamp": "2024-03-10T09:00:00Z"}
{"session": "session_3", "metric": "perf_score", "unit": "points", "direction": "higher", "run": 28, "value": 63.98, "status": "crash", "description": "run 327 experiment", "timestamp": "2024-04-10T09:00:00Z"}
{"session": "session_3", "metric": "perf_score", "unit": "points", "direction": "higher", "run": 29, "value": 85.06, "status": "keep", "description": "run 328 experiment", "timestamp": "2024-05-10T09:00:00Z"}
{"session": "session_3", "metric": "perf_score", "unit": "points", "direction": "higher", "run": 30, "value": 77.79, "status": "crash", "description": "run 329 experiment", "timestamp": "2024-06-10T09:00:00Z"}
{"session": "session_3", "metric": "perf_score", "unit": "points", "direction": "higher", "run": 31, "value": 97.4, "status": "keep", "description": "run 330 experiment", "timestamp": "2024-07-10T09:00:00Z"}
{"session": "session_3", "metric": "perf_score", "unit": "points", "direction": "higher", "run": 32, "value": 62.07, "status": "discard", "description": "run 331 experiment", "timestamp": "2024-08-10T09:00:00Z"}
{"session": "session_3", "metric": "perf_score", "unit": "points", "direction": "higher", "run": 33, "value": 74.43, "status": "keep", "description": "run 332 experiment", "timestamp": "2024-09-10T09:00:00Z"}
{"session": "session_3", "metric": "perf_score", "unit": "points", "direction": "higher", "run": 34, "value": 84.53, "status": "discard", "description": "run 333 experiment", "timestamp": "2024-01-10T09:00:00Z"}
{"session": "session_3", "metric": "perf_score", "unit": "points", "direction": "higher", "run": 35, "value": 72.41, "status": "keep", "description": "run 334 experiment", "timestamp": "2024-02-10T09:00:00Z"}
{"session": "session_3", "metric": "perf_score", "unit": "points", "direction": "higher", "run": 36, "value": 54.65, "status": "keep", "description": "run 335 experiment", "timestamp": "2024-03-10T09:00:00Z"}
{"session": "session_3", "metric": "perf_score", "unit": "points", "direction": "higher", "run": 37, "value": 70.22, "status": "keep", "description": "run 336 experiment", "timestamp": "2024-04-10T09:00:00Z"}
{"session": "session_3", "metric": "perf_score", "unit": "points", "direction": "higher", "run": 38, "value": 65.31, "status": "crash", "description": "run 337 experiment", "timestamp": "2024-05-10T09:00:00Z"}
{"session": "session_3", "metric": "perf_score", "unit": "points", "direction": "higher", "run": 39, "value": 68.45, "status": "crash", "description": "run 338 experiment", "timestamp": "2024-06-10T09:00:00Z"}
{"session": "session_3", "metric": "perf_score", "unit": "points", "direction": "higher", "run": 40, "value": 76.55, "status": "discard", "description": "run 339 experiment", "timestamp": "2024-07-10T09:00:00Z"}
{"session": "session_3", "metric": "perf_score", "unit": "points", "direction": "higher", "run": 41, "value": 99.83, "status": "crash", "description": "run 340 experiment", "timestamp": "2024-08-10T09:00:00Z"}
{"session": "session_3", "metric": "perf_score", "unit": "points", "direction": "higher", "run": 42, "value": 66.54, "status": "discard", "description": "run 341 experiment", "timestamp": "2024-09-10T09:00:00Z"}
{"session": "session_3", "metric": "perf_score", "unit": "points", "direction": "higher", "run": 43, "value": 63.55, "status": "keep", "description": "run 342 experiment", "timestamp": "2024-01-10T09:00:00Z"}
{"session": "session_3", "metric": "perf_score", "unit": "points", "direction": "higher", "run": 44, "value": 61.53, "status": "keep", "description": "run 343 experiment", "timestamp": "2024-02-10T09:00:00Z"}
{"session": "session_3", "metric": "perf_score", "unit": "points", "direction": "higher", "run": 45, "value": 65.78, "status": "crash", "description": "run 344 experiment", "timestamp": "2024-03-10T09:00:00Z"}
{"session": "session_3", "metric": "perf_score", "unit": "points", "direction": "higher", "run": 46, "value": 97.54, "status": "keep", "description": "run 345 experiment", "timestamp": "2024-04-10T09:00:00Z"}
{"session": "session_3", "metric": "perf_score", "unit": "points", "direction": "higher", "run": 47, "value": 59.58, "status": "discard", "description": "run 346 experiment", "timestamp": "2024-05-10T09:00:00Z"}
{"session": "session_3", "metric": "perf_score", "unit": "points", "direction": "higher", "run": 48, "value": 63.82, "status": "crash", "description": "run 347 experiment", "timestamp": "2024-06-10T09:00:00Z"}
{"session": "session_3", "metric": "perf_score", "unit": "points", "direction": "higher", "run": 49, "value": 98.83, "status": "crash", "description": "run 348 experiment", "timestamp": "2024-07-10T09:00:00Z"}
{"session": "session_3", "metric": "perf_score", "unit": "points", "direction": "higher", "run": 50, "value": 79.84, "status": "keep", "description": "run 349 experiment", "timestamp": "2024-08-10T09:00:00Z"}
{"session": "session_3", "metric": "perf_score", "unit": "points", "direction": "higher", "run": 51, "value": 91.63, "status": "keep", "description": "run 350 experiment", "timestamp": "2024-09-10T09:00:00Z"}
{"session": "session_3", "metric": "perf_score", "unit": "points", "direction": "higher", "run": 52, "value": 61.37, "status": "keep", "description": "run 351 experiment", "timestamp": "2024-01-10T09:00:00Z"}
{"session": "session_3", "metric": "perf_score", "unit": "points", "direction": "higher", "run": 53, "value": 65.11, "status": "crash", "description": "run 352 experiment", "timestamp": "2024-02-10T09:00:00Z"}
{"session": "session_3", "metric": "perf_score", "unit": "points", "direction": "higher", "run": 54, "value": 56.33, "status": "keep", "description": "run 353 experiment", "timestamp": "2024-03-10T09:00:00Z"}
{"session": "session_3", "metric": "perf_score", "unit": "points", "direction": "higher", "run": 55, "value": 98.71, "status": "crash", "description": "run 354 experiment", "timestamp": "2024-04-10T09:00:00Z"}
{"session": "session_3", "metric": "perf_score", "unit": "points", "direction": "higher", "run": 56, "value": 64.61, "status": "keep", "description": "run 355 experiment", "timestamp": "2024-05-10T09:00:00Z"}
{"session": "session_3", "metric": "perf_score", "unit": "points", "direction": "higher", "run": 57, "value": 81.89, "status": "discard", "description": "run 356 experiment", "timestamp": "2024-06-10T09:00:00Z"}
{"session": "session_3", "metric": "perf_score", "unit": "points", "direction": "higher", "run": 58, "value": 55.13, "status": "keep", "description": "run 357 experiment", "timestamp": "2024-07-10T09:00:00Z"}
{"session": "session_3", "metric": "perf_score", "unit": "points", "direction": "higher", "run": 59, "value": 78.7, "status": "discard", "description": "run 358 experiment", "timestamp": "2024-08-10T09:00:00Z"}
{"session": "session_3", "metric": "perf_score", "unit": "points", "direction": "higher", "run": 60, "value": 73.94, "status": "keep", "description": "run 359 experiment", "timestamp": "2024-09-10T09:00:00Z"}
{"session": "session_3", "metric": "perf_score", "unit": "points", "direction": "higher", "run": 61, "value": 59.22, "status": "keep", "description": "run 360 experiment", "timestamp": "2024-01-10T09:00:00Z"}
{"session": "session_3", "metric": "perf_score", "unit": "points", "direction": "higher", "run": 62, "value": 62.62, "status": "discard", "description": "run 361 experiment", "timestamp": "2024-02-10T09:00:00Z"}
{"session": "session_3", "metric": "perf_score", "unit": "points", "direction": "higher", "run": 63, "value": 55.7, "status": "keep", "description": "run 362 experiment", "timestamp": "2024-03-10T09:00:00Z"}
{"session": "session_3", "metric": "perf_score", "unit": "points", "direction": "higher", "run": 64, "value": 70.04, "status": "keep", "description": "run 363 experiment", "timestamp": "2024-04-10T09:00:00Z"}
{"session": "session_3", "metric": "perf_score", "unit": "points", "direction": "higher", "run": 65, "value": 78.85, "status": "keep", "description": "run 364 experiment", "timestamp": "2024-05-10T09:00:00Z"}
{"session": "session_3", "metric": "perf_score", "unit": "points", "direction": "higher", "run": 66, "value": 57.59, "status": "crash", "description": "run 365 experiment", "timestamp": "2024-06-10T09:00:00Z"}
{"session": "session_3", "metric": "perf_score", "unit": "points", "direction": "higher", "run": 67, "value": 97.46, "status": "keep", "description": "run 366 experiment", "timestamp": "2024-07-10T09:00:00Z"}
{"session": "session_3", "metric": "perf_score", "unit": "points", "direction": "higher", "run": 68, "value": 99.7, "status": "keep", "description": "run 367 experiment", "timestamp": "2024-08-10T09:00:00Z"}
{"session": "session_3", "metric": "perf_score", "unit": "points", "direction": "higher", "run": 69, "value": 77.9, "status": "discard", "description": "run 368 experiment", "timestamp": "2024-09-10T09:00:00Z"}
{"session": "session_3", "metric": "perf_score", "unit": "points", "direction": "higher", "run": 70, "value": 80.32, "status": "crash", "description": "run 369 experiment", "timestamp": "2024-01-10T09:00:00Z"}
{"session": "session_3", "metric": "perf_score", "unit": "points", "direction": "higher", "run": 71, "value": 61.28, "status": "crash", "description": "run 370 experiment", "timestamp": "2024-02-10T09:00:00Z"}
{"session": "session_3", "metric": "perf_score", "unit": "points", "direction": "higher", "run": 72, "value": 69.02, "status": "discard", "description": "run 371 experiment", "timestamp": "2024-03-10T09:00:00Z"}
{"session": "session_3", "metric": "perf_score", "unit": "points", "direction": "higher", "run": 73, "value": 64.87, "status": "crash", "description": "run 372 experiment", "timestamp": "2024-04-10T09:00:00Z"}
{"session": "session_3", "metric": "perf_score", "unit": "points", "direction": "higher", "run": 74, "value": 99.5, "status": "keep", "description": "run 373 experiment", "timestamp": "2024-05-10T09:00:00Z"}
{"session": "session_3", "metric": "perf_score", "unit": "points", "direction": "higher", "run": 75, "value": 78.43, "status": "keep", "description": "run 374 experiment", "timestamp": "2024-06-10T09:00:00Z"}
{"session": "session_3", "metric": "perf_score", "unit": "points", "direction": "higher", "run": 76, "value": 80.48, "status": "keep", "description": "run 375 experiment", "timestamp": "2024-07-10T09:00:00Z"}
{"session": "session_3", "metric": "perf_score", "unit": "points", "direction": "higher", "run": 77, "value": 97.38, "status": "keep", "description": "run 376 experiment", "timestamp": "2024-08-10T09:00:00Z"}
{"session": "session_3", "metric": "perf_score", "unit": "points", "direction": "higher", "run": 78, "value": 81.28, "status": "keep", "description": "run 377 experiment", "timestamp": "2024-09-10T09:00:00Z"}
{"session": "session_3", "metric": "perf_score", "unit": "points", "direction": "higher", "run": 79, "value": 83.02, "status": "keep", "description": "run 378 experiment", "timestamp": "2024-01-10T09:00:00Z"}
{"session": "session_3", "metric": "perf_score", "unit": "points", "direction": "higher", "run": 80, "value": 61.99, "status": "crash", "description": "run 379 experiment", "timestamp": "2024-02-10T09:00:00Z"}
{"session": "session_3", "metric": "perf_score", "unit": "points", "direction": "higher", "run": 81, "value": 53.75, "status": "keep", "description": "run 380 experiment", "timestamp": "2024-03-10T09:00:00Z"}
{"session": "session_3", "metric": "perf_score", "unit": "points", "direction": "higher", "run": 82, "value": 70.43, "status": "crash", "description": "run 381 experiment", "timestamp": "2024-04-10T09:00:00Z"}
{"session": "session_3", "metric": "perf_score", "unit": "points", "direction": "higher", "run": 83, "value": 73.5, "status": "keep", "description": "run 382 experiment", "timestamp": "2024-05-10T09:00:00Z"}
{"session": "session_3", "metric": "perf_score", "unit": "points", "direction": "higher", "run": 84, "value": 61.57, "status": "keep", "description": "run 383 experiment", "timestamp": "2024-06-10T09:00:00Z"}
{"session": "session_3", "metric": "perf_score", "unit": "points", "direction": "higher", "run": 85, "value": 85.15, "status": "discard", "description": "run 384 experiment", "timestamp": "2024-07-10T09:00:00Z"}
{"session": "session_3", "metric": "perf_score", "unit": "points", "direction": "higher", "run": 86, "value": 53.56, "status": "keep", "description": "run 385 experiment", "timestamp": "2024-08-10T09:00:00Z"}
{"session": "session_3", "metric": "perf_score", "unit": "points", "direction": "higher", "run": 87, "value": 96.2, "status": "crash", "description": "run 386 experiment", "timestamp": "2024-09-10T09:00:00Z"}
{"session": "session_3", "metric": "perf_score", "unit": "points", "direction": "higher", "run": 88, "value": 83.06, "status": "keep", "description": "run 387 experiment", "timestamp": "2024-01-10T09:00:00Z"}
{"session": "session_3", "metric": "perf_score", "unit": "points", "direction": "higher", "run": 89, "value": 71.26, "status": "crash", "description": "run 388 experiment", "timestamp": "2024-02-10T09:00:00Z"}
{"session": "session_3", "metric": "perf_score", "unit": "points", "direction": "higher", "run": 90, "value": 61.24, "status": "keep", "description": "run 389 experiment", "timestamp": "2024-03-10T09:00:00Z"}
{"session": "session_3", "metric": "perf_score", "unit": "points", "direction": "higher", "run": 91, "value": 95.42, "status": "keep", "description": "run 390 experiment", "timestamp": "2024-04-10T09:00:00Z"}
{"session": "session_3", "metric": "perf_score", "unit": "points", "direction": "higher", "run": 92, "value": 53.57, "status": "keep", "description": "run 391 experiment", "timestamp": "2024-05-10T09:00:00Z"}
{"session": "session_3", "metric": "perf_score", "unit": "points", "direction": "higher", "run": 93, "value": 89.63, "status": "crash", "description": "run 392 experiment", "timestamp": "2024-06-10T09:00:00Z"}
{"session": "session_3", "metric": "perf_score", "unit": "points", "direction": "higher", "run": 94, "value": 87.45, "status": "crash", "description": "run 393 experiment", "timestamp": "2024-07-10T09:00:00Z"}
{"session": "session_3", "metric": "perf_score", "unit": "points", "direction": "higher", "run": 95, "value": 96.06, "status": "discard", "description": "run 394 experiment", "timestamp": "2024-08-10T09:00:00Z"}
{"session": "session_3", "metric": "perf_score", "unit": "points", "direction": "higher", "run": 96, "value": 56.22, "status": "keep", "description": "run 395 experiment", "timestamp": "2024-09-10T09:00:00Z"}
{"session": "session_3", "metric": "perf_score", "unit": "points", "direction": "higher", "run": 97, "value": 84.99, "status": "keep", "description": "run 396 experiment", "timestamp": "2024-01-10T09:00:00Z"}
{"session": "session_3", "metric": "perf_score", "unit": "points", "direction": "higher", "run": 98, "value": 75.02, "status": "discard", "description": "run 397 experiment", "timestamp": "2024-02-10T09:00:00Z"}
{"session": "session_3", "metric": "perf_score", "unit": "points", "direction": "higher", "run": 99, "value": 71.89, "status": "crash", "description": "run 398 experiment", "timestamp": "2024-03-10T09:00:00Z"}
{"session": "session_3", "metric": "perf_score", "unit": "points", "direction": "higher", "run": 100, "value": 51.99, "status": "discard", "description": "run 399 experiment", "timestamp": "2024-04-10T09:00:00Z"}
{"session": "session_4", "metric": "perf_score", "unit": "points", "direction": "higher", "run": 1, "value": 86.73, "status": "crash", "description": "run 400 experiment", "timestamp": "2024-05-10T09:00:00Z"}
{"session": "session_4", "metric": "perf_score", "unit": "points", "direction": "higher", "run": 2, "value": 62.52, "status": "keep", "description": "run 401 experiment", "timestamp": "2024-06-10T09:00:00Z"}
{"session": "session_4", "metric": "perf_score", "unit": "points", "direction": "higher", "run": 3, "value": 61.45, "status": "crash", "description": "run 402 experiment", "timestamp": "2024-07-10T09:00:00Z"}
{"session": "session_4", "metric": "perf_score", "unit": "points", "direction": "higher", "run": 4, "value": 79.36, "status": "keep", "description": "run 403 experiment", "timestamp": "2024-08-10T09:00:00Z"}
{"session": "session_4", "metric": "perf_score", "unit": "points", "direction": "higher", "run": 5, "value": 99.98, "status": "keep", "description": "run 404 experiment", "timestamp": "2024-09-10T09:00:00Z"}
{"session": "session_4", "metric": "perf_score", "unit": "points", "direction": "higher", "run": 6, "value": 78.81, "status": "keep", "description": "run 405 experiment", "timestamp": "2024-01-10T09:00:00Z"}
{"session": "session_4", "metric": "perf_score", "unit": "points", "direction": "higher", "run": 7, "value": 73.53, "status": "discard", "description": "run 406 experiment", "timestamp": "2024-02-10T09:00:00Z"}
{"session": "session_4", "metric": "perf_score", "unit": "points", "direction": "higher", "run": 8, "value": 95.8, "status": "keep", "description": "run 407 experiment", "timestamp": "2024-03-10T09:00:00Z"}
{"session": "session_4", "metric": "perf_score", "unit": "points", "direction": "higher", "run": 9, "value": 99.85, "status": "discard", "description": "run 408 experiment", "timestamp": "2024-04-10T09:00:00Z"}
{"session": "session_4", "metric": "perf_score", "unit": "points", "direction": "higher", "run": 10, "value": 81.74, "status": "discard", "description": "run 409 experiment", "timestamp": "2024-05-10T09:00:00Z"}
{"session": "session_4", "metric": "perf_score", "unit": "points", "direction": "higher", "run": 11, "value": 98.45, "status": "discard", "description": "run 410 experiment", "timestamp": "2024-06-10T09:00:00Z"}
{"session": "session_4", "metric": "perf_score", "unit": "points", "direction": "higher", "run": 12, "value": 67.4, "status": "keep", "description": "run 411 experiment", "timestamp": "2024-07-10T09:00:00Z"}
{"session": "session_4", "metric": "perf_score", "unit": "points", "direction": "higher", "run": 13, "value": 66.05, "status": "keep", "description": "run 412 experiment", "timestamp": "2024-08-10T09:00:00Z"}
{"session": "session_4", "metric": "perf_score", "unit": "points", "direction": "higher", "run": 14, "value": 92.89, "status": "keep", "description": "run 413 experiment", "timestamp": "2024-09-10T09:00:00Z"}
{"session": "session_4", "metric": "perf_score", "unit": "points", "direction": "higher", "run": 15, "value": 70.58, "status": "discard", "description": "run 414 experiment", "timestamp": "2024-01-10T09:00:00Z"}
{"session": "session_4", "metric": "perf_score", "unit": "points", "direction": "higher", "run": 16, "value": 64.41, "status": "discard", "description": "run 415 experiment", "timestamp": "2024-02-10T09:00:00Z"}
{"session": "session_4", "metric": "perf_score", "unit": "points", "direction": "higher", "run": 17, "value": 90.68, "status": "crash", "description": "run 416 experiment", "timestamp": "2024-03-10T09:00:00Z"}
{"session": "session_4", "metric": "perf_score", "unit": "points", "direction": "higher", "run": 18, "value": 51.83, "status": "keep", "description": "run 417 experiment", "timestamp": "2024-04-10T09:00:00Z"}
