{"session": "session_5", "metric": "perf_score", "unit": "points", "direction": "higher", "run": 23, "value": 91.52, "status": "keep", "description": "run 522 experiment", "timestamp": "2024-01-10T09:00:00Z"}
{"session": "session_5", "metric": "perf_score", "unit": "points", "direction": "higher", "run": 24, "value": 95.7, "status": "discard", "description": "run 523 experiment", "timestamp": "2024-02-10T09:00:00Z"}
{"session": "session_5", "metric": "perf_score", "unit": "points", "direction": "higher", "run": 25, "value": 98.37, "status": "keep", "description": "run 524 experiment", "timestamp": "2024-03-10T09:00:00Z"}
{"session": "session_5", "metric": "perf_score", "unit": "points", "direction": "higher", "run": 26, "value": 87.33, "status": "keep", "description": "run 525 experiment", "timestamp": "2024-04-10T09:00:00Z"}
{"session": "session_5", "metric": "perf_score", "unit": "points", "direction": "higher", "run": 27, "value": 90.21, "status": "discard", "description": "run 526 experiment", "timestamp": "2024-05-10T09:00:00Z"}
{"session": "session_5", "metric": "perf_score", "unit": "points", "direction": "higher", "run": 28, "value": 98.14, "status": "keep", "description": "run 527 experiment", "timestamp": "2024-06-10T09:00:00Z"}
{"session": "session_5", "metric": "perf_score", "unit": "points", "direction": "higher", "run": 29, "value": 87.71, "status": "keep", "description": "run 528 experiment", "timestamp": "2024-07-10T09:00:00Z"}
{"session": "session_5", "metric": "perf_score", "unit": "points", "direction": "higher", "run": 30, "value": 93.01, "status": "discard", "description": "run 529 experiment", "timestamp": "2024-08-10T09:00:00Z"}
{"session": "session_5", "metric": "perf_score", "unit": "points", "direction": "higher", "run": 31, "value": 98.36, "status": "crash", "description": "run 530 experiment", "timestamp": "2024-09-10T09:00:00Z"}
{"session": "session_5", "metric": "perf_score", "unit": "points", "direction": "higher", "run": 32, "value": 68.29, "status": "discard", "description": "run 531 experiment", "timestamp": "2024-01-10T09:00:00Z"}
{"session": "session_5", "metric": "perf_score", "unit": "points", "direction": "higher", "run": 33, "value": 50.7, "status": "crash", "description": "run 532 experiment", "timestamp": "2024-02-10T09:00:00Z"}
{"session": "session_5", "metric": "perf_score", "unit": "points", "direction": "higher", "run": 34, "value": 56.18, "status": "keep", "description": "run 533 experiment", "timestamp": "2024-03-10T09:00:00Z"}
{"session": "session_5", "metric": "perf_score", "unit": "points", "direction": "higher", "run": 35, "value": 83.64, "status": "keep", "description": "run 534 experiment", "timestamp": "2024-04-10T09:00:00Z"}
{"session": "session_5", "metric": "perf_score", "unit": "points", "direction": "higher", "run": 36, "value": 79.23, "status": "keep", "description": "run 535 experiment", "timestamp": "2024-05-10T09:00:00Z"}
{"session": "session_5", "metric": "perf_score", "unit": "points", "direction": "higher", "run": 37, "value": 55.42, "status": "keep", "description": "run 536 experiment", "timestamp": "2024-06-10T09:00:00Z"}
{"session": "session_5", "metric": "perf_score", "unit": "points", "direction": "higher", "run": 38, "value": 73.57, "status": "crash", "description": "run 537 experiment", "timestamp": "2024-07-10T09:00:00Z"}
{"session": "session_5", "metric": "perf_score", "unit": "points", "direction": "higher", "run": 39, "value": 94.21, "status": "crash", "description": "run 538 experiment", "timestamp": "2024-08-10T09:00:00Z"}
{"session": "session_5", "metric": "perf_score", "unit": "points", "direction": "higher", "run": 40, "value": 66.4, "status": "crash", "description": "run 539 experiment", "timestamp": "2024-09-10T09:00:00Z"}
{"session": "session_5", "metric": "perf_score", "unit": "points", "direction": "higher", "run": 41, "value": 61.07, "status": "keep", "description": "run 540 experiment", "timestamp": "2024-01-10T09:00:00Z"}
{"session": "session_5", "metric": "perf_score", "unit": "points", "direction": "higher", "run": 42, "value": 81.77, "status": "discard", "description": "run 541 experiment", "timestamp": "2024-02-10T09:00:00Z"}
{"session": "session_5", "metric": "perf_score", "unit": "points", "direction": "higher", "run": 43, "value": 95.47, "status": "keep", "description": "run 542 experiment", "timestamp": "2024-03-10T09:00:00Z"}
{"session": "session_5", "metric": "perf_score", "unit": "points", "direction": "higher", "run": 44, "value": 82.46, "status": "keep", "description": "run 543 experiment", "timestamp": "2024-04-10T09:00:00Z"}
{"session": "session_5", "metric": "perf_score", "unit": "points", "direction": "higher", "run": 45, "value": 56.99, "status": "keep", "description": "run 544 experiment", "timestamp": "2024-05-10T09:00:00Z"}
{"session": "session_5", "metric": "perf_score", "unit": "points", "direction": "higher", "run": 46, "value": 65.22, "status": "discard", "description": "run 545 experiment", "timestamp": "2024-06-10T09:00:00Z"}
{"session": "session_5", "metric": "perf_score", "unit": "points", "direction": "higher", "run": 47, "value": 55.81, "status": "keep", "description": "run 546 experiment", "timestamp": "2024-07-10T09:00:00Z"}
{"session": "session_5", "metric": "perf_score", "unit": "points", "direction": "higher", "run": 48, "value": 94.36, "status": "keep", "description": "run 547 experiment", "timestamp": "2024-08-10T09:00:00Z"}
{"session": "session_5", "metric": "perf_score", "unit": "points", "direction": "higher", "run": 49, "value": 69.43, "status": "keep", "description": "run 548 experiment", "timestamp": "2024-09-10T09:00:00Z"}
{"session": "session_5", "metric": "perf_score", "unit": "points", "direction": "higher", "run": 50, "value": 83.52, "status": "crash", "description": "run 549 experiment", "timestamp": "2024-01-10T09:00:00Z"}
{"session": "session_5", "metric": "perf_score", "unit": "points", "direction": "higher", "run": 51, "value": 70.96, "status": "keep", "description": "run 550 experiment", "timestamp": "2024-02-10T09:00:00Z"}
{"session": "session_5", "metric": "perf_score", "unit": "points", "direction": "higher", "run": 52, "value": 94.27, "status": "keep", "description": "run 551 experiment", "timestamp": "2024-03-10T09:00:00Z"}
{"session": "session_5", "metric": "perf_score", "unit": "points", "direction": "higher", "run": 53, "value": 91.68, "status": "crash", "description": "run 552 experiment", "timestamp": "2024-04-10T09:00:00Z"}
{"session": "session_5", "metric": "perf_score", "unit": "points", "direction": "higher", "run": 54, "value": 70.41, "status": "keep", "description": "run 553 experiment", "timestamp": "2024-05-10T09:00:00Z"}
{"session": "session_5", "metric": "perf_score", "unit": "points", "direction": "higher", "run": 55, "value": 51.64, "status": "keep", "description": "run 554 experiment", "timestamp": "2024-06-10T09:00:00Z"}
{"session": "session_5", "metric": "perf_score", "unit": "points", "direction": "higher", "run": 56, "value": 60.86, "status": "discard", "description": "run 555 experiment", "timestamp": "2024-07-10T09:00:00Z"}
{"session": "session_5", "metric": "perf_score", "unit": "points", "direction": "higher", "run": 57, "value": 97.53, "status": "keep", "description": "run 556 experiment", "timestamp": "2024-08-10T09:00:00Z"}
{"session": "session_5", "metric": "perf_score", "unit": "points", "direction": "higher", "run": 58, "value": 54.97, "status": "keep", "description": "run 557 experiment", "timestamp": "2024-09-10T09:00:00Z"}
{"session": "session_5", "metric": "perf_score", "unit": "points", "direction": "higher", "run": 59, "value": 77.22, "status": "keep", "description": "run 558 experiment", "timestamp": "2024-01-10T09:00:00Z"}
{"session": "session_5", "metric": "perf_score", "unit": "points", "direction": "higher", "run": 60, "value": 53.03, "status": "keep", "description": "run 559 experiment", "timestamp": "2024-02-10T09:00:00Z"}
{"session": "session_5", "metric": "perf_score", "unit": "points", "direction": "higher", "run": 61, "value": 59.49, "status": "keep", "description": "run 560 experiment", "timestamp": "2024-03-10T09:00:00Z"}
{"session": "session_5", "metric": "perf_score", "unit": "points", "direction": "higher", "run": 62, "value": 97.45, "status": "discard", "description": "run 561 experiment", "timestamp": "2024-04-10T09:00:00Z"}
{"session": "session_5", "metric": "perf_score", "unit": "points", "direction": "higher", "run": 63, "value": 54.58, "status": "keep", "description": "run 562 experiment", "timestamp": "2024-05-10T09:00:00Z"}
{"session": "session_5", "metric": "perf_score", "unit": "points", "direction": "higher", "run": 64, "value": 82.09, "status": "crash", "description": "run 563 experiment", "timestamp": "2024-06-10T09:00:00Z"}
{"session": "session_5", "metric": "perf_score", "unit": "points", "direction": "higher", "run": 65, "value": 98.55, "status": "keep", "description": "run 564 experiment", "timestamp": "2024-07-10T09:00:00Z"}
{"session": "session_5", "metric": "perf_score", "unit": "points", "direction": "higher", "run": 66, "value": 89.34, "status": "keep", "description": "run 565 experiment", "timestamp": "2024-08-10T09:00:00Z"}
{"session": "session_5", "metric": "perf_score", "unit": "points", "direction": "higher", "run": 67, "value": 99.44, "status": "crash", "description": "run 566 experiment", "timestamp": "2024-09-10T09:00:00Z"}
{"session": "session_5", "metric": "perf_score", "unit": "points", "direction": "higher", "run": 68, "value": 60.26, "status": "crash", "description": "run 567 experiment", "timestamp": "2024-01-10T09:00:00Z"}
{"session": "session_5", "metric": "perf_score", "unit": "points", "direction": "higher", "run": 69, "value": 60.36, "status": "keep", "description": "run 568 experiment", "timestamp": "2024-02-10T09:00:00Z"}
{"session": "session_5", "metric": "perf_score", "unit": "points", "direction": "higher", "run": 70, "value": 90.65, "status": "keep", "description": "run 569 experiment", "timestamp": "2024-03-10T09:00:00Z"}
{"session": "session_5", "metric": "perf_score", "unit": "points", "direction": "higher", "run": 71, "value": 66.43, "status": "keep", "description": "run 570 experiment", "timestamp": "2024-04-10T09:00:00Z"}
{"session": "session_5", "metric": "perf_score", "unit": "points", "direction": "higher", "run": 72, "value": 89.43, "status": "crash", "description": "run 571 experiment", "timestamp": "2024-05-10T09:00:00Z"}
{"session": "session_5", "metric": "perf_score", "unit": "points", "direction": "higher", "run": 73, "value": 50.14, "status": "keep", "description": "run 572 experiment", "timestamp": "2024-06-10T09:00:00Z"}
{"session": "session_5", "metric": "perf_score", "unit": "points", "direction": "higher", "run": 74, "value": 99.38, "status": "crash", "description": "run 573 experiment", "timestamp": "2024-07-10T09:00:00Z"}
{"session": "session_5", "metric": "perf_score", "unit": "points", "direction": "higher", "run": 75, "value": 62.53, "status": "keep", "description": "run 574 experiment", "timestamp": "2024-08-10T09:00:00Z"}
{"session": "session_5", "metric": "perf_score", "unit": "points", "direction": "higher", "run": 76, "value": 55.5, "status": "keep", "description": "run 575 experiment", "timestamp": "2024-09-10T09:00:00Z"}
{"session": "session_5", "metric": "perf_score", "unit": "points", "direction": "higher", "run": 77, "value": 56.59, "status": "keep", "description": "run 576 experiment", "timestamp": "2024-01-10T09:00:00Z"}
{"session": "session_5", "metric": "perf_score", "unit": "points", "direction": "higher", "run": 78, "value": 89.5, "status": "keep", "description": "run 577 experiment", "timestamp": "2024-02-10T09:00:00Z"}
{"session": "session_5", "metric": "perf_score", "unit": "points", "direction": "higher", "run": 79, "value": 79.44, "status": "keep", "description": "run 578 experiment", "timestamp": "2024-03-10T09:00:00Z"}
{"session": "session_5", "metric": "perf_score", "unit": "points", "direction": "higher", "run": 80, "value": 58.71, "status": "keep", "description": "run 579 experiment", "timestamp": "2024-04-10T09:00:00Z"}
{"session": "session_5", "metric": "perf_score", "unit": "points", "direction": "higher", "run": 81, "value": 56.34, "status": "discard", "description": "run 580 experiment", "timestamp": "2024-05-10T09:00:00Z"}
{"session": "session_5", "metric": "perf_score", "unit": "points", "direction": "higher", "run": 82, "value": 76.3, "status": "keep", "description": "run 581 experiment", "timestamp": "2024-06-10T09:00:00Z"}
{"session": "session_5", "metric": "perf_score", "unit": "points", "direction": "higher", "run": 83, "value": 73.81, "status": "keep", "description": "run 582 experiment", "timestamp": "2024-07-10T09:00:00Z"}
{"session": "session_5", "metric": "perf_score", "unit": "points", "direction": "higher", "run": 84, "value": 75.66, "status": "keep", "description": "run 583 experiment", "timestamp": "2024-08-10T09:00:00Z"}
{"session": "session_5", "metric": "perf_score", "unit": "points", "direction": "higher", "run": 85, "value": 72.6, "status": "keep", "description": "run 584 experiment", "timestamp": "2024-09-10T09:00:00Z"}
{"session": "session_5", "metric": "perf_score", "unit": "points", "direction": "higher", "run": 86, "value": 97.27, "status": "keep", "description": "run 585 experiment", "timestamp": "2024-01-10T09:00:00Z"}
{"session": "session_5", "metric": "perf_score", "unit": "points", "direction": "higher", "run": 87, "value": 86.36, "status": "crash", "description": "run 586 experiment", "timestamp": "2024-02-10T09:00:00Z"}
{"session": "session_5", "metric": "perf_score", "unit": "points", "direction": "higher", "run": 88, "value": 65.08, "status": "keep", "description": "run 587 experiment", "timestamp": "2024-03-10T09:00:00Z"}
{"session": "session_5", "metric": "perf_score", "unit": "points", "direction": "higher", "run": 89, "value": 53.04, "status": "discard", "description": "run 588 experiment", "timestamp": "2024-04-10T09:00:00Z"}
{"session": "session_5", "metric": "perf_score", "unit": "points", "direction": "higher", "run": 90, "value": 92.36, "status": "discard", "description": "run 589 experiment", "timestamp": "2024-05-10T09:00:00Z"}
{"session": "session_5", "metric": "perf_score", "unit": "points", "direction": "higher", "run": 91, "value": 84.3, "status": "discard", "description": "run 590 experiment", "timestamp": "2024-06-10T09:00:00Z"}
{"session": "session_5", "metric": "perf_score", "unit": "points", "direction": "higher", "run": 92, "value": 85.62, "status": "discard", "description": "run 591 experiment", "timestamp": "2024-07-10T09:00:00Z"}
{"session": "session_5", "metric": "perf_score", "unit": "points", "direction": "higher", "run": 93, "value": 53.67, "status": "keep", "description": "run 592 experiment", "timestamp": "2024-08-10T09:00:00Z"}
{"session": "session_5", "metric": "perf_score", "unit": "points", "direction": "higher", "run": 94, "value": 66.11, "status": "keep", "description": "run 593 experiment", "timestamp": "2024-09-10T09:00:00Z"}
{"session": "session_5", "metric": "perf_score", "unit": "points", "direction": "higher", "run": 95, "value": 53.28, "status": "keep", "description": "run 594 experiment", "timestamp": "2024-01-10T09:00:00Z"}
{"session": "session_5", "metric": "perf_score", "unit": "points", "direction": "higher", "run": 96, "value": 81.22, "status": "crash", "description": "run 595 experiment", "timestamp": "2024-02-10T09:00:00Z"}
{"session": "session_5", "metric": "perf_score", "unit": "points", "direction": "higher", "run": 97, "value": 77.42, "status": "keep", "description": "run 596 experiment", "timestamp": "2024-03-10T09:00:00Z"}
{"session": "session_5", "metric": "perf_score", "unit": "points", "direction": "higher", "run": 98, "value": 69.05, "status": "crash", "description": "run 597 experiment", "timestamp": "2024-04-10T09:00:00Z"}
{"session": "session_5", "metric": "perf_score", "unit": "points", "direction": "higher", "run": 99, "value": 76.53, "status": "discard", "description": "run 598 experiment", "timestamp": "2024-05-10T09:00:00Z"}
{"session": "session_5", "metric": "perf_score", "unit": "points", "direction": "higher", "run": 100, "value": 75.28, "status": "discard", "description": "run 599 experiment", "timestamp": "2024-06-10T09:00:00Z"}
{"session": "session_6", "metric": "perf_score", "unit": "points", "direction": "higher", "run": 1, "value": 54.96, "status": "keep", "description": "run 600 experiment", "timestamp": "2024-07-10T09:00:00Z"}
{"session": "session_6", "metric": "perf_score", "unit": "points", "direction": "higher", "run": 2, "value": 92.64, "status": "crash", "description": "run 601 experiment", "timestamp": "2024-08-10T09:00:00Z"}
{"session": "session_6", "metric": "perf_score", "unit": "points", "direction": "higher", "run": 3, "value": 86.04, "status": "keep", "description": "run 602 experiment", "timestamp": "2024-09-10T09:00:00Z"}
{"session": "session_6", "metric": "perf_score", "unit": "points", "direction": "higher", "run": 4, "value": 71.5, "status": "keep", "description": "run 603 experiment", "timestamp": "2024-01-10T09:00:00Z"}
{"session": "session_6", "metric": "perf_score", "unit": "points", "direction": "higher", "run": 5, "value": 70.69, "status": "discard", "description": "run 604 experiment", "timestamp": "2024-02-10T09:00:00Z"}
{"session": "session_6", "metric": "perf_score", "unit": "points", "direction": "higher", "run": 6, "value": 69.94, "status": "keep", "description": "run 605 experiment", "timestamp": "2024-03-10T09:00:00Z"}
{"session": "session_6", "metric": "perf_score", "unit": "points", "direction": "higher", "run": 7, "value": 65.63, "status": "keep", "description": "run 606 experiment", "timestamp": "2024-04-10T09:00:00Z"}
{"session": "session_6", "metric": "perf_score", "unit": "points", "direction": "higher", "run": 8, "value": 83.26, "status": "keep", "description": "run 607 experiment", "timestamp": "2024-05-10T09:00:00Z"}
{"session": "session_6", "metric": "perf_score", "unit": "points", "direction": "higher", "run": 9, "value": 97.68, "status": "discard", "description": "run 608 experiment", "timestamp": "2024-06-10T09:00:00Z"}
{"session": "session_6", "metric": "perf_score", "unit": "points", "direction": "higher", "run": 10, "value": 53.36, "status": "keep", "description": "run 609 experiment", "timestamp": "2024-07-10T09:00:00Z"}
{"session": "session_6", "metric": "perf_score", "unit": "points", "direction": "higher", "run": 11, "value": 54.66, "status": "keep", "description": "run 610 experiment", "timestamp": "2024-08-10T09:00:00Z"}
{"session": "session_6", "metric": "perf_score", "unit": "points", "direction": "higher", "run": 12, "value": 87.23, "status": "keep", "description": "run 611 experiment", "timestamp": "2024-09-10T09:00:00Z"}
{"session": "session_6", "metric": "perf_score", "unit": "points", "direction": "higher", "run": 13, "value": 90.59, "status": "crash", "description": "run 612 experiment", "timestamp": "2024-01-10T09:00:00Z"}
{"session": "session_6", "metric": "perf_score", "unit": "points", "direction": "higher", "run": 14, "value": 53.0, "status": "crash", "description": "run 613 experiment", "timestamp": "2024-02-10T09:00:00Z"}
{"session": "session_6", "metric": "perf_score", "unit": "points", "direction": "higher", "run": 15, "value": 78.08, "status": "keep", "description": "run 614 experiment", "timestamp": "2024-03-10T09:00:00Z"}
{"session": "session_6", "metric": "perf_score", "unit": "points", "direction": "higher", "run": 16, "value": 70.54, "status": "discard", "description": "run 615 experiment", "timestamp": "2024-04-10T09:00:00Z"}
{"session": "session_6", "metric": "perf_score", "unit": "points", "direction": "higher", "run": 17, "value": 93.4, "status": "keep", "description": "run 616 experiment", "timestamp": "2024-05-10T09:00:00Z"}
{"session": "session_6", "metric": "perf_score", "unit": "points", "direction": "higher", "run": 18, "value": 98.42, "status": "crash", "description": "run 617 experiment", "timestamp": "2024-06-10T09:00:00Z"}
{"session": "session_6", "metric": "perf_score", "unit": "points", "direction": "higher", "run": 19, "value": 65.62, "status": "keep", "description": "run 618 experiment", "timestamp": "2024-07-10T09:00:00Z"}
{"session": "session_6", "metric": "perf_score", "unit": "points", "direction": "higher", "run": 20, "value": 78.9, "status": "keep", "description": "run 619 experiment", "timestamp": "2024-08-10T09:00:00Z"}
{"session": "session_6", "metric": "perf_score", "unit": "points", "direction": "higher", "run": 21, "value": 57.74, "status": "discard", "description": "run 620 experiment", "timestamp": "2024-09-10T09:00:00Z"}
{"session": "session_6", "metric": "perf_score", "unit": "points", "direction": "higher", "run": 22, "value": 61.21, "status": "keep", "description": "run 621 experiment", "timestamp": "2024-01-10T09:00:00Z"}
{"session": "session_6", "metric": "perf_score", "unit": "points", "direction": "higher", "run": 23, "value": 67.51, "status": "crash", "description": "run 622 experiment", "timestamp": "2024-02-10T09:00:00Z"}
{"session": "session_6", "metric": "perf_score", "unit": "points", "direction": "higher", "run": 24, "value": 68.38, "status": "keep", "description": "run 623 experiment", "timestamp": "2024-03-10T09:00:00Z"}
{"session": "session_6", "metric": "perf_score", "unit": "points", "direction": "higher", "run": 25, "value": 78.71, "status": "discard", "description": "run 624 experiment", "timestamp": "2024-04-10T09:00:00Z"}
{"session": "session_6", "metric": "perf_score", "unit": "points", "direction": "higher", "run": 26, "value": 92.26, "status": "crash", "description": "run 625 experiment", "timestamp": "2024-05-10T09:00:00Z"}
