{"session": "session_2", "metric": "perf_score", "unit": "points", "direction": "higher", "run": 11, "value": 75.36, "status": "discard", "description": "run 210 experiment", "timestamp": "2024-04-10T09:00:00Z"}
{"session": "session_2", "metric": "perf_score", "unit": "points", "direction": "higher", "run": 12, "value": 66.31, "status": "keep", "description": "run 211 experiment", "timestamp": "2024-05-10T09:00:00Z"}
{"session": "session_2", "metric": "perf_score", "unit": "points", "direction": "higher", "run": 13, "value": 77.72, "status": "keep", "description": "run 212 experiment", "timestamp": "2024-06-10T09:00:00Z"}
{"session": "session_2", "metric": "perf_score", "unit": "points", "direction": "higher", "run": 14, "value": 71.02, "status": "discard", "description": "run 213 experiment", "timestamp": "2024-07-10T09:00:00Z"}
{"session": "session_2", "metric": "perf_score", "unit": "points", "direction": "higher", "run": 15, "value": 83.87, "status": "keep", "description": "run 214 experiment", "timestamp": "2024-08-10T09:00:00Z"}
{"session": "session_2", "metric": "perf_score", "unit": "points", "direction": "higher", "run": 16, "value": 80.78, "status": "keep", "description": "run 215 experiment", "timestamp": "2024-09-10T09:00:00Z"}
{"session": "session_2", "metric": "perf_score", "unit": "points", "direction": "higher", "run": 17, "value": 70.3, "status": "keep", "description": "run 216 experiment", "timestamp": "2024-01-10T09:00:00Z"}
{"session": "session_2", "metric": "perf_score", "unit": "points", "direction": "higher", "run": 18, "value": 65.19, "status": "keep", "description": "run 217 experiment", "timestamp": "2024-02-10T09:00:00Z"}
{"session": "session_2", "metric": "perf_score", "unit": "points", "direction": "higher", "run": 19, "value": 71.49, "status": "crash", "description": "run 218 experiment", "timestamp": "2024-03-10T09:00:00Z"}
{"session": "session_2", "metric": "perf_score", "unit": "points", "direction": "higher", "run": 20, "value": 80.33, "status": "keep", "description": "run 219 experiment", "timestamp": "2024-04-10T09:00:00Z"}
{"session": "session_2", "metric": "perf_score", "unit": "points", "direction": "higher", "run": 21, "value": 73.25, "status": "discard", "description": "run 220 experiment", "timestamp": "2024-05-10T09:00:00Z"}
{"session": "session_2", "metric": "perf_score", "unit": "points", "direction": "higher", "run": 22, "value": 83.78, "status": "crash", "description": "run 221 experiment", "timestamp": "2024-06-10T09:00:00Z"}
{"session": "session_2", "metric": "perf_score", "unit": "points", "direction": "higher", "run": 23, "value": 73.66, "status": "keep", "description": "run 222 experiment", "timestamp": "2024-07-10T09:00:00Z"}
{"session": "session_2", "metric": "perf_score", "unit": "points", "direction": "higher", "run": 24, "value": 82.94, "status": "keep", "description": "run 223 experiment", "timestamp": "2024-08-10T09:00:00Z"}
{"session": "session_2", "metric": "perf_score", "unit": "points", "direction": "higher", "run": 25, "value": 75.77, "status": "crash", "description": "run 224 experiment", "timestamp": "2024-09-10T09:00:00Z"}
{"session": "session_2", "metric": "perf_score", "unit": "points", "direction": "higher", "run": 26, "value": 66.76, "status": "keep", "description": "run 225 experiment", "timestamp": "2024-01-10T09:00:00Z"}
{"session": "session_2", "metric": "perf_score", "unit": "points", "direction": "higher", "run": 27, "value": 83.64, "status": "keep", "description": "run 226 experiment", "timestamp": "2024-02-10T09:00:00Z"}
{"session": "session_2", "metric": "perf_score", "unit": "points", "direction": "higher", "run": 28, "value": 90.33, "status": "keep", "description": "run 227 experiment", "timestamp": "2024-03-10T09:00:00Z"}
{"session": "session_2", "metric": "perf_score", "unit": "points", "direction": "higher", "run": 29, "value": 51.22, "status": "keep", "description": "run 228 experiment", "timestamp": "2024-04-10T09:00:00Z"}
{"session": "session_2", "metric": "perf_score", "unit": "points", "direction": "higher", "run": 30, "value": 99.2, "status": "crash", "description": "run 229 experiment", "timestamp": "2024-05-10T09:00:00Z"}
{"session": "session_2", "metric": "perf_score", "unit": "points", "direction": "higher", "run": 31, "value": 92.49, "status": "keep", "description": "run 230 experiment", "timestamp": "2024-06-10T09:00:00Z"}
{"session": "session_2", "metric": "perf_score", "unit": "points", "direction": "higher", "run": 32, "value": 72.77, "status": "crash", "description": "run 231 experiment", "timestamp": "2024-07-10T09:00:00Z"}
{"session": "session_2", "metric": "perf_score", "unit": "points", "direction": "higher", "run": 33, "value": 59.72, "status": "discard", "description": "run 232 experiment", "timestamp": "2024-08-10T09:00:00Z"}
{"session": "session_2", "metric": "perf_score", "unit": "points", "direction": "higher", "run": 34, "value": 74.72, "status": "keep", "description": "run 233 experiment", "timestamp": "2024-09-10T09:00:00Z"}
{"session": "session_2", "metric": "perf_score", "unit": "points", "direction": "higher", "run": 35, "value": 57.38, "status": "keep", "description": "run 234 experiment", "timestamp": "2024-01-10T09:00:00Z"}
{"session": "session_2", "metric": "perf_score", "unit": "points", "direction": "higher", "run": 36, "value": 94.63, "status": "keep", "description": "run 235 experiment", "timestamp": "2024-02-10T09:00:00Z"}
{"session": "session_2", "metric": "perf_score", "unit": "points", "direction": "higher", "run": 37, "value": 88.92, "status": "keep", "description": "run 236 experiment", "timestamp": "2024-03-10T09:00:00Z"}
{"session": "session_2", "metric": "perf_score", "unit": "points", "direction": "higher", "run": 38, "value": 58.79, "status": "crash", "description": "run 237 experiment", "timestamp": "2024-04-10T09:00:00Z"}
{"session": "session_2", "metric": "perf_score", "unit": "points", "direction": "higher", "run": 39, "value": 73.23, "status": "crash", "description": "run 238 experiment", "timestamp": "2024-05-10T09:00:00Z"}
{"session": "session_2", "metric": "perf_score", "unit": "points", "direction": "higher", "run": 40, "value": 62.46, "status": "keep", "description": "run 239 experiment", "timestamp": "2024-06-10T09:00:00Z"}
{"session": "session_2", "metric": "perf_score", "unit": "points", "direction": "higher", "run": 41, "value": 72.82, "status": "discard", "description": "run 240 experiment", "timestamp": "2024-07-10T09:00:00Z"}
{"session": "session_2", "metric": "perf_score", "unit": "points", "direction": "higher", "run": 42, "value": 83.38, "status": "crash", "description": "run 241 experiment", "timestamp": "2024-08-10T09:00:00Z"}
{"session": "session_2", "metric": "perf_score", "unit": "points", "direction": "higher", "run": 43, "value": 79.77, "status": "discard", "description": "run 242 experiment", "timestamp": "2024-09-10T09:00:00Z"}
{"session": "session_2", "metric": "perf_score", "unit": "points", "direction": "higher", "run": 44, "value": 80.63, "status": "crash", "description": "run 243 experiment", "timestamp": "2024-01-10T09:00:00Z"}
{"session": "session_2", "metric": "perf_score", "unit": "points", "direction": "higher", "run": 45, "value": 71.34, "status": "crash", "description": "run 244 experiment", "timestamp": "2024-02-10T09:00:00Z"}
{"session": "session_2", "metric": "perf_score", "unit": "points", "direction": "higher", "run": 46, "value": 72.3, "status": "keep", "description": "run 245 experiment", "timestamp": "2024-03-10T09:00:00Z"}
{"session": "session_2", "metric": "perf_score", "unit": "points", "direction": "higher", "run": 47, "value": 87.18, "status": "discard", "description": "run 246 experiment", "timestamp": "2024-04-10T09:00:00Z"}
{"session": "session_2", "metric": "perf_score", "unit": "points", "direction": "higher", "run": 48, "value": 72.5, "status": "keep", "description": "run 247 experiment", "timestamp": "2024-05-10T09:00:00Z"}
{"session": "session_2", "metric": "perf_score", "unit": "points", "direction": "higher", "run": 49, "value": 91.99, "status": "keep", "description": "run 248 experiment", "timestamp": "2024-06-10T09:00:00Z"}
{"session": "session_2", "metric": "perf_score", "unit": "points", "direction": "higher", "run": 50, "value": 88.29, "status": "crash", "description": "run 249 experiment", "timestamp": "2024-07-10T09:00:00Z"}
{"session": "session_2", "metric": "perf_score", "unit": "points", "direction": "higher", "run": 51, "value": 74.23, "status": "keep", "description": "run 250 experiment", "timestamp": "2024-08-10T09:00:00Z"}
{"session": "session_2", "metric": "perf_score", "unit": "points", "direction": "higher", "run": 52, "value": 63.73, "status": "keep", "description": "run 251 experiment", "timestamp": "2024-09-10T09:00:00Z"}
{"session": "session_2", "metric": "perf_score", "unit": "points", "direction": "higher", "run": 53, "value": 85.68, "status": "keep", "description": "run 252 experiment", "timestamp": "2024-01-10T09:00:00Z"}
{"session": "session_2", "metric": "perf_score", "unit": "points", "direction": "higher", "run": 54, "value": 63.59, "status": "keep", "description": "run 253 experiment", "timestamp": "2024-02-10T09:00:00Z"}
{"session": "session_2", "metric": "perf_score", "unit": "points", "direction": "higher", "run": 55, "value": 94.65, "status": "keep", "description": "run 254 experiment", "timestamp": "2024-03-10T09:00:00Z"}
{"session": "session_2", "metric": "perf_score", "unit": "points", "direction": "higher", "run": 56, "value": 56.92, "status": "keep", "description": "run 255 experiment", "timestamp": "2024-04-10T09:00:00Z"}
{"session": "session_2", "metric": "perf_score", "unit": "points", "direction": "higher", "run": 57, "value": 69.15, "status": "keep", "description": "run 256 experiment", "timestamp": "2024-05-10T09:00:00Z"}
{"session": "session_2", "metric": "perf_score", "unit": "points", "direction": "higher", "run": 58, "value": 85.32, "status": "keep", "description": "run 257 experiment", "timestamp": "2024-06-10T09:00:00Z"}
{"session": "session_2", "metric": "perf_score", "unit": "points", "direction": "higher", "run": 59, "value": 70.74, "status": "keep", "description": "run 258 experiment", "timestamp": "2024-07-10T09:00:00Z"}
{"session": "session_2", "metric": "perf_score", "unit": "points", "direction": "higher", "run": 60, "value": 77.13, "status": "discard", "description": "run 259 experiment", "timestamp": "2024-08-10T09:00:00Z"}
{"session": "session_2", "metric": "perf_score", "unit": "points", "direction": "higher", "run": 61, "value": 53.11, "status": "discard", "description": "run 260 experiment", "timestamp": "2024-09-10T09:00:00Z"}
{"session": "session_2", "metric": "perf_score", "unit": "points", "direction": "higher", "run": 62, "value": 69.47, "status": "crash", "description": "run 261 experiment", "timestamp": "2024-01-10T09:00:00Z"}
{"session": "session_2", "metric": "perf_score", "unit": "points", "direction": "higher", "run": 63, "value": 97.3, "status": "keep", "description": "run 262 experiment", "timestamp": "2024-02-10T09:00:00Z"}
{"session": "session_2", "metric": "perf_score", "unit": "points", "direction": "higher", "run": 64, "value": 92.84, "status": "crash", "description": "run 263 experiment", "timestamp": "2024-03-10T09:00:00Z"}
{"session": "session_2", "metric": "perf_score", "unit": "points", "direction": "higher", "run": 65, "value": 69.02, "status": "keep", "description": "run 264 experiment", "timestamp": "2024-04-10T09:00:00Z"}
{"session": "session_2", "metric": "perf_score", "unit": "points", "direction": "higher", "run": 66, "value": 97.14, "status": "keep", "description": "run 265 experiment", "timestamp": "2024-05-10T09:00:00Z"}
{"session": "session_2", "metric": "perf_score", "unit": "points", "direction": "higher", "run": 67, "value": 87.67, "status": "discard", "description": "run 266 experiment", "timestamp": "2024-06-10T09:00:00Z"}
{"session": "session_2", "metric": "perf_score", "unit": "points", "direction": "higher", "run": 68, "value": 76.91, "status": "crash", "description": "run 267 experiment", "timestamp": "2024-07-10T09:00:00Z"}
{"session": "session_2", "metric": "perf_score", "unit": "points", "direction": "higher", "run": 69, "value": 89.99, "status": "keep", "description": "run 268 experiment", "timestamp": "2024-08-10T09:00:00Z"}
{"session": "session_2", "metric": "perf_score", "unit": "points", "direction": "higher", "run": 70, "value": 74.41, "status": "keep", "description": "run 269 experiment", "timestamp": "2024-09-10T09:00:00Z"}
{"session": "session_2", "metric": "perf_score", "unit": "points", "direction": "higher", "run": 71, "value": 71.79, "status": "keep", "description": "run 270 experiment", "timestamp": "2024-01-10T09:00:00Z"}
{"session": "session_2", "metric": "perf_score", "unit": "points", "direction": "higher", "run": 72, "value": 69.44, "status": "discard", "description": "run 271 experiment", "timestamp": "2024-02-10T09:00:00Z"}
{"session": "session_2", "metric": "perf_score", "unit": "points", "direction": "higher", "run": 73, "value": 86.21, "status": "discard", "description": "run 272 experiment", "timestamp": "2024-03-10T09:00:00Z"}
{"session": "session_2", "metric": "perf_score", "unit": "points", "direction": "higher", "run": 74, "value": 95.98, "status": "crash", "description": "run 273 experiment", "timestamp": "2024-04-10T09:00:00Z"}
{"session": "session_2", "metric": "perf_score", "unit": "points", "direction": "higher", "run": 75, "value": 76.71, "status": "discard", "description": "run 274 experiment", "timestamp": "2024-05-10T09:00:00Z"}
{"session": "session_2", "metric": "perf_score", "unit": "points", "direction": "higher", "run": 76, "value": 79.59, "status": "keep", "description": "run 275 experiment", "timestamp": "2024-06-10T09:00:00Z"}
{"session": "session_2", "metric": "perf_score", "unit": "points", "direction": "higher", "run": 77, "value": 54.2, "status": "discard", "description": "run 276 experiment", "timestamp": "2024-07-10T09:00:00Z"}
{"session": "session_2", "metric": "perf_score", "unit": "points", "direction": "higher", "run": 78, "value": 56.78, "status": "discard", "description": "run 277 experiment", "timestamp": "2024-08-10T09:00:00Z"}
{"session": "session_2", "metric": "perf_score", "unit": "points", "direction": "higher", "run": 79, "value": 59.09, "status": "keep", "description": "run 278 experiment", "timestamp": "2024-09-10T09:00:00Z"}
{"session": "session_2", "metric": "perf_score", "unit": "points", "direction": "higher", "run": 80, "value": 68.96, "status": "keep", "description": "run 279 experiment", "timestamp": "2024-01-10T09:00:00Z"}
{"session": "session_2", "metric": "perf_score", "unit": "points", "direction": "higher", "run": 81, "value": 72.73, "status": "keep", "description": "run 280 experiment", "timestamp": "2024-02-10T09:00:00Z"}
{"session": "session_2", "metric": "perf_score", "unit": "points", "direction": "higher", "run": 82, "value": 88.06, "status": "discard", "description": "run 281 experiment", "timestamp": "2024-03-10T09:00:00Z"}
{"session": "session_2", "metric": "perf_score", "unit": "points", "direction": "higher", "run": 83, "value": 63.91, "status": "discard", "description": "run 282 experiment", "timestamp": "2024-04-10T09:00:00Z"}
{"session": "session_2", "metric": "perf_score", "unit": "points", "direction": "higher", "run": 84, "value": 62.61, "status": "keep", "description": "run 283 experiment", "timestamp": "2024-05-10T09:00:00Z"}
{"session": "session_2", "metric": "perf_score", "unit": "points", "direction": "higher", "run": 85, "value": 73.52, "status": "crash", "description": "run 284 experiment", "timestamp": "2024-06-10T09:00:00Z"}
{"session": "session_2", "metric": "perf_score", "unit": "points", "direction": "higher", "run": 86, "value": 52.6, "status": "keep", "description": "run 285 experiment", "timestamp": "2024-07-10T09:00:00Z"}
{"session": "session_2", "metric": "perf_score", "unit": "points", "direction": "higher", "run": 87, "value": 61.21, "status": "keep", "description": "run 286 experiment", "timestamp": "2024-08-10T09:00:00Z"}
{"session": "session_2", "metric": "perf_score", "unit": "points", "direction": "higher", "run": 88, "value": 89.06, "status": "keep", "description": "run 287 experiment", "timestamp": "2024-09-10T09:00:00Z"}
{"session": "session_2", "metric": "perf_score", "unit": "points", "direction": "higher", "run": 89, "value": 87.71, "status": "keep", "description": "run 288 experiment", "timestamp": "2024-01-10T09:00:00Z"}
{"session": "session_2", "metric": "perf_score", "unit": "points", "direction": "higher", "run": 90, "value": 59.97, "status": "keep", "description": "run 289 experiment", "timestamp": "2024-02-10T09:00:00Z"}
{"session": "session_2", "metric": "perf_score", "unit": "points", "direction": "higher", "run": 91, "value": 81.07, "status": "keep", "description": "run 290 experiment", "timestamp": "2024-03-10T09:00:00Z"}
{"session": "session_2", "metric": "perf_score", "unit": "points", "direction": "higher", "run": 92, "value": 56.31, "status": "keep", "description": "run 291 experiment", "timestamp": "2024-04-10T09:00:00Z"}
{"session": "session_2", "metric": "perf_score", "unit": "points", "direction": "higher", "run": 93, "value": 78.2, "status": "keep", "description": "run 292 experiment", "timestamp": "2024-05-10T09:00:00Z"}
{"session": "session_2", "metric": "perf_score", "unit": "points", "direction": "higher", "run": 94, "value": 73.25, "status": "keep", "description": "run 293 experiment", "timestamp": "2024-06-10T09:00:00Z"}
{"session": "session_2", "metric": "perf_score", "unit": "points", "direction": "higher", "run": 95, "value": 88.34, "status": "keep", "description": "run 294 experiment", "timestamp": "2024-07-10T09:00:00Z"}
{"session": "session_2", "metric": "perf_score", "unit": "points", "direction": "higher", "run": 96, "value": 80.29, "status": "keep", "description": "run 295 experiment", "timestamp": "2024-08-10T09:00:00Z"}
{"session": "session_2", "metric": "perf_score", "unit": "points", "direction": "higher", "run": 97, "value": 88.89, "status": "keep", "description": "run 296 experiment", "timestamp": "2024-09-10T09:00:00Z"}
{"session": "session_2", "metric": "perf_score", "unit": "points", "direction": "higher", "run": 98, "value": 98.24, "status": "keep", "description": "run 297 experiment", "timestamp": "2024-01-10T09:00:00Z"}
{"session": "session_2", "metric": "perf_score", "unit": "points", "direction": "higher", "run": 99, "value": 78.93, "status": "keep", "description": "run 298 experiment", "timestamp": "2024-02-10T09:00:00Z"}
{"session": "session_2", "metric": "perf_score", "unit": "points", "direction": "higher", "run": 100, "value": 78.79, "status": "discard", "description": "run 299 experiment", "timestamp": "2024-03-10T09:00:00Z"}
{"session": "session_3", "metric": "perf_score", "unit": "points", "direction": "higher", "run": 1, "value": 69.83, "status": "keep", "description": "run 300 experiment", "timestamp": "2024-04-10T09:00:00Z"}
{"session": "session_3", "metric": "perf_score", "unit": "points", "direction": "higher", "run": 2, "value": 53.8, "status": "keep", "description": "run 301 experiment", "timestamp": "2024-05-10T09:00:00Z"}
{"session": "session_3", "metric": "perf_score", "unit": "points", "direction": "higher", "run": 3, "value": 55.1, "status": "keep", "description": "run 302 experiment", "timestamp": "2024-06-10T09:00:00Z"}
{"session": "session_3", "metric": "perf_score", "unit": "points", "direction": "higher", "run": 4, "value": 92.51, "status": "crash", "description": "run 303 experiment", "timestamp": "2024-07-10T09:00:00Z"}
{"session": "session_3", "metric": "perf_score", "unit": "points", "direction": "higher", "run": 5, "value": 90.28, "status": "crash", "description": "run 304 experiment", "timestamp": "2024-08-10T09:00:00Z"}
{"session": "session_3", "metric": "perf_score", "unit": "points", "direction": "higher", "run": 6, "value": 89.13, "status": "keep", "description": "run 305 experiment", "timestamp": "2024-09-10T09:00:00Z"}
{"session": "session_3", "metric": "perf_score", "unit": "points", "direction": "higher", "run": 7, "value": 76.64, "status": "keep", "description": "run 306 experiment", "timestamp": "2024-01-10T09:00:00Z"}
{"session": "session_3", "metric": "perf_score", "unit": "points", "direction": "higher", "run": 8, "value": 53.45, "status": "keep", "description": "run 307 experiment", "timestamp": "2024-02-10T09:00:00Z"}
{"session": "session_3", "metric": "perf_score", "unit": "points", "direction": "higher", "run": 9, "value": 50.63, "status": "discard", "description": "run 308 experiment", "timestamp": "2024-03-10T09:00:00Z"}
{"session": "session_3", "metric": "perf_score", "unit": "points", "direction": "higher", "run": 10, "value": 91.12, "status": "keep", "description": "run 309 experiment", "timestamp": "2024-04-10T09:00:00Z"}
{"session": "session_3", "metric": "perf_score", "unit": "points", "direction": "higher", "run": 11, "value": 71.68, "status": "keep", "description": "run 310 experiment", "timestamp": "2024-05-10T09:00:00Z"}
{"session": "session_3", "metric": "perf_score", "unit": "points", "direction": "higher", "run": 12, "value": 81.78, "status": "discard", "description": "run 311 experiment", "timestamp": "2024-06-10T09:00:00Z"}
{"session": "session_3", "metric": "perf_score", "unit": "points", "direction": "higher", "run": 13, "value": 85.37, "status": "discard", "description": "run 312 experiment", "timestamp": "2024-07-10T09:00:00Z"}
{"session": "session_3", "metric": "perf_score", "unit": "points", "direction": "higher", "run": 14, "value": 58.81, "status": "crash", "description": "run 313 experiment", "timestamp": "2024-08-10T09:00:00Z"}
